A knock interrupts her reverie. It is a guardsman reporting that Lady Falyse has requested an audience. Cersei wants to refuse her, but the guardsman says she is in an awful state, so Cersei dresses and goes to see her. Falyse is bruised and sobbing when Cersei arrives. Ser Balman is dead. He challenged Bronn to single combat, figuring he could unhorse the sellsword and finish him while he was stunned. Bronn impaled Balman's horse instead, and his legs were crushed in the fall. When Falyse ran to him, Bronn hit her. He makes Balman confess and then puts his dagger in Balman's eye. He tells Falyse to leave if she does not want the same, and the garrison sided with him. She did not even have time to gather up her clothes, which Bronn said were forfeited to Lollys. Bronn is the lord of Stokeworth now. Cersei asks if Balman named her, and Falyse confirms that he did. Falyse is worried for Lady Tanda, who may be dead already. Cersei gets her drunk and then sends Dorcas to bring Qyburn and Jocelyn to bring food and wine. When Qyburn arrives, Cersei asks if he still needs women for his experiments, which he does, as the puppeteers are used up. Cersei gives him Falyse, and Qyburn takes her away to the black cells. Taena is asleep when she returns. She decides to play with the other woman's breasts, which awakens Taena, who seems to like the attention. She twists Taena's nipples until they hurt, but when Taena protests, Cersei blames the wine. Taena is aroused, and Cersei pleasures her, but gets no joy out of it herself. When Taena tries to return the favor, Cersei rolls out of bed and decides to pretend it never happened.","Trumpets pierce the air at dusk, and Josmyn automatically goes for Jaime's swordbelt. Jaime assures him that outlaws would not blow trumpets and that Ser Daven Lannister, Warden of the West, must have arrived. Jaime comes out of his tent to greet him and leads him into the tent, where Garret has lit the braziers, Lew takes Daven's cloak and Pia prepares some wine. Jaime asks what to expect at Riverrun. Daven reports that the siege is dragging on with neither side engaging the other in combat. Daven is particularly irritated by the Frey contingent. Ser Ryman is usually drunk, his son Edwyn is full of hate, and Lord Emmon keeps trying to tell him how to run the siege and to avoid damaging Riverrun since it is now his seat. He is fed up with Walder Rivers as well, but Ser Perwyn is amiable enough. Daven is to marry a Frey by an agreement made by Lord Tywin. Jaime tells him that Lancel dissolved his marriage and left Castle Darry to pledge his sword to the Faith. Daven says that Ser Kevan passed through on his way back west, and he wishes Kevan had stayed, as the Freys would not vex him so. Ryman has raised a gibbet and puts a noose around Edmure's neck every day and threatens to hang him. Ser Brynden is not swayed, so every night he is taken down again. Roslin is pregnant with Edmure's child, and Emmon wants Edmure executed immediately. Lord Gawen is with the army as well, and beseeches him to make sure Edmure is not hanged, as his wife and children are in the castle and he fears they will be killed in retaliation. The castle is encircled by three camps. Ser Ryman commands the Freys north of the Tumblestone, Lord Emmon is with Ser Forley and the remains of Jaime's host from the original siege as well as the Riverlords that have returned to the fold south of the Red Fork, and Daven himself is between the rivers and faces the main gates. There is also a boom across the Red Fork downstream from Riverrun to prevent resupply by water manned by Ser Manfryd Yew and Ser Raynard Ruttiger. Starving out the castle is not an option, as it is well provisioned and many of Daven's foraging parties do not return thanks to outlaws and Stark loyalists. Fires are being lit all around them every night, and many towns now light fires in worship of the Lord of Light. Jaime asks if there has been a parlay, and Daven replies that Ryman rode up to the gates once making threats, and Ser Brynden sent him on his way by putting an arrow in the rump of his horse. Jaime means to try again and offer generous terms so that he does not have to take up arms against House Tully.
Jaime goes out among the tents to mingle with the men, who have always been comfortable around him. He gives a young knight advice on how to defend against a warhammer and watches as Raff and another man hoisting half-naked washerwomen on their shoulders to joust with rolled up cloaks. Finally, he finds Ser Ilyn and goes off to train with him. Once again, it ends with Jaime bruised and humiliated. The next day, they reach the environs of Riverrun. Jaime can see the camps surrounding it. Ryman's is the biggest and most disorganized. Daven explains that he has given his men whores, cock fights, and boar baiting to keep them entertained and also has a singer. Lady Genna brought Whitesmile Wat with her from Lannisport, so Ryman had to have a singer too.1 Jaime beholds the castle, which still flies Tully and Stark banners, and thinks of the first time he went to the castle with Sumner Crakehall. Hoster had tried to interest him in Lysa, but all Jaime had cared about was talking to Brynden, who had gained renown through his service in the War of the Ninepenny Kings. They have to pass through Emmon's camp on the way to Daven's. Jaime sees the banners of Lychester, Vance, Roote, Goodbrook, Smallwood, and Piper, but is disturbed not to see any from Mallister, Bracken, Ryger, or Paege, all of which supposedly renewed their fealty. The Brackens are busy fighting the Blackwoods, but he feels the others should be there. He feels the siege must end quickly; else the others may be tempted to renew the fighting. As they reach Daven's camp, Ser Kennos sounds his horn to announce their arrival, and Ser Dermot and Ser Hugo go before Jaime carrying his standards. Jaime sees two completed siege towers and a ram, with a third tower under construction. He orders Ser Addam to inspect the perimeter defenses and sends Ser Jon with a peace banner to request a parlay.
Jaime sets up his tent, and soon his Aunt Genna comes to greet him with Ser Emmon in tow. Genna offers condolences for Tywin's death and is shocked to learn that Tyrion really did do the deed. She asks after Cleos as well, and Jaime lies that he scattered the outlaws before he died. Emmon brings up the siege engines and tells Jaime that Riverrun must not be harmed. Emmon says he means to be fair with his new vassals and is not pleased when Jaime points out that he was only granted the castle and Lord Petyr is the Lord Paramount of the Trident. Genna is disappointed that they were granted Riverrun instead of Darry, as Cleos's wife, Jeyne, is a Darry and the male line is extinguished unlike the Tully line. She thinks Kevan should have been granted Riverrun instead and laments that Tywin never consulted with her. Jaime tells her about Lancel, but she is not concerned, as Kevan can marry Martyn to Amerei and still keep the castle. She is furious with Cersei though for reviving the militant orders of the Faith. After Aegon I died, there was a large rebellion against Targaryen rule that the Faith was right in the middle of. Maegor ended up putting a bounty of one dragon on each Warrior's Son and one silver stag for each Poor Fellow. The rebellion only ended after Maegor's death when Jaehaerys agreed to pardon all those who put down their swords. Genna asks what Jaime means to do, and he says he will offer terms. She does not think that will work and thinks they should execute Edmure. She tells Jaime to do what Tywin would have done. Jaime asks if Genna loved Tywin. She tells him that she was seven when Lord Tytos betrothed her to Emmon. It was a poor match, but Tytos was his father's thirdborn son and was always looking to please his elders. He made the match just to please Lord Walder. The announcement was made before half the west. Lady Ellyn laughed and Lord Reyne stormed out of the hall angrily. No one else dared speak against the match save Tywin, a boy of ten. He was her big brother and protected her; now there is no one to protect them. Jaime says he left a son, and she replies that is what she fears most. Jaime has some of Tygett in him, some of Gerion, and even some of Kevan, but Tyrion was his only true son.","Arya wakes up and gets out of the bed she shares with Brusco's daughters, Talea and Brea. The three of them get dressed and then pile onto Brusco's boat. As the boat wends its way to the fishmarket, Arya tries to recall her dream from the night before. She thinks she had the wolf dream again, which still comes to her often. She also frequently dreams she is searching for her mother in a rainy wasteland, but a monster with a dog's head always prevents Arya from finding her. Once they arrive at the market, Brusco examines the morning catch and instructs the others on which ones to haul back to his boat. Once this is finished, they cast off again. Arya always keeps a lookout for new things she can learn, as she is commanded to return to the temple three days out of every thirty and tell the Kindly Man three new things she learned since last she left the temple. For example, one evening she tells him she knows what Blind Beqqo puts in his hot sauce, that the mummers at the Blue Lantern are performing The Lord of Woeful Countenance and the mummers at the Ship are answering with Seven Drunken Oarsmen, and that the bookseller Lotho Lornel sleeps in the house of Captain Moredo Prestayn when the captain is at sea. Afterwards, he always asks who she is. She answers ""no one,"" but the Kindly Man knows she considers herself Cat of the canals. Three days of every thirty, she must serve at the temple, the rest of the time she works for Brusco.
When the boat returns to the house, Arya helps Brusco's sons and daughters unload the shellfish. Afterwards, Brusco divides them between Arya, Talea, and Brea, and tells them not to return until all the shellfish are sold. Brea sells hers at the Purple Harbor, Talea plies the Moon Pool area and the Isle of the Gods, and Arya sells hers at Ragman's harbor. Arya loves the sights, sounds and smells of the harbor, and enjoys mingling with the sailors too. She often uses insulting words and phrases, which occasionally makes someone angry, but Red Roggo, a frequent patron of the Happy Port, once showed her how to use a knife and carry it up her sleeve. Other denizens of the docks have taught her other things as well. Gyloro Dothare taught her filthy songs, his brother Gyleno told her the best place to catch eels, the mummers of the Ship instructed her in acting and parts of speeches from plays such as The Song of the Rhoyne, The Conqueror's Two Wives, and The Merchant's Lusty Lady, and Cossomo the Conjuror taught her sleight of hand. Quill, the makeup artist for the mummers of the Ship, wanted to instruct her in kissing, but Tagganaro quickly put a stop to that.
Arya sells her clams on five new ships that have just docked; a carrack called the Brazen Monkey, an Ibbanese whaler, two battered cogs from Pentos, and a galley from Volantis. The mate on the galley tells her that the ship captain had been killed when the pirate Salladhor Saan tried to board them near the Stepstones from Valyrian and Old Mother's Son. The Brazen Monkey is out of Gulltown, and Arya tells a sailor named Wat where to find the best whores. Many of the dockside whores in Braavos can be dangerous. S'vrone has robbed and killed at least a dozen men, the Drunken Daughter gets nasty when drunk, and Canker Jeyne is really a man. Meralyn runs the Happy Port and has a big heart, and her girls, Bethany, the Sailor's Wife, Yna, Lanna, and Assadora are all nice as well. Another lad asks about getting a courtesan, but only the highborn can afford them. They are beautiful women much sought after as lovers. They each have their own barge and keep an air of mystery about themselves. Some of the more famous courtesans include the Poetess, the Moonshadow, the Merling Queen, and the Veiled Lady, but the most famous and beautiful of them all is the Black Pearl. She is reputedly descended from Targaryen stock. The original Black Pearl, also named Bellegere like the current one, was reputedly a pirate queen that was taken as a lover by a Westerosi prince. Her daughter became the first Black Pearl courtesan, and each daughter has been the Black Pearl in turn until the present day. The sailors give Arya news from Gulltown, including Lysa's death. As Arya continues down the docks, she comes across Taggnaro with his seal, Casso. He asks her to come and work for him, as he has been looking for a new cutpurse since Little Narbo got stabbed in the hand by the Drunken Daughter.
Arya ends at the Happy Port, where she sells to several mummers from the Ship, including Joss the Gloom and Myrmello. They are down two actors, as Quence caught Allaquo in bed with another member of the troop, Sloey, and both men left. When she enters the brothel, she is angered to see Dareon there, singing a love song to Merry, Yna, and Lanna. She is angry that he is in Braavos flirting with all the girls because he is a man of the Night's Watch who has forsworn his duty. The Sailor's Wife comes up and says he is fair to look upon, but Arya thinks he has a foul heart. The Sailor's Wife married him once, as she only takes those who ""marry"" her. There are often three or four weddings a night. Often, a drunken red priest named Ezzelyno performs the ceremony, or Eustace, who was once a septon before being defrocked. If neither are available, one of the mummers from the ship performs the service. Her real husband was lost at sea when she was but a teenager, and she prays constantly for his return. The sun is going down by the time she leaves. She walks for awhile with Dareon, who is going to play at another inn. As they enter a small back alley, she kills him. She returns to Brusco's house with the empty barrow and Dareon's boots. It is one of the nights she is to serve at the temple, so she takes her leave. After she arrives, she bathes, changes, and gets some food from Umma before going to help the waif. At one point as they work, the waif slaps her for biting her lip while thinking like Arya Stark and asks who she is. Arya replies she is no one and angrily asks who the waif is. Surprisingly, she tells her story. She was the only child of a noble and his first wife. When the woman died, her father remarried when he was six. When the second wife had a child, she tried to poison the waif so her child would inherit. The poison did not kill her, but left her in her deformed state. Her father offered her and two-thirds of his wealth to the Many-Faced God, and the Faceless Men killed his wife. The Kindly Man comes and asks her what she learned. She tells him about Narbo being stabbed, the fight between Quence and Alaquo, and how she killed Dareon. The Kindly Man has the waif bring Arya some warm milk, which Arya drinks despite the burnt and bitter aftertaste. When she wakes up the next morning, she is blind.","Sam gives a funerary service for Maester Aemon aboard the Cinnamon Wind somewhere off the coast of Dorne. Gilly is there, as is the crew, including the captain, Quhuru Mo, his daughter, Kojja, who translates Sam's words, and the mate, Xhondo. Sam breaks down at the end of his speech, and a cask of rum is brought out so the crew may celebrate the recently departed. For a while, it had seemed Aemon may recover. When Sam had returned to their room in Braavos with what Xhondo told him about the dragons, Maester Aemon returned to his old self for a time. He said that the prophecies had misled them all. They were looking for a prince, but as Barth had reasoned long ago, dragons are neither male nor female, so the gender is unimportant. Aemon always believed Rhaegar was the one, with the smoke of the prophecy being the fire that devoured Summerhall and the salt representing the tears for those lost. Rhaegar agreed with him at first, but later thought it must be his son Aegon, as a comet was seen above King's Landing the night Aegon was conceived, and Rhaegar was certain that the bleeding star had to be a comet. The dragons prove that it must be Daenerys.
Aemon was so determined to reach Daenerys that he actually walked onto the deck of the Cinnamon Wind under his own strength. Passage had cost them nearly everything they had left. Sam gave his sword to Xhondo as restitution for his ruined cloak, and the old books bound for the Citadel served as payment for their passage. Quhuru means to still give them to the Citadel, but for a price. He had also wanted Aemon's chain, but he was finally convinced to leave it be. All Sam has left are his clothes, boots, and the broken horn Jon found near the Fist of the First Men. When the ship reached Pentos, Maester Aemon was still strong and came up on deck to have Sam describe the city to him, but by the time they reached Tyrosh, his wits and strength were failing again. He began to implore Sam to make the maesters understand the great danger that is coming from the North and to tell them of Daenerys. Melisandre has misread the signs. He had hoped it could be Stannis, as his father's mother was Aegon V's daughter, Rhaelle, but the Lightbringer Stannis carries is a sure forgery. He tells Sam they must send Daenerys a maester so she can be counseled and protected. He becomes delirious soon after and begins to rave more and more. He speaks of dreams, but never names the dreamer,1 of a glass candle that cannot be lit,2 and of eggs that would not hatch3 He also says that the sphinx was the riddle, not the riddler, and asks Sam to read him passages from the writings of Septon Barth, whose works had been ordered burned by Baelor I. One day, he wakes up weeping, saying that the dragon must have three heads but he is too weak. By the time they reached the Stepstones, Aemon could barely remember Sam's name.
Sam laments to Gilly that Aemon might have lived another ten years on the Wall, but Gilly points out that Melisandre would have burned him. Gilly wants to name the baby Maester when he is two, but Sam says that is not a name and he should be called Aemon. Gilly agrees. Sam asks where the baby is, and Gilly says Kojja has her. The baby has become the darling of the female crew members, and Gilly has grown to trust and admire Kojja. The rum lowers Gilly's inhibitions, and she tells Sam she likes him. They grow drunk on the rum, go below decks, and have sex. Sam wakes up the next morning with a hangover to the sound of Xhondo exhorting him to work; the books had not been enough to pay the whole passage, so Sam and Gilly have been working for their passage. He avoids Gilly all day, ashamed of breaking his vow. In the end, Xhondo corners him and brings him to Kojja. She tells Sam that he can go to Gilly or walk to Oldtown. He protests that he took a vow, and Kojja tells him that Gilly knows this. She has lost everything she has known, and only wants Sam for a little while. Sam does go to her then and tells her they cannot be together. Gilly tells him that the trees watch over them, but right now, they are surrounded only by water.","Cersei has an audience with Aurane, freshly arrived on the evening tide on Sweet Cersei. He reports that Dragonstone has fallen. Cersei is pleased and releases Lord Paxter to return to the Arbor. The ironmen have been raiding up and down the Mander and overwhelmed the dozen or so ships Lord Paxter left at the Arbor. They have even made moves towards Oldtown. The battle at Dragonstone was a bloodbath, however, with a thousand dead, most of them on the Lannister side. Ser Loras is seriously wounded and expected to die. Cersei has Dorcas bring refreshments as Aurane tells her the whole tale. Cersei, pleased with this turn of events, goes to tell Margaery herself. Margaery is with her cousins, Alla, Megga, and Elinor, when Cersei arrives. She tells how Lord Paxter had been digging a tunnel under the walls, but Loras found the progress too slow and insisted on a frontal assault after the castellan, Rolland Storm, refused to settle the matter in single combat. Loras was the first through the breach, taking a quarrel through the thigh, another through the shoulder, and a mace blow that broke several ribs. Finally, as Loras led the assault on the inner wall, he was doused with boiling oil. Margaery, grief stricken, throws Cersei out.
That night, as Jocelyn lays beside her in bed in place of Taena, who did not come as usual, Cersei thinks of how pleased her father would be by what she has accomplished. Taena comes the next morning, telling Cersei that she was up all night with Margaery and her ladies talking about Loras. Margaery remains convinced that he will not die and she plans to send her own maester to tend to him. Ser Osmund enters to report that four have come claiming to have information about Tyrion, one of them with a head. The man with the head is Tyroshi, but when he opens the box bearing the head, Cersei sees right away that it is a fake. Furious, she orders Ser Meryn to take him to Qyburn. The other three informers have no good information either. With the audiences over, Cersei goes to court accompanied by Taena. Jalabhar Xho is the first to petition, asking as he always does for men to regain the Red Flower Vale. Cersei denies him and says maybe next year they can help, just as Robert always did. Lord Hallyne comes next, asking leave to hatch any dragon eggs found on Dragonstone. Cersei puts him off, as every attempt to hatch such eggs has ended in death, disaster, or disgrace. Next a group of merchants come forward, complaining that the Iron Bank is demanding repayment of all outstanding loans and refusing to issue new ones. Cersei is fed up with the bank and thinks she must start her own, but for now, all she can do is tell the merchants to pay up. Next a delegation from the Faith attends, Septon Raynard escorted by six members of the Warrior's Sons, including Lancel. Qyburn has reported that over a hundred knights have already joined the reconstituted Warrior's Sons. Although most of them are former household knights and hedge knights, Lancel is not the only man of higher station to pledge himself to the Faith. Cersei is angry, as she had summoned the High Septon himself, but Raynard says he is busy. Cersei summoned him because he and his followers are preaching against the brothels, and the owners have complained. Cersei orders the High Septon to halt this practice at once. Pycelle comes next, in place of Lord Gyles, who is too ill to leave his bed. Pycelle reports that Gyles is coughing up bits of lung now, and it will not be long before he dies. Cersei says that he has never died from his cough before, and she thinks someone is trying to kill him.
