Brienne is surprised when the rider turns out not to be Shadrich, but a boy instead, specifically the boy she bumped into at Duskendale. As he turns down a road, she realizes he was at Rosby as well and must be following her. He passes by the castle, so she decides to ambush him by sneaking up behind him to give his horse a whack with her tourney sword. The boy falls and lands in the mud. He manages to stutter out that his name is Podrick Payne. Brienne feels sympathy for him and remembers the day Ser Ronnet Connington had come to see her at Evenfall when she was twelve and he eighteen. He was bringing her a rose and all she had to do was welcome him to the castle, but she was so nervous she could not get the words out. Brienne demands to know why Podrick is following her, and he explains it is because Brella told him she was looking for Sansa. He figures Sansa will lead him to Tyrion. He still considers himself Tyrion's squire and is dejected that he was left behind.","Sansa and the rest of the Eyrie are plagued by Marillion's constant singing in the sky cells. Sansa asks Lord Petyr to make him stop, but Littlefinger says he promised the singer that he could sing. It will be over soon, however, as Lord Nestor is coming to make inquiries into Lady Lysa's demise. Marillion has agreed to confess before the lord. Sansa is afraid that Marillion may tell the truth, but Petyr says it will not matter because it would be their word against his, and Petyr has prepared an incentive for Lord Nestor to side with him. Sansa will have to tell her side of the story too, which frightens her, but Petyr says the lie is necessary to save them. She already lied to Lord Robert about what happened, but that was different because he was a little boy that had to be protected from the truth for his own sake. Sansa does not fully trust Petyr, but is willing to go along for the moment as he did save her life. Petyr's devious, lying side worries her, but everyone else she cares about is dead so far as she knows and she is isolated and friendless save for him. That night, she is unable to sleep for long due to Marillion's continued singing.
Lord Nestor arrives late in the afternoon with his son, Ser Albar, a dozen knights, and twenty men-at-arms. Lord Petyr, Sansa, and Maester Colemon greet him. After the introductions are over, Petyr sends Sansa to fetch Robert. She finds him in his chambers being dressed by two serving women, Gretchel and Maddy. He has been crying and is a mess. Sansa orders a washbasin brought for Robert, whom she addresses as Sweetrobin. Robert did not sleep well the night before because of the singing and because his door was locked. Sansa actually ordered Lothor to lock the door because Robert has taken to sleeping with her, often nuzzling her breasts or wetting the bed. Sansa and Maddy take Lord Robert to the great hall, where he receives Lord Nestor. Nestor asks after Lysa, and Robert says Marillion killed her. Ser Marwyn Belmore, Lysa's captain of the guard before Petyr replaced him with Lothor, asks Robert if he saw the deed himself, and the boy responds that Petyr and Alayne did. Sansa recounts the tale. Part way through, Robert begins shaking violently while demanding to make Marillion fly, and Lothor is forced to restrain him. When the episode is over, Lothor and Colemon remove Robert from the hall. Lord Nestor accepts the story, particularly since Marillion made many enemies by mocking various nobles and then running to Lysa for protection who showered him with gifts. Mord escorts Marillion, now blind, into the hall, who confesses to the murder. He says that he killed her out of jealous love when he learned she was pregnant with Petyr's child. Mord leads him back out, and Sansa is astonished to see the jailor has gold teeth.1 Petyr offers rooms and refreshments for his guests and has Oswell lead Lord Nestor's retainers away while he asks Lord Nestor to attend him in private.
Sansa serves Lords Petyr and Nestor in the solar. Nestor informs Petyr that Lord Yohn is on his way to question Marillion and that he will be coming in force with a group including Ser Symond Templeton, Lady Anya Waynwood, Lord Benedar Belmore, Lord Gilwood Hunter, Lord Horton Redfort, Ser Samwell Stone, Lord Uthor Tollett, Ser Damon Shett, Lord Royce Coldwater, and Ser Lyn Corbray. Lord Yohn means to remove Petyr as Lord Protector. Nestor wonders what Petyr will do, and Petyr presents him a decree naming Nestor's branch of House Royce Keepers of the Gates of the Moon in perpetuity. Petyr signed the decree himself, claiming that Lysa was murdered before she could do so. Lord Nestor calls this a bold move that will make some unhappy. The Gates were raised by House Arryn as a summer seat when its members still wore the Falcon Crown and ruled as kings of the Vale, and it remains an Arryn possession. Lord Jon served as Keeper of the Gates when his father was lord, and Jon's brother Ronnel and cousin Denys later both served in that capacity as well. Lord Nestor has long coveted the castle, however, as he fells he deserves it as a reward for ruling the Vale while Lord Jon served as Hand.
Much later, after Lord Nestor takes his leave, Petyr asks Sansa if she realizes what he did. She says that he gave Nestor the Gates of the Moon in return for his support. Petyr admits it, stating that if he had tried to bribe Nestor outright he would be rebuffed, but that he wanted to be a lord in truth and bequeath something to his son. Sansa realizes that Petyr signed it himself instead of having Robert sign so that if he dies, Nestor's claim will be called into question. Petyr is pleased that she sees the ploy and compliments her as his daughter. She protests, but Petyr says she must think of herself as his daughter in her heart or the deception could fail. Sansa is not sure she wants to go that far, but realizes that this is what Petyr wants and lies that she will. That night, Robert comes to her bed to sleep. He asks if Sansa is his mother now, and she replies that she is, figuring that the lie is kindly meant and therefore of no harm.","Asha sits in the great hall of Ten Towers looking over the assembled captains and crews celebrating. She is disheartened that so few have come. Each lord has hung his banner in the hall, and only Botley, Stonetree, Volmark, and Myre are represented along with the personal sigils of several Harlaws, Sigfryd, Hotho, Boremund, and Ser Harras. Asha notes that her uncle, Lord Rodrik Harlaw, is not present and asks the steward, Three-Tooth, if he has gone to his books. Three-Tooth answers in the affirmative and that Lord Tristifer Botley is with him. Asha wonders why Tristifer is lord instead of Lord Sawane's eldest son, Harren, and is uncomfortable at the thought of speaking to him. Asha next asks after her mother, who Three-Tooth informs her is abed in the Widow's Tower, so named because Rodrik's sister Gwynesse moved in to mourn after her husband was lost off Fair Isle during Greyjoy's Rebellion and has been there ever since, always complaining that Ten Towers should be hers because she is seven years older than Rodrik. Asha's mother, Alannys, is frail and sickly and will probably not last much longer. The last time Asha saw her was before she left for the campaign in the North, and she had been heartbroken when Asha arrived without Theon. She dreads having to tell her mother that he is dead. Asha tells Three-Tooth to see to her captives, Sybelle Glover and her children, Gawen and Erena. Erena is sick, and Asha warns Three-Tooth to make sure the baby is cared for and does not die.
Asha is pleased to be back at Ten Towers, which always felt more like home than Pyke. It is the newest castle in the Iron Islands, raised by Lord Rodrik's grandfather, Theomore Harlaw, after three of his sons died in infancy, which Lord Theomore blamed on the flooded cellars, damp stones, and festering nitre of Harlaw Hall. The same changeable nature that led the lord to have six wives also led the design to change over time, making it appear like ten castles squashed together. The thickest tower is the Book Tower, which Asha climbs to see her uncle, Lord Rodrik, who is reading. He is almost never found without a book, even on the deck of his longship, Sea Song, and while pronouncing judgments in the great hall. At the moment, he is reading Archmaester Marwyn's Book of Lost Books, in which the author claims to have found three pages of Signs and Portents, a book of visions written down by the daughter of Aenar Targaryen before the Doom of Valyria.
Rodrik is pleased Asha has finally arrived, as she had been expected earlier. Asha explains she was delayed because the winds were against them and because Lady Sybelle's milk dried up on the voyage and she needed to find a wet nurse. Her men could only find a goat instead, and this is why the baby is not doing well. Rodrik informs her that she is come too late. Asha idly turns the pages of the nearest book, an account of King Maegor's war against the Poor Fellows, as they talk of family. Asha is convinced Balon was murdered, and Rodrik agrees that the timing of Euron's return cannot be a coincidence. Asha asks where all the ironmen are, as she means to drive Euron from the Seastone Chair. Rodrik tells her that Harlaw, Stonetree, and Volmark have gathered along with some Myres. These are all Harlaw houses, and Asha wonders where the houses of the other islands are. Rodrik says that Lord Baelor Blacktyde came to consult him and then sailed for Old Wyk. Asha is confused, and Rodrik reveals that Aeron called a kingsmoot. Asha is amused at first, but Rodrik says that other priests such as Blind Beron Blacktyde, Tarle the Thrice-Drowned, and the Old Grey Gull have taken up Aeron's call, and the captains are gathering at Old Wyk. Rodrik is worried, because according to Haereg's History of the Ironborn, the last kingsmoot ended with Urron of Orkmont letting axemen loose among the attendees, after which House Greyiron held the throne unopposed for one thousand years until the Andals arrived. There has not been a kingsmoot in four thousand years according to Haereg's account, although Maester Denestan argued in Questions that these events happened only two thousand years ago.
Rodrik feels the kingsmoot is a terrible idea, as he has always felt that talk of kings is folly and the old way is dead. He feels that the ironmen should side with one of the warring kings in exchange for new lands. Asha feels she must go to claim the throne, but Rodrik argues that she will never be elected because she is a woman. Asha will not be deterred because as long as Rodrik supports her, she will have Harlaw, which is the richest and most populous of the iron islands. Rodrik counters that all captains are equal in the kingsmoot, and he cannot order them to support her claim. He entreats her to think of her mother, who spent her final years on Pyke wandering the castle at night looking for her dead sons. Rodrik asks after Theon. Asha says he must be dead, but that Winterfell was a mess when she arrived after the sack and it was impossible to identify all the body parts in the castle. In a final attempt to dissuade her from attending the kingsmoot, Rodrik says that if she stays he will name her his heir to Ten Towers since both his sons died off Fair Isle and he is unlikely to have any more. Asha believes that his cousins would never allow it, as Boremund has three sons to think of, Sigfryd has grandsons, and Hotho has ambitions and they all mean to follow Rodrik. Rodrik counters that Ser Harras will rule Harlaw after him, but Asha can have the castle. Asha turns him down and leaves.
Out in the yard, Asha is stopped by Tristifer. She asks if it is true that he is now Lord Botley, and he explains that his elder brother was killed by crannogmen at Moat Cailin, making him the heir, but that he is lord in name only since Euron dispossessed him of his lands. Half were given to Waldon Wynch, the first lord to swear fealty to Euron, while the other half are now ruled by Tristifer's uncle, Germund. Euron bought both men with a portion of a vast hoard of treasure he brought with him. Asha promises to restore Tristifer's lands when she is queen, but he cares for naught but her. He had been fostered at Pyke along with four other boys after Maron and Rodrik died to replace the children lost to war and soon took a fancy to Asha. She returned his favor at first, but began to lose interest when he began to speak of how many children she would bear him, since she wanted to be a warrior. Soon after, Maester Qalen discovered them together, and Tristifer was sent away to foster with Lord Baelor Blacktyde. He had tried to write her, but Maester Joseran refused to send the letters. Tristifer professes his continuing adoration, which bothers Asha since she no longer has any feelings for him. She asks if he will speak for her at the kingsmoot, and he responds that while he will, he sees the idea as folly. He believes that Euron means to come to power through blood and treachery and that he has gathered many captains, including Alyn Orkwood of Orkmont, Pinchface Jon Myre, Left-Hand Lucas Codd, Harren Half-Hoare, the Red Oarsman, Kemmet Pyke the Bastard, Rodrik Freeborn, and Torwold Browntooth. She points out that they are men of small account and not important. Tristifer says he will go with her and be his wife as well, as her mother has already given her consent. Asha says he does not really want her, but he claims he loves her and needs her and they were meant to be together. She tells him she has had many men, which shocks him but does not weaken his resolve. He finally grabs her arm, causing her to put her dirk to his throat. She reminds him she is his queen not his wife and stalks away.","Jocelyn dresses Cersei for Tommen's wedding. Cersei is furious that she has to go through with the ceremony, but Tommen is not yet secure enough on his throne that she can offend Highgarden. She orders eggs for breakfast, but after breaking the first and discovering it contains a half-formed chick, she has Senelle bring wine instead. Jaime arrives and informs her of the security precautions that will be in place at the wedding. Men will watch as every dish is prepared and goldcloaks will escort the dishes to the hall. Ser Boros will taste every dish, and Maester Ballabar will be there with purges and antidotes for twenty common poisons. Cersei is still worried for Tommen's safety and thinks back to being in a tent with a girl named Melara, now long dead, as an old hag makes threats. She fears that Tyrion may be waiting in the walls for an opportunity to slit Tommen's throat. She orders Jaime to stay in his room all night long over his protests. He will be sharing a bed with Margaery that night. Lady Olenna and Lady Alerie both wanted them to share a bed from that point forward, but Cersei would only consent to the one night. Cersei tells Jaime she wants eyes in the room that night and Jaime wonders why, as Tommen is far too young to conceive. Cersei retorts that Lord Ossifer Plumm was ""much too dead,"" but that did not stop him fathering a child, which just leaves Jaime confused.1
Jaime asks if she still means to burn the Tower of the Hand, and Cersei replies she will after the feast. She hopes that the fire will smoke out Tyrion, Varys, and Rugen, which Jaime thinks is ridiculous. He had men exploring the tower bit by bit knocking down walls and ripping up floors, and while they found fifty or so passages, there has been no sign of any people. Some passages were so small that stableboys had to be used to explore them. One got stuck and had to be pulled out shrieking while another fell and broke his legs. Two guardsmen also disappeared while exploring a side tunnel. Cersei wants to build a new palace beyond the river after the war is over. Jamie compares her use of wildfire to burn the tower akin to something Aerys might do, and Cersei thinks to herself that Jaime is a stranger to her now and wonders why she ever loved him.
The wedding ceremony is a small gathering compared to Joffrey's, with fewer than a hundred guests looking on in the sept of the Red Keep. As Tommen and Margaery exchange vows, Cersei looks over at Lord Mace, Lady Alerie, and Lady Olenna and thinks of getting revenge for this travesty of a wedding. Afterwards, many of the guests offer congratulations, including Ser Lyle, Lord Gyles, Lord Paxter, Lord Mace, and Grand Maester Pycelle. Ser Kevan is among the last to come forward. He is leaving after the wedding for Castle Darry. Ser Harwyn has cleared the outlaws out of the castle and Lancel's bride, Amerei, waits for him there. The area is still not safe, however, as the remnants of the Brave Companions are still loose, and Lord Beric is hanging Freys. Kevan asks if the rumors about Sandor joining Beric are true. Cersei is surprised he heard about that and tells him that reports claim that he led a raid on Saltpans, killing a dozen men and raping a girl of twelve.2 Cersei tells Kevan that he is just the person to deal with Sandor. She has named Damion castellan of the Rock and Daven as Warden of the West to snub Kevan. Kevan stalks away, and Jaime escorts Cersei to the small hall for the wedding feast.
Cersei is cross at the Tyrells and Olenna in particular, but Jaime reassures her that Olenna is leaving the next day. Lord Mace is taking half his strength to besiege Storm's End, while the other half joins Garlan to make good his claim to Brightwater Keep. When Cersei enters the hall, Margaery embraces her. Cersei hates the girl for not mourning Joffrey and wedding Tommen so quickly and thinks she only wants the crown. She has to restrain herself from slapping Margaery. The feast is only a modest seven courses. Moon Boy and Butterbumps entertain while musicians play. Only one singer is present this time, a favorite of Margaery's called Wat the Blue Bard. Cersei looks at Olenna and thinks back to Maggy the Frog and her tent. The crone had sucked blood from Cersei's finger and prophesied that she would be queen until another comes, younger and more beautiful, to cast her down. Cersei worries it could be Margaery. Jaime is nervous during the dinner despite the fact that Ser Osmund and Ser Meryn are guarding the doors, Ser Balon stands beside Tommen, and Ser Loras stands by Margaery. At one point, Tommen begins to cough, scaring Cersei, but he was just choking on some wine. Cersei retreats from the hall and begins to weep.
Lady Taena follows Cersei out of the hall and offers the queen comfort. She also brings news that Senelle is a Tyrell spy and reports to Alla, Elinor, and Megga for Margaery. Cersei says Taena will be rewarded and returns to the hall. Jaime tries to comfort her when she returns, but she is not assuaged. She looks over the assembled, including Lord Mace, Lord Paxter, Lord Mathis, Kevan, Lancel, Pycelle, and Senelle, who is serving, and thinks that she has no one she can rely on and needs to surround Tommen with her own people. Tommen dances with his new wife as well as Alla, Elinor, and Megga. Jaime asks Cersei for a dance as well, but she refuses and insults him. She watches the Tyrell girls as Margaery dances with Alla, Megga dances with Ser Tallad, and Elinor shares a cup of wine with Aurane Waters. As Tommen returns to his seat, Cersei sees Kevan talking to Garlan and wonders if they are plotting together. Cersei announces that it is time to go outside and light the Tower of the Hand. At a signal from Hallyne, a group of archers launch flaming arrows at the tower, which ignites the wildfire already placed within. As the tower burns, Cersei thinks back on all the Hands she knew, Owen Merryweather, Jon Connington, Qarlton Chelsted, Jon Arryn, Eddard Stark, Tyrion, and Tywin and thinks that they are all gone now with their scheming and betrayals and that she now rules the kingdom. Lady Olenna, flanked by Erryk and Arryk says it is time for the king and queen to go to bed. Jaime asks if Cersei will retire as well, but she wants to watch the tower burn.","Ser Arys walks through the streets of Sunspear in disguise. He does not want to be recognized because a fortnight ago the mob killed a trader because he was from King's Landing. He finds his Dornish clothes comfortable, but his father would have been horrified to see him wearing them. His house proudly recalls Lord Edgerran the Open-Handed, seated with one hundred Dornish heads at his feet, the Three Leaves pierced by Dornish spears in the Prince's Pass as Alester sounded his warhorn with his dying breath, and Ser Olyvar the Green Oak of the Kingsguard, who died defending King Daeron I. The people of Sunspear knew his history too and eyed him with hostility even before Prince Oberyn was killed. Afterwards it was even worse, although the streets have been quieter since Prince Doran confined the Sand Snakes. Still, he knows that if he wears his white cloak in the city, it will mean his death. He hopes that ""she"" will understand and laments the weakness of men, thinking of King Baelor the Blessed, who would fast to the point of fainting in an attempt to tame his lusts.
Arys left Myrcella playing a game from Volantis called Cyvasse with Trystane. The game had come from Volantis via the Planky Town, and the entire Dornish court has gone crazy for it. Myrcella learned the game to spend more time with Trystane, with whom she has become fast friends. He is concerned for her, but he left two guards on the door, and Septa Eglantine and Trystane's sworn shield, Ser Gascoyne of the Greenblood, are with them as well. Just a few days before, Doran had an audience with Arys and promised that he would keep Myrcella safe. With Sunspear so inflamed, however, he did not believe she could be kept safe in the castle. He said that he meant to return to the Water Gardens soon and take Myrcella with him so she will be safe. The Gardens were built by Prince Maron Martell for his Targaryen bride,1 to mark Dorne's entry into the Seven Kingdoms, and Doran considers them his sanctuary. He wants to bring Myrcella there in strict secrecy so that no one will know where she is.
He reaches his destination, where Princess Arianne waits for him, naked. Arys had only come to tell her that he was leaving the city, but he cannot resist her allure. They have sex, after which Arys feels great shame, as he always does after having sex with her because it is a betrayal of his vows. In the ten years since he joined the Kingsguard, he had never broken them before meeting Arianne. He has come to convince her that now that he is leaving with Myrcella for the Water Gardens soon, they must end their relationship. Arianne wants him to stay with her, but Arys feels he must end it for the sake of both their honors. She tries to tempt him further, but he continues to insist that he must keep to his vows from now on. She points out that the Bastard of Godsgrace had her maidenhead when she was fourteen, and when her father found out, he did nothing about it. She tells him that other Kingsguard have broken the vow. He thinks of Boros Blount and Preston Greenfield who both broke their vows as well, but does not mention them. He does mention Ser Terrence Toyne, however, who was found abed with the king's mistress. They were both executed and House Toyne disgraced. Arianne mentions Ser Lucamore Strong, who the songs say had three wives and sixteen children. Arys tells her that Lucamore the Lusty was gelded by the rest of the Kingsguard and sent to the Wall by Jaehaerys I. There was Aemon and Naerys as well, though Arys insists that story is false and that Aegon IV spread it so he could set aside Daeron II in favor of Daemon. Arianne reveals that Prince Lewyn had a lover as well, which shocks Arys since it was not recorded in the White Book.
