"A group of novices and acolytes from the Citadel, Mollander, Alleras, Roone, and Armen, discuss rumors of dragons outside the Quill and Tankard in Oldtown. Pate is with them too, but he is thinking of Rosey, the woman he loves. Her mother, Emma, the oldest serving wench at the Quill and Tankard, has decreed that Rosey's maidenhead will cost him a golden dragon, which he has no hope of ever saving up. His training at the Citadel has not been successful. Now, he helps tend the ravens for Archmaester Walgrave, but the man's wits are completely gone, and Maester Gormon sits below the iron mask in his place and has the power of granting the black iron link for ravenry. Archmaester Ebrose has refused him the silver link for healing, but he still knows enough that he thinks he and Rosey could make a life traveling Westeros to heal the smallfolk. Pate is waiting for a man he calls ""the alchemist."" Rosey introduced Pate to the mysterious man three days ago, and he promised Pate the gold coin he needs to win Rosey in exchange for stealing something. Pate told the man he was not a thief, and the man said he would return to the Quill and Tankard in three days in case Pate changed his mind. He decided to return, but his friends showed up to celebrate Alleras receiving his copper link, so he joined them so as not to draw suspicion.
Mollander, the son of a knight who died on the Blackwater, is convinced the stories of dragons are real. They have heard four different stories from sailors from four different ships, and while the details are different in each one, they all mention dragons and a beautiful young queen. Alleras shoots at apples being thrown by Mollander as they talk. He has only been at the Citadel for a year, yet he has already forged three links of his chain. Pate, on the other hand, arrived at the Citadel five years ago when he was thirteen and still has no links. Twice he felt himself ready to earn one, but Archmaester Vaellyn was not impressed with his knowledge of the heavens, and Archmaester Ebrose refused him a link as well. Alleras ends his target practice and tells the group the dragon must have three heads. Roone thinks this a riddle, which fits with Alleras's nickname as ""the Sphinx."" Lazy Leo had given him the name because a sphinx is made up of the parts of several different animals, and Alleras has a Dornish father and a mother from the Summer Isles.1 Armen scoffs that there are no three-headed dragons, as that was just a heraldric charge for the Targaryens, and they are all dead. Alleras reminds them that Daenerys still lives.
Leo Tyrell joins the group, much to their dismay since he is cruel and none of them like him. He mocks Pate as a pig boy because his namesake is a character from the stories named Spotted Pate that is good-hearted and empty-headed yet always manages to get the best of knights, lords, and septons. The group turns hostile, but Leo deflects them by stating that the rumors do indeed refer to Daenerys and that she has hatched three dragons. Every sailor that has been near Qarth is talking about them, and Archmaester Marwyn believes the stories. Armen says that is no proof because Archmaesters Perestan and Ryam believe Marwyn is unsound. He is said to consort with whores and hedge wizards, speak to Ibbanese and Summer Islanders in their own tongues, and sacrifice to strange gods at the sailors' temples by the docks. He spent eight years exploring the east, looking for lost books and training with warlocks and shadowbinders, and Archmaester Vaellyn dubbed him ""Marwyn the Mage"" upon his return. Leo counters that a glass candle is burning in the maester's chambers. The candles, three black and one green, came to the Citadel a thousand years before the Doom of Vlayria and serve as the final test for an acolyte before he is raised to maester. The acolyte must spend a night in darkness unless he can light the candle, which is made of dragonglass and cannot be lit. The test is meant to teach humility and the limits of knowledge, yet now one of them is casting a light brighter than any wax candle that never flickers. Armen and the others still have doubts save Alleras.
It is getting late, so everyone departs save Leo and Pate, who still hopes the alchemist will appear. Leo cruelly mocks him some more, but Pate ignores the japes because attacking him would mean his death since Leo is trained in arms and his father is Ser Moryn Tyrell, the commander of the City Watch of Oldtown. When dawn breaks, Pate leaves to return to the Citadel. As he walks, the alchemist hails him. He did not come earlier because he did not want to approach Pate while he was with his friends. Pate has stolen a key from Archmaester Walgrave for him, one that opens every door in the Citadel. The alchemist leads him into an alley, where he hands over the gold dragon in exchange for the key. Pate asks who he is and what he wants, but the alchemist just says he is no one. Pate turns to leave, but suddenly finds himself on the ground. He does not understand what is going on, and the alchemist says he never will. Pate dies thinking of Rosey.","Aeron is on Great Wyk drowning initiates into the priesthood of the Drowned God. He has drowned three already without incident, but the fourth and final man, Emmond, thrashes about, and Aeron needs help to finish the job. As he finishes, he sees three men on shore, the Sparr and his son Steffarion and Gormond Goodbrother. He finishes the ceremony with the help of his drowned men, including Norjen and Rus, using CPR to bring Emmond back to life and accepting him into the drowned men. Every priest of the drowned god occasionally loses one of the drowned, even Tarle the Thrice-Drowned, who is so revered he was once chosen to crown a king1, but Aeron has never lost one.
Aeron turns to the new arrivals. Gormond tells him that Balon is dead, killed when the bridge he was crossing at Pyke was destroyed in a storm. Aeron declares that the Storm God cast him down for making the ironmen great again. He takes Gormond's mount and tells his men to meet him at Pebbleton. As he rides, Aeron thinks of his brothers. Their father, Quellon Greyjoy, had nine sons. His first wife, a Stonetree, birthed Harlon, Quenton, and Donel. His second wife, a Sunderly, birthed Balon, Euron, Victarion, Urrigon, and Aeron, and his third wife, who was not of the Iron Islands, birthed a sickly halfwit named Robin. Quenton and Donel died as infants, Harlon was taken by greyscale fever, and only Balon, Euron, Victarion, and Aeron lived to adulthood. Balon had been a fearless child. By thirteen, he was as good with an oar and at the finger dance as any man in the isles. At fifteen, Dagmer Cleftjaw took him reaving in the Stepstones for the first time, and he took his first two salt wives. By seventeen, he captained his own ship.
When Aeron arrives at Hammerhorn, Gran escorts him to the hall, where Lord Gorold awaits with Maester Murenmure. Aeron tells him to send everyone away, but while Gorold sends Gran and two of his daughters, Gysella and Gwin, out of the room, he has the maester stay. Aeron cannot abide maesters and begins to leave until Murenmure informs him that Euron sits the Seastone Chair and calls on all captains to return to Pyke and do fealty. Aeron is shocked that Euron has returned, as Balon exiled him two years ago. He immediately states that only a godly man may sit the Seastone Chair and Euron worships only his pride. Lord Gorold asks if Balon spoke to him of the succession, and Aeron remembers that when he returned from reaving on the Stoney Shore and told Balon of Theon's fate, Balon had stated that he hoped Theon was dead so he could not stand in Asha's way. Before Aeron can speak, however, Murenmure says that Theon is now ruler, or Asha if he is dead, but Aeron cares not for green land law and states that no woman may sit the chair either. Gorold asks what to do, and Aeron says he should send no answer until Aeron has prayed.
Aeron continues on to Pebbleton with Greydon Goodbrother guiding him. As they ride through the night, Aeron dozes in the saddle and thinks of the scream of a rusted hinge and of Urrigon. While Lord Quellon and his elder sons had been away at war, Urrigon, then fourteen, lost half his fingers doing the finger dance with Aeron. Quellon's third wife, a Piper, allowed her maester to attempt sewing the fingers back on his hands, but the wound mortified, and Urrigon died. Quellon died on his voyage as well, and so it was Lord Balon who returned and chopped off three of the maester's fingers and had his father's wife sew them back on. The maester died as his wounds mortified as well, and the wife died not long after while delivering a stillborn daughter. Afterwards, Aeron became a wild drunk until his ship, Golden Storm, was destroyed off Fair Isle by Fury during Greyjoy's Rebellion. He washed up on shore, was taken captive, and spent the rest of the war in chains beneath Casterly Rock. Afterwards, he was a changed man and became a servant of the Drowned God.
Greydon leaves Aeron the next morning to take the news of Balon's death to his cousins at Downdelving, Crow Spike Keep, and Corpse Lake, and Aeron continues to Pebbleton alone, stopping to preach on the way and gathering a dozen followers. By the time he arrives at Pebbleton, his drowned men have prepared a shelter for him, where he retires after drowning his new followers. He is restless, and so wades out into the water and finally figures out what must be done. Lord Meldred Merlyn comes to see him the next morning. He has received a bird from Euron as well as one from Asha at Ten Towers, the seat of House Harlaw. Aeron preaches to the assembled that they should go neither to Pyke nor Ten Towers but rather to the ruins of the Grey King's hall at the hill of Nagga on Old Wyk for a kingsmoot. Urras Ironfoot, Sylas Flatnose, Harrag Hoare, the Old Kraken, and many other great kings had been chosen in kingsmoot, and Aeron believes this is the best way to deny Euron the crown.","Areo Hotah wheels Prince Doran Martell onto the terrace of the Water Gardens, where he watches the children splash in the fountains. After several hours, Obara Sand comes to see him, with Maester Caleotte trailing her and trying to stop her. Areo blocks her entrance, saying Doran does not wish to be disturbed. She asks if Doran knows that Oberyn is dead, and Areo states there was a bird. Obara says that thousands are crossing the Boneway to help Ellaria bring his body home. All over Dorne everyone is asking what Doran will do. Areo reiterates that the prince does not want to be disturbed, but Doran says to let her come forward. Prince Doran has two armies in the field. One, commanded by Lord Anders in the Boneway and the other in the Prince's Pass.1 Obara wants Doran to give her one and Nymeria the other so that Obara can sack Oldtown. Doran says he will think on it, and Obara stalks out angrily.
Caleotte asks if it is prudent to allow Obara to return to Sunspear, and Doran says he must return as well. Caleotte reminds him he will be seen, but Doran says he must attempt to settle the people even if his enemies may learn the extent of his gout. This will be Doran's first visit to Sunspear since departing for the Water Gardens two years ago; his gout was not nearly as bad then, and he could still walk slowly with a cane. Caleotte is especially concerned because Doran will need to grant Myrcella and Arys an audience and Arys reports to the queen. Areo thinks of Arys sadly; he feels the day that they must fight is approaching soon and that when it does, Areo will have to kill him. Doran says they will leave at first light. Doran asks Areo if he had brothers and sisters back in Norvos, and the guard captain responds he had two brothers and three sisters and he was the youngest. Because he was another unwanted mouth to feed and outgrew his clothes quickly, he was sold to the bearded priests. Doran laments that he was the oldest, yet he is the last. Mors and Olyvar both died in the cradle, and when he was nine and a squire at Salt Shore Elia was born a month premature, yet survived. A year later, Oberyn was born. Areo does not know how to respond, as he is a simple man who swore simple vows of ""serve, protect, obey"" when he wed his axe at sixteen. Doran watches the pools until long into the evening when he falls asleep. Areo returns him to his bed, sharpens his axe, and goes to sleep himself.
The next morning, Doran dawdles so that they do not get underway until midmorning. Areo, Caleotte, and twenty guards accompany him. Halfway to Sunspear, Nymeria Sand catches up with the party. She wants leave to take Tyene with her to King's Landing to assassinate Jaime, Cersei, Tywin, and Tommen as revenge for Oberyn, Elia, Aegon, and Rhaenys. Doran says they must wait and that Oberyn was too impatient. He was only supposed to assess the strengths and weaknesses of the throne and make what allies he could, but he could not wait. Nymeria says she does not mean to wait either and gallops off towards Sunspear. When they finally reach Sunspear and make their way to the Old Palace, a throng of people surrounds the litter calling out for vengeance for Oberyn. When they reach the Old Palace, they are greeted by Arianne and half the court, including the seneschal, Ricasso, the castellan, Ser Manfrey Martell, Maester Myles, twenty knights, and Myrcella with her septa, Eglantine, and Ser Arys. Arianne welcomes Doran and tells him Tyene Sand awaits him in the throne room for a private word.
Areo bears Doran to the throne room. Tyene wants Doran to crown Myrcella as the lawful Queen of Westeros, since she is older than Tommen and would inherit by Dornish law, and then bleed the Lannisters when they march south to depose her. Doran says he will think on it. Tyene insults him and then asks for his blessing, which he gives by touching her head, before leaving. When she is gone, Caleotte examines Doran's hand to make sure he was not poisoned and leaves to fetch Doran a small cup of milk of the poppy. When the maester is gone, Doran asks Areo if the guards are loyal, to which Areo responds in the affirmative. Doran orders him to seize all seven of Oberyn's daughters currently in Dorne.2 He would take Sarella too, but she is beyond his reach.3","Cersei's maid, Senelle, wakes her from a nightmare in which Tyrion is laughing at her while the Iron Throne tears her apart. Ser Osmund and Ser Boros are there to tell her that Lord Tywin is dead. Senelle and Jocelyn Swyft help her dress and freshen up a little. Ser Osmund explains that they discovered a passage in Tywin's room and that Jaime has gone to see where it leads. Ser Loras is guarding Tommen. Cersei sends Boros to make sure Tyrion is still in his cell and accompanies Osmund to Tywin's chambers. Cersei is troubled by Tywin's death, but also pleased that she now holds all the power of Casterly Rock and will not be disregarded. As she climbs the Tower of the Hand, she ponders tearing down the cursed structure. Red Lester offers condolences when she reaches the top. The hall is full of people already, and Cersei is irate that she was not told first as the Queen Regent. Ser Meryn guards the entrance to the bedchamber. Tywin has been brought to his bed. Ser Kevan is trying to pray beside it. Cersei is furious that the quarrel is still embedded in his groin and that he has not been bathed and dressed. She wonders if she should weep and if Tywin wept for his own father. Cersei had been one when Lord Tytos died of a burst heart as he was climbing the steps to his mistress, and Tywin had been away in King's Landing at the time serving as Hand. She angrily calls for Grand Maester Pycelle, only to learn that he had already come and then left to summon the silent sisters. She realizes that she was summoned last.
Cersei angrily calls for Ballabar or Frenken, and two guards, Puckens and Shortear, run to obey. They return with Qyburn. He explains that he was once a maester and treated Jaime, and Cersei orders him to remove the quarrel and prepare the body. Qyburn asks what to do with the other body, and Cersei realizes that Shae is in the bed too. Cersei cannot believe that Tywin would use a whore. When Lord Tytos died, Tywin had his mistress paraded naked through the streets to confess herself a thief and a harlot. Qyburn suggests that perhaps Tywin was questioning her about Sansa, and Cersei eagerly accepts the explanation. When she emerges into the hall, Osney and Osfryd have arrived. She tells them to dispose of Shae and make sure no one knows she was there. She tells them to go through the passage just as Jaime emerges. He reports that the passage is blocked by locked iron gates, and he will need keys. Cersei orders men to knock through walls with hammers if they must but to find the killers. She tells Jaime he must be Hand now, but he refuses. Kevan, Qyburn, Osmund, Osfrey, Osney, and three guardsmen, Puckens, Shortear, and Hoke the Horseleg all overhear the rebuff. Jaime mocks her ability to rule, so she slaps him. Kevan angrily tells them to take their quarrel outside. Cersei is sick of meddling Hands and decides that Tywin's successor must be biddable. She therefore plans to ask Kevan. Cersei suddenly wonders where Varys is and thinks he must have been part of it. She orders Ser Meryn to bring him when Ser Boros returns to report Tyrion is gone. One of the gaolers, Rugen, is missing as well, and the guards are asleep. Cersei orders the guards killed. Cersei is suddenly frightened and thinks of a prophecy from her childhood relating to her doom. She closes her eyes and sees Tyrion grinning at her.","Brienne asks several residents of Rosby if they have seen Sansa, asking after her not by name but as a maid of thirteen with blue eyes and auburn hair, but there has been no sign of her. As she prepares to leave, she notices a skinny boy atop a piebald mare, but he vanishes before she can ask after Sansa.1 She leaves the town and continues on towards Duskendale, which she thinks is the most likely place to find Sansa or her trail. The road is full of travelers, but none of them have seen Sansa either. Around dusk, she comes upon two hedge knights grilling trout at a campfire. They invite her over to share the fish and are shocked when she takes off her helm and reveals she is a woman. She asks them about Sansa as well, but they have not seen her. They once again invite her to share their food and introduce themselves as Creighton Longbough and Illifer the Penniless. Ser Creighton offers to escort her to Duskendale, and insists even after she refuses. Illifer tells Creighton to give over and says that a liar like her has no need of them. He points out her shield, which sports the black bat of Lothston, a line that was ended generations ago. The last lord of the line, Lucas Lothston, was known for his dark deeds, as was his son, Manfryd of the Black Hood. By her freakish size, Illifer recognizes her as Brienne of Tarth. He accuses her of killing Renly, which she denies. She thinks of how she fell in love with Renly when he first came to Tarth during his progress when he came of age. Brienne did not want to attend the welcome feast in his honor, sure she would be mocked because of the incident with the rose,2 but Lord Selwyn made her attend. Renly showed her every courtesy and even danced with her; from that day, Brienne wanted nothing more than to serve and protect him. She swears her innocence by the Seven, which satisfies the two hedge knights who ask her to take the first watch. She considers leaving, but does not want to leave the two men defenseless. She is relieved and falls asleep.
The next day, the three travel together. Around midday they encounter a large group of men, women, and children accompanied by a septon and some begging brothers. They are going to King's Landing with a cart full of the bones of servants of the Seven that have been killed during the war and mean to ask for the king's protection. Several of them are armed with axes, clubs, and cudgels, including one big man with the seven-pointed star carved on his breast. The septon, a spare man with a lean sharp face, a short beard grizzled grey and brown, thin hair knotted behind his head, and black gnarled feet, beseeches the hedge knights to join them.3 Ser Illifer offers to escort them to King's Landing for a price, but the septon states that sparrows need no gold. Ser Creighton asks why they call themselves sparrows, and the septon explains they are the humblest of men as the sparrow is the humblest of birds. He goes on to say that it is time for all true knights to gather and defend the Holy Faith. With no payment in the offing, Ser Illifer refuses to accompany the sparrows. Brienne asks after Sansa again, but they have not seen her.
About three hours later, they come across a merchant named Hibald traveling with his serving men and hedge knight guard. Brienne asks after Sansa without success, while Creighton and Illifer offer to travel with the merchant, who accepts. As they ride, the hedge knight drops back to ride with Brienne. He introduces himself as Ser Shadrich of the Shady Glen, also known as the Mad Mouse. He reveals that he recognized Brienne's description of Sansa and that he is also looking for her. He fought for Stannis on the Blackwater and spent all his coin ransoming himself. He means to collect the bounty placed on Sansa by Varys. The party stops for the night at an inn by a bridge called the Old Stone Bridge. Brienne offers to pay for them, as Jaime made sure she had plenty of gold along with a letter signed by Tommen calling on all loyal subjects to assist her. The innkeeper, Naggle, gives them rooms and food. Brienne retires early, drawing Oathkeeper and saying a prayer to the Crone before lying in bed. After all the other patrons have retired for the night, she sneaks out of the inn and continues her journey alone.","Sam is in the library reading various books and folios. He has been there most of the night. One of the last books he read was ''Annals of the Black Centaur'' by Septon Jorquen detailing the nine year term of Orbert Caswell as Lord Commander of the Night's Watch. He finally gathers up a stack of books and scrolls and emerges from the tunnels beneath Castle Black. The Wall is abuzz with activity as men work to build a new stairway to replace the one destroyed when the wildlings attacked.1 He thinks of the Targaryens that visited the Wall on their dragons two hundred years before, first Queen Alysanne and later King Jaehaerys I, and wonders if Silverwing left an egg at the Wall. Even if she had, he has no clue how Stannis hopes to quicken it when several Targaryens had failed before him.
Dolorous Edd hails Sam and tells him Jon wants to see him. Pyp and Grenn come around the corner as well and tease Sam about missing dinner and not showing up for archery practice with Ulmer. Jon has instituted daily archery drills for the entire garrison; he feels that the Watch pays too much attention to the sword and too little to the bow. This attitude developed when one brother of every ten had been a knight rather than one of every hundred. They tease Sam about Val too, who often watches them from the tower where she is held, until Sam says he has to see Jon. Pyp and Grenn are unhappy with Jon because he never has time for them anymore. What little free time he has is always spent practicing the sword; Jon explained to Sam that he feels he must become worthy of Longclaw. Sam takes his leave.
With the Lord Commander's Tower gutted and Stannis residing in the King's Tower, Jon has taken up residence in Donal Noye's old quarters behind the armory. As Sam approaches, Gilly rushes out of Jon's quarters looking wan and frightened. Sam catches her, dropping two of his books as he does, and tries to talk to her, but she runs off with tears in her eyes, leaving Sam perplexed.2 He inspects the books he dropped, Colloquo Votar's Jade Compendium and Maester Thomax's Dragonkin, Being a History of House Targaryen from Exile to Apotheosis, with a Consideration of the Life and Death of Dragons, and finds that the former is undamaged while the latter now has several muddy pages. He curses himself for his clumsiness and reflects on how Gilly raises certain urges in him that a brother of the Night's Watch should not have.
Hairy Hal and Mully stand guard outside Jon's chambers and tell Sam that the Lord Commander is waiting. As Sam runs through the armory, Ghost watches him pass. As he enters Jon's solar, Lord Commander Mormont's raven flies at him demanding corn. When Sam proffers some from a sack by the door, the crow pecks his hand hard enough to draw blood. Jon shows him a letter written by Maester Aemon addressed to King Tommen. It states that the Watch is not taking sides in the war for the throne and only helps Stannis to defend the realms of men then goes on to ask for aid. Jon does not think it will work. Sam worries that Tywin may march on Stannis and destroy the Night's Watch, while Jon hopes that Stannis can rouse the North and still win. Stannis has sent birds to all the great northern houses asking for support, but so far only the Karstarks have declared for him. Jon signs the letter and tells Sam to make sure it is sent. Sam asks about Gilly, and Jon says Val sent her to plead for Mance's life; rumor is that Stannis means to give him to the flames because Melisandre claims king's blood has the power to wake a dragon. Jon thinks the notion foolish, as Mance was not really a king. Jon also tells Sam that he is sending Gilly and her boy away.
