Catelyn starts her climb, which takes her past three waycastles as the journey continues, Stone, Snow, and Sky. Mya talks as they go, telling Catelyn how she is in love with Ser Lyn Corbray's squire, Mychel Redfort, and that they are to marry when he becomes a knight in a year or two. Catelyn thinks to herself that House Redfort is one of the oldest houses in the Vale, tracing their lineage back to the First Men, and that a son of this house would never marry a bastard.1 The path gets narrower and windier on up, and by the time Catelyn reaches the last waycastle, Sky, she is too nervous to continue and has herself hauled up from Sky to the Eyrie in a basket. She is greeted by Ser Vardis Egen and Maester Colemon, who take her to Lysa. Her sister is all smiles until everyone leaves, at which point she turns vicious. She is furious that Catelyn brought Tyrion to the Vale and dragged her into her quarrel with the Lannisters. She had never meant to fight them, only to hide in the Eyrie. Lord Robert comes in as she shouts, and he is very sickly. He gets scared, and Lysa breastfeeds him. She wonders what to do with Tyrion, and Robert asks if they can make him fly.2","Eddard prepares to leave the brothel, run by Chataya, with Lord Petyr, Jory, Heward, and Wyl. He found another bastard of Robert's at the brothel, a baby girl named Barra, who has fine dark hair. They begin the ride back to the Red Keep. Eddard thinks of Lyanna. She once told him that Robert would never keep to one bed, and when Eddard protested that Robert loved her, she responded that love could not change a man's nature. Eddard asks Petyr what he knows of Robert's bastards. Petyr does not know how many Robert has, but says there is one acknowledged bastard that he begot with a Florent on the night Stannis wed his wife.1 When the boy was born, Robert shipped him to Renly at Storm's End. There are also rumors that he had twins with a serving girl at Casterly Rock three years ago when he attended Lord Tywin's tourney and that Cersei had the babies killed and the mother sold into slavery.2 Eddard asks Petyr why Lord Jon would take an interest in Robert's bastards and why someone would kill him for it. Petyr finds the idea preposterous. Eddard suddenly thinks of Rhaegar and wonders if the prince ever visited brothels. He believes the prince did not. Suddenly, Eddard and Petyr are surrounded by twenty Lannister house guards led by Jaime. Jaime asks after Tyrion, and Eddard says he has been taken at his order to answer for his crimes. Jaime tells Petyr to leave, and Petyr promises to bring the City Watch. Jaime prepares to kill Eddard, but Eddard reminds Jaime that this would lead Catelyn to kill Tyrion. Jaime realizes this is so and tells the commander of his guards, Tregar, to make sure Eddard comes to no harm. He then orders Tregar to kill Eddard's men and takes his leave. Eddard rushes to their aid and delivers a serious blow to Tregar, but he falls from his horse and breaks his leg. Jory, Heward, and Wyl are killed. The City Watch arrives some time later and brings him back to the Red Keep, where Grand Maester Pycelle prepares to treat his wounds.","Daenerys enters Vaes Dothrak with Drogo, his bloodriders1, Ser Jorah, Viserys, Aggo, Rakharo and her other khas at the head of the khalasar. Viserys, now universally mocked by the Dothraki after being forced to walk and ride in a cart, is getting very impatient to march on Westeros. Jorah tells Daenerys that Viserys should have remained in Pentos and that Dothraki see the world differently. Viserys sees Daenerys as the price for Drogo's support, but Drogo sees her as a gift for which he will give a return gift in his own good time. Daenerys points out that Viserys will leave when he has his ten thousand, but Jorah retorts that Viserys is incompetent and could not prevail no matter the size of his army. Daenerys asks how the Dothraki would fare under a competent commander, and Jorah considers. Drogo has forty thousand warriors, as many as Rhaegar had at the Trident, however only a tenth of these were knights. Dothraki fighting from horseback with hit and run attacks would probably be able to defeat a western army in the field, but the Dothraki care little for siegecraft and would never be able to take a castle. As Irri and Jhiqui help Daenerys off her silver, Cohollo comes over and says that Drogo will ascend the Mother to offer a sacrifice. Daenerys has Doreah invite Viserys to dinner so that she can present him with gifts, fine Dothraki clothing. Viserys arrives and scorns her gifts and threatens her, so she hits him, and he leaves. She curls up with one of her dragon eggs and goes to sleep, confident that the child in her womb will one day be a king.","Bran takes his first ride out of Winterfell on his new horse, Dancer. With him are Robb, Theon, Summer, Grey Wind, Joseth, Maester Luwin, and four guards, including Quent and Wayn. On the way out of town, Theon calls out to Bessa and Kyra, two women he has lain with on more than one occasion. As they ride on into the wolfswood, Robb tells Bran about the death of Jory and Eddard's injury. Theon thinks Robb should call the banners, but Robb is undecided as of yet. He has, however, fortified Moat Cailin after receiving a letter from Catelyn. Bran loses his enjoyment of the ride and wants to go back, but they need to find the direwolves first.
Robb and Bran slowly outdistance their guard. They hear the direwolves in the distance, and Robb goes off to bring them in. Soon after, Bran is set upon by four men, including Stiv and Wallen who deserted from the Night's Watch, and two women, Hali and Osha. Bran identifies himself and threatens them. Hali wants to kill him, but Osha says he would be worth more to Mance alive. Stiv says he is not going back to face the white walkers.1 As Stiv prepares to cut Bran off Dancer, Robb returns with Summer and Grey Wind. They charge, and soon everyone is dead except Osha and Stiv, who takes Bran hostage. Suddenly, Stiv is felled by an arrow from Theon as the guard arrives. Robb is furious at Theon for such a reckless act, and is even more enraged to learn that the guard did not get there sooner because Theon went off hunting turkey. They take Osha back to Winterfell for questioning.","Tyrion is in a cell being taunted and tormented by his gaoler, Mord. One end of his cell is open to the sky, and Mord says that he will jump to his death eventually. Tyrion thinks back to how he got into this predicament. It began during his audience with Lord Robert and Lady Lysa. Lysa accused him of murdering Jon, causing him to become very annoyed and very sarcastic. Robert almost had him killed before Catelyn reminded Lysa that Tyrion is her prisoner and not to be harmed. Ser Vardis took him to a cell instead, where he is routinely mistreated by Mord. He wonders whether Jaime and Cersei really did conspire to kill Jon,1 and wonders why the attack on Bran was so clumsy, finding that odd.2 He thinks that someone may be trying to start a feud between Stark and Lannister.3 He decides that he will die if confined in the cell much longer and decides he must get out. He calls for Mord and promises him gold in exchange for aid. Mord is reluctant at first and starts beating him, but finally consents to take Tyrion's message to Lysa that Tyrion is ready to confess his crimes.
That night, Ser Vardis comes for Tyrion and brings him before the Lady Lysa. All the powerful houses of the Vale are represented in the High Hall. The attendees include Ser Brynden, Lord Nestor, Ser Albar Royce, Ser Lyn Corbray, Lord Eon Hunter, Lady Anya Waynwood and her sons.4 Others present bear sigils he does not recognize such as a broken lance,5 a green viper,6 a burning tower,7 and a winged chalice.8 Ser Rodrik, Ser Willis, Marillion, and Bronn are also there. As Tyrion enters, Bronn looks pointedly at him with hand on pommel. Tyrion steps forward and begins confessing his crimes, that he lays with whores, gambles, mocks, etc. Catelyn accuses him again of plotting to kill Bran, and he denies it. Lysa is about to send him back to his cell, but he demands a trial. Lysa says Lord Robert will hear his case, but Tyrion demands trial by combat. Lysa appoints Ser Vardis as her champion and Tyrion names Jaime, but Lysa will only allow him to choose someone who is present. Bronn stands up and volunteers.","Eddard dreams an old dream of the day he was reunited with Lyanna. He rides with six friends, Martyn Cassel, Theo Wull, Brandon's squire Ethan Glover, Ser Mark Ryswell, Howland Reed, and Lord William Dustin. Before them is the Tower of Joy, hard against the Red Mountains, and three knights of the Kingsguard, Ser Arthur Dayne, Ser Oswell Whent, and the Lord Commander, Ser Gerold Hightower. Eddard tells them he looked for them on the Trident, at King's Landing, and at Storm's End and thought perhaps they were with Ser Willem Darry on Dragonstone, but they say that they swore a vow and do not run. Just as he and his companions close to fight the Kingsguard, Eddard wakes up.
Vayon tells Eddard he has been unconscious for six days and seven nights and that Robert commanded to be called the moment he woke up. Eddard sends Vayon to fetch the king. Alyn, now captain of the guard with Jory dead, enters and tells him that Jaime has fled the city to join Lord Tywin at Casterly Rock. Jory's body has been sent north to lay with his grandfather. His father, Martyn, is buried at the former site of the Tower of Joy with Ser Mark, Theo, Ethan, and Lord William; only Eddard and Howland survived the encounter with the Kingsguard, and Eddard pulled the tower down afterward to make funeral cairns for his companions and the three Kingsguard. Vayon comes back to tell him that Robert and Cersei have arrived.
Eddard takes responsibility for Catelyn's seizure of Tyrion, saying it was done at his command. Robert is unhappy that eight men are dead, Eddard's three companions, four Lannister guards at the scene, and Tregar, who died that very morning of the blow Eddard gave him. Cersei accuses Eddard of starting the fight after coming back from a brothel drunk, but Eddard counters that he was there to visit Barra, which does not please Robert or Cersei.1 Eddard asks permission to bring Jaime to justice for killing three of his men. Cersei says that the seizure was unlawful and that it is Eddard who should be brought to justice. Robert wants none of it and orders Tyrion's release and for Eddard to make peace with Jaime. Neither Eddard nor Cersei is happy. Cersei insults Robert, and he hits her, then has Ser Meryn escort her back to her chambers. When she is gone, he laments that he should not have hit her and wonders how he can fight an enemy he cannot hit. He thinks Rhaegar won after all; he has Lyanna while Robert is stuck with Cersei. He tells Eddard that he is going hunting and that, like it or not, Eddard will remain his Hand.","Catelyn looks out on Alyssa's Tears. They are named for Alyssa Arryn, who according to legend had seen her entire family die before her six thousand years ago, but refused to shed a tear. The story goes that she would not be allowed any rest until her tears watered the Vale of Arryn. Ser Rodrik reports on recent events to Catelyn. Jaime is gathering a host at Casterly Rock. Edmure Tully has demanded to know his intent and ordered Lord Vance and Lord Clement Piper to guard the pass below the Golden Tooth against him. Lord Hoster Tully was not mentioned in the letter at all, and must be very sick if he has given charge of the defense of the riverlands to Edmure. Catelyn decides she must return to Winterfell and tells Ser Rodrik that they will take ship from Gulltown after Tyrion's trial. She is most annoyed with Lysa, who is very moody and inconstant and has been played for a fool by Tyrion.
Ser Brynden joins Catelyn. He had asked leave of Lysa to take one thousand men and march to the riverlands. When she refused him, he resigned as Knight of the Gate and is now preparing to leave for Riverrun. Catelyn convinces him to join them on the ship back to Winterfell. Catelyn arrives at the site of the combat, where Lysa and Lord Robert are surrounded by knights and retainers, including Lord Eon and Ser Lyn, her two favored suitors at the moment, and Ser Morton. Catelyn tells Ser Rodrik that Robert is unfit to rule and must be taken away from Lysa. Maester Colemon comes up to her and says that Lord Jon agreed and was going to foster him at Dragonstone with Lord Stannis. Catelyn says he is mistaken and that Robert was going to Casterly Rock and that the arrangements were made after Jon's death.1 2 Maester Colemon begins to rebut, but at that point Tyrion is brought in, with Bronn and Ser Vardis appearing soon after. Vardis is fully armored; Bronn wears only mail and a halfhelm.
A septon blesses the trial, and the fight begins. Watching the battle takes Catelyn back to the combat years ago when Petyr fought Brandon Stark for her hand. Petyr begged her for a favor to wear, but she had to refuse. She gave one to Brandon instead, and begged him not to kill Petyr. Brandon gave him a dozen wounds and drove him all over the yard demanding that he yield, but was finally required to give a potentially mortal blow when Petyr steadfastly refused. Petyr said Catelyn's name as he fell, and it was the last time Catelyn saw him until their meeting in King's Landing. It took Petyr two weeks to recover enough from his wounds to travel. Catelyn was forbidden to see him during that time, but Lysa was a constant companion. Edmure tried to visit too, but Petyr refused to see him because he acted as Brandon's squire in the duel. Lord Hoster sent him back to the Fingers to finish his healing at home.
The sounds of combat bring Catelyn back to the battle at hand. Bronn dodges around Ser Vardis, darting this way and that to tire his heavily armored foe. When Vardis is near exhaustion, Bronn closes in and begins pressing him fiercely. Vardis makes one final bull rush to try and end it, but Bronn darts aside, topples a statue on top of him, and delivers the killing blow. Lysa realizes she must free Tyrion, but orders him and Bronn put out on the high road, where she believes they will die.","Ser Alliser has learned that Gueren is bringing five new recruits to Castle Black, so he decides to elevate Halder, Todder, Albett, Pypar, Grenn, Matthar, Dareon, and Jon to full members of the Night's Watch. Sam congratulates them, but seems depressed. That night, Bowen Marsh personally leads them to a seat by the fire and Three-Finger Hobb cooks them a special meal. Jon is worried when he does not see Sam at dinner and realizes that Sam is afraid because with Jon gone he will probably get hurt again by less savory trainees such as Rast and Cuger. He rides with Ghost for awhile thinking. He considers not joining the Watch, but quickly discounts that. He thinks of Sam again and goes to see Maester Aemon. Chett answers the door and does not want to admit Jon at first, but he insists, and Chett gets the maester. Jon asks Maester Aemon to convince the Lord Commander to raise Sam to the Watch, saying he will be hurt or killed otherwise. He says that every man has a use and that Sam would be ideal for helping Maester Aemon with his work, particularly since Chett cannot read and his other assistant, an albino named Clydas, has weak eyes. The maester says he will think on it and sends Jon away.","Tyrion and Bronn stop to take shelter along the high road. They have been riding all day since being put out of the Vale by Ser Lyn. Tyrion gathers wood to start a fire. Bronn threatens to leave, but Tyrion offers him any reward if he stays to protect Tyrion, and he accepts. Tyrion lights a fire to draw some mountain clansmen in. He mentions his mistreatment in the dungeon of the Eyrie, and Bronn registers surprise that Tyrion gave Mord the gold he promised the gaoler. Tyrion merely replies that a Lannister always pays his debts. Bronn asks where they will go now, and Tyrion says he means to make inquiries about a certain dagger. With no clansmen coming yet, Tyrion begins to whistle a Myrish song called ""The Seasons of My Love."" He tells Bronn that the first woman he ever bedded used to sing that song, and it has been stuck in his head ever since. He goes on to tell the story of their meeting.
When he was thirteen, Tyrion was riding back to Casterly Rock from Lannisport with Jaime when they encountered a girl named Tysha being chased by bandits. After they saved the girl, Jaime rode off to get help to hunt down the bandits while Tyrion took the girl to a nearby inn. She was a crofter's daughter orphaned when her father died of fever, but Tyrion drank too much wine and they had sex. Tyrion fell in love and married her in front of a drunken septon. For two weeks they played at being husband and wife at a cottage until the septon sobered up and told Lord Tywin. The furious lord first made Jaime tell the truth that Tysha was a whore he hired because he felt it was time Tyrion had his first woman.1 Then he gave Tysha to his guards, making them each pay a silver piece to take her. When they were done, Tywin made Tyrion go last, but for a gold piece because a Lannister is worth more. Bronn says he would kill any man that did that to him, and Tyrion says he may get that chance, for a Lannister always pays his debts.
Sometime later, they are accosted by about ten Stone Crows including their chief, Gunthor, Shagga, Conn, Torrek, and Jaggot. They are about to kill Tyrion, but he promises to deliver them suitable weapons and armor from his father so they can take the Vale.","Eddard sits on the Iron Throne with part of the small council, Varys, Petyr, and Pycelle. Ser Arys stands guard at the foot of the throne, as do Alyn and Porther. Sansa is in the gallery watching with Septa Mordane. Robert is still out hunting and has been joined by Lord Renly, Ser Barristan, Prince Joffrey, Sandor, Ser Balon, Lord Yohn, and half the court. Eddard is listening to testimony from Ser Raymun Darry, Ser Karyl Vance, and Ser Marq Piper about Lannister raids that have destroyed the holdfasts of Sherrer, Mummer's Ford, and Wendish Town. A brewer from Sherrer named Joss testifies that Gregor Clegane was the leader of the raiders. No one had been present to defend the holdfasts because all the banners had been called. Edmure has since sent men to guard all the holdfasts, and Eddard realizes that this was probably Tywin's plan all along to bleed off strength.1 Edmure wanted to take vengeance right away, but Lord Hoster made him send to the king first for permission.
Pycelle tries to divert the issue, first suggesting that the knights take up the matter with Gregor's liege lord, Tywin, and then suggesting they wait for the king to return, but Eddard decides he must act. He sends Ser Robar to tell Robert what has happened and attaints Ser Gregor for treason, has him stripped of all titles, and sentences him to death. He says he would normally lead the party to bring Gregor to justice, but his leg prevents him. Ser Loras asks for the honor of leading the party in his stead, but Eddard gives leadership to Lord Beric instead. Lord Beric, Thoros of Myr, Ser Gladden Wylde, and Lord Lothar Mallery are each to take twenty men along with twenty of Eddard's personal guard to see justice done. Varys comes up to Eddard afterward and says he should have sent Loras to secure friendship with the Tyrells against the Lannisters and that he should also have sent Ser Ilyn since he is the king's executioner. Varys says Ser Ilyn was in the back and did not look happy.","Sansa is talking to Jeyne over dinner. She is shocked that Eddard did not send Loras after Gregor because it would be just like in the songs and stories. She had been saying as much to Septa Mordane at court earlier, and Petyr came up to her and told her that life was not a song and that she may find this out to her regret. Yoren had also been at court, and Eddard gave him leave to choose men from the dungeons for the Night's Watch. The next morning, she wakes up early to watch Lord Beric's party ride off, with Alyn carrying the Stark banner.1 Afterward, she joins Arya and Septa Mordane for breakfast. Sansa explains to Arya what is happening with Gregor, and Arya says she wishes someone would kill Jaime and Sandor for their murders. Sansa repeats her lie that Mycah attacked Joffrey, and Arya throws an orange at her. They exchange insults, and Septa Mordane sends them to their rooms. Eddard summons them both to him later. He informs them that he is sending them back to Winterfell for their own safety. Sansa begs to stay and says she loves Joffrey as Queen Naerys loved Prince Aemon and Jonquil Ser Florian and wants to marry him. During the course of the conversation, Sansa says that Joffrey is nothing like the king, and Eddard suddenly gets a strange look on his face.2 He sends the girls back to their rooms.","Pycelle is tending to Eddard's leg. He tells Eddard that Lord Tywin has sent a letter to Cersei expressing discontent over the Gregor situation. Eddard says that if Tywin interferes, he will have Robert to answer to, and Pycelle hurries off, probably to report to Cersei. Eddard now realizes thanks to Sansa that Joffrey, Myrcella, and Tommen are not Robert's children, and he believes this is the secret Jon died for.1 Lord Petyr stops by and reports that sellswords and freeriders are gathering at Casterly Rock. Robert continues to hunt, but some of the party, including Joffrey, Sandor, Ser Balon, Lord Yohn, and Ser Robar have returned. Petyr says that Sandor is probably not happy at the moment because he does not want anyone but himself killing his brother. After Petyr leaves, Eddard returns to his musings. He trusts Petyr only a little and Varys not at all. He feels that Pycelle is certainly a Lannister creature and that Ser Barristan is too old and rigid to help. He knows he must speak to Robert upon his return. Vayon has arranged for Eddard's daughters to leave on the Wind Witch out of Braavos, captained by a man named Qos, in three days. Eddard remembers how Lord Tywin presented the bodies of Rhaegar's children to Robert and wants to make sure that Cersei's children do not suffer a similar fate. Eddard summons Tomard, who now commands the guard with Alyn off hunting Gregor, and has him and Varly take him to the godswood and has Tomard deliver a message to Cersei.
Cersei arrives at sunset, and Eddard accuses her and Jaime of being lovers, which she admits. He brings up Bran's accident, and she confirms that Jaime pushed him. He asks if all three of her children are Jaime's, and she says yes. Eddard figured this must be the case. Jon Arryn's last words that the ""seed is strong"" apparently referred to the dominance of dark hair color in Baratheon children. All of Robert's bastards have dark hair, yet Cersei's children are all blond. The book of lineages by Grand Maester Malleon records the last marriage between a Lannister and a Baratheon ninety years before in which Gowen Baratheon, third son of the lord at the time, wed Tya Lannister who gave birth to a boy who died in infancy that had black hair. Thirty years before that, a male Lannister wed a Baratheon who bore three daughters and a son that all had black hair. Eddard could find no Lannister-Baratheon marriage in the book resulting in a blonde-haired child. Eddard asks Cersei how she avoided getting with child from Robert, and she explains that she did once but had an abortion. After that, she found other ways to please Robert, and he was usually too drunk to care anyway. She says she has hated him since their wedding night when he called her Lyanna in his passion. Cersei tries to seduce Eddard, but fails. Eddard says he will tell Robert the truth when he returns and that Cersei and her children should have fled Westeros by then or face full punishment. Cersei tells him that he should have taken the throne fifteen years ago and that he should fear her wrath.","With Drogo and the dosh khaleen looking on, Daenerys eats a stallion's heart. Other spectators include Daenerys's handmaidens, Irri, Jhiqui, and Doreah; Drogo's bloodriders, Cohollo, Haggo, and Qotho; Khal Ogo and his son Fogo; and Khal Jommo with his four wives. The Dothraki believe that if she eats the whole heart her baby will be strong; if she fails, her child will be female, deformed, or even stillborn. When Daenerys is finished, the crones declare that her son will be the ""stallion who mounts the world."" They ask for a name, and she names him Rhaego. She then proceeds to the Womb of the World and cleanses herself. Afterwards, she rides her silver to Drogo's tent for a feast.
