Daenerys does not see Viserys in the feast tent and calls Jorah over to ask where he is. Jorah informs her that he went looking for wine. He has been talking to caravan guards in the hopes of hiring them, and talks of using Daenerys's dragon eggs as payment. She asks who the stallion that mounts the world is, and Jorah explains that he is the khal of khals who will unite the Dothraki and conquer the world. Suddenly, Viserys arrives drunk with a sword on his hip. He demands to see Daenerys and to have a place at the feast. Drogo points to the farthest corner where those with no honor sit, and Viserys is affronted. He is mocked and draws his sword despite Jorah's protests. He goes to Daenerys and threatens her baby unless Drogo gives him his promised crown. Drogo melts his gold medallions as his bloodriders seize Viserys and then pours the molten gold over Viserys.","Eddard is woken from sleep by Tomard and Cayn, who have brought the King's steward with a summons to see Robert, who has returned from his hunt. Eddard passes Ser Boros, Ser Preston, and Ser Barristan on his way to the king's chambers and knows something is wrong when he sees Barristan's face. When he enters the king's chambers, he sees Pycelle, Renly, and Cersei all hovering around Robert, who is mortally wounded. He had drunk too much wine and missed a thrust against a boar, which tore him from groin to nipple. Robert orders everyone to leave so he can speak to Eddard alone. He repents for sending assassins after Daenerys and tells Eddard to get paper and ink. He dictates his will, naming Eddard Lord Regent and Protector of the Realm until Joffrey comes of age. Eddard starts to tell him the truth about Joffrey, but cannot bring himself to hurt Robert more. Instead, he just writes ""my heir"" in the will instead of ""Joffrey."" Robert also tells Eddard to let Daenerys live. They call Renly and Pycelle back in to witness the sealing of the will and then Pycelle gives Robert milk of the poppy so he will sleep.
As Eddard exits the king's chamber, Varys comes up to him and Ser Barristan and asks how Robert came to be so drunk. Barristan replies that the king's squire, Lancel, provided him with a steady supply of wine,1 and Eddard realizes that the Lannisters killed the king. Eddard orders Varys to cancel any arrangements he made to kill Daenerys. As he walks back to his own quarters, Renly approaches him and offers to give him one hundred swords to seize Joffrey, Tommen, and Myrcella so that the small council will confirm Eddard as Lord Protector and ward of Joffrey. Eddard refuses the offer and Renly stalks away.
When Eddard returns to his quarters, he tells Cayn to find Petyr, then tells Tomard to personally escort his daughters to the Wind Witch the next evening with twenty men and to stop by Dragonstone on the way back to Winterfell to deliver a letter to Stannis. Afterwards, he writes the letter to Stannis, which urges him to sail to King's Landing with all his strength to claim the throne. As he finishes the letter, Cayn and Desmond arrive with Lord Petyr. Eddard tells him about Cersei and the children, which does not seem to surprise him, and Petyr advises Eddard not to deal with Stannis, claiming that it will mean war as the Lannisters will fight and the Tyrells, Greyjoys and others whom Robert pardoned will also rise for fear of punishment from the far more taciturn Stannis. Petyr offers to aid Eddard in ruling as regent for a modest price, but Eddard refuses and says it must be Stannis. He wants Petyr to insure the loyalty of the City Watch, and Petyr says he will pay them six thousand gold pieces so they will join Eddard in overcoming Cersei's soldiers when the time comes.","Sam comes up to Jon and says he is to be raised to the Night's Watch with the others. He will assist Maester Aemon with the ravens and the library as Jon had suggested. They join Todder, Pypar, Albett, Halder, Matthar, Grenn, and Dareon in the sept, where Septon Cellador is preparing for the ceremony. Soon Maester Aemon, leaning on Clydas, Jeor Mormont, Alliser Thorne, Bowen Marsh, Othell Yarwyck, and Jaremy Rykker, who is acting first ranger with Benjen missing, arrive. Jeor explains the ceremony and the oath and asks if there are any who keep to the old gods. Jon speaks up, and Sam decides to swear to them as well. Jeor explains that Castle Black has no godswood, but that there is a grove on the edge of the haunted forest where they may swear. Next, he gives out assignments. Halder and Albett join the builders, Grenn, Pypar, Matthar, and Todder the rangers, and Sam, Dareon, and Jon the stewards. Jon is shocked and hurt and figures this was retribution by Ser Alliser. Bowen assigns Sam to Maester Aemon, replacing Chett who will go to the kennels, and sends Dareon to Eastwatch to aid Borcas, the head steward there, in dealing with traders. Jon is to be Lord Commander Mormont's personal steward; the lord commander selected him personally. Jon is furious, but Sam points out that he is probably being groomed for command. Late in the afternoon, Sam and Jon set out with Bowen Marsh and an escort, including Dywen, to the edge of the forest. Ghost comes too. They kneel before a grove of nine weirwood trees and take their vows. Afterwards, Ghost comes up to Jon with a rotted human hand in his jaws.","Eddard awakes to the sound of Lannister guardsmen drilling with Sandor in the yard below. He takes breakfast with Septa Mordane, Arya, and Sansa. Arya asks to have one more lesson with Syrio before leaving, and Eddard gives his assent. Pycelle comes in after breakfast to report that Robert is dead, and Eddard has him convene the small council in Eddard's solar. Ser Barristan arrives first, followed by Petyr, who says all arrangements are made, and then Varys. Varys reports that Renly and Loras left for the south early in the morning. Eddard has Ser Barristan read Robert's will and asks to be confirmed in his role as lord protector. Just then, Tomard arrives with the king's steward, who asks that the small council attend Joffrey.
Eddard, the council, Tomard, and eight members of Eddard's guard walk to the throne room. Janos Slynt meets the council at the door and escorts them in. Joffrey sits on the throne with Tommen, Myrcella, and Cersei at the base. Ser Mandon, Ser Meryn, Ser Arys, Ser Boros and Ser Preston are arrayed at the base of the throne in full armor. Sandor also guards the prince. Twenty Lannister guardsmen stand behind the throne and city watchmen are arrayed along both walls. Joffrey asks for the fealty of the council, and Eddard produces the king's letter. Cersei rips it in half and tells Eddard that if he swears fealty he will be allowed to go back to the North and live in peace. Instead, Eddard denies Joffrey's claim to the throne and declares Stannis to be the true heir. Cersei orders Ser Barristan to seize him, and Eddard orders the City Watch to take Cersei into custody. Instead, they turn on Eddard's men, killing all of them, including Tomard, Varly and Cayn. Petyr unsheathes Eddard's dagger and places it at his throat.","Syrio gives Arya a lesson. He calls out where he will strike so that Arya can counter, but he lies on the final thrust and gets through her defense. Arya is upset, but Syrio points out that his whole body showed the point of attack and only his words were lies. He then tells her a story about the importance of seeing what is really there rather than what someone says is there. When Syrio's predecessor as first sword died, the Sealord of Braavos began conducting interviews with bravos from the city one at a time. When Syrio was brought before him, the Sealord had a beast on his lap he said was brought from a faraway land. Syrio recognized it as an immensely fat yet otherwise ordinary cat and was given the job. All the other candidates had seen an exotic beast because the Sealord said it was exotic, but Syrio saw through the lie. The lesson learned, Syrio tells Arya he is pleased with her progress and believes he might let her use Needle when they get to Winterfell. Suddenly, Ser Meryn bursts into the room with five Lannister guards. He says that Arya's father wants to see her, but Syrio sees through the ruse, and Ser Meryn orders Arya taken. Syrio intercedes to give her time to escape, and Ser Meryn orders him killed. Syrio takes on and defeats all five guards, killing some of them, but cannot do much against the fully armored Ser Meryn. He tells Arya to run and closes with his foe and almost certain death.
Arya runs into an underground storeroom and then crawls out a window. She sees the Tower of the Hand, with the doors bashed in and one of her father's guards dead at the door. She hears the sounds of fighting from within. She realizes she cannot go that way and heads to the stables instead. She sees Hullen at the entrance; he has been stabbed many times. Hullen tells her to warn her father and dies. Inside, there are more dead men: a groom, three Stark guards, including Desmond, and one dead Lannister guard. She sees her chest and searches through it for Needle. A stableboy sees her and tries to turn her in, but she stabs and kills him. She realizes the gates will be shut, but remembers the passage where she had seen the strange men.1 It takes her a while, but she finds her way down and walks towards freedom.","Sansa has been held in her room for three days. On the first day, she had gone to the queen and told her of Eddard's plan to send her away so that she might get her or the king to stop it. Cersei then had her escorted back to a secure room in Maegor's Holdfast, where she heard the fighting begin. Jeyne was placed in the room with her and told her everybody was being killed. On the second day, they heard all the bells in the city ringing to announce the death of King Robert. On the third day, Ser Boros comes to escort her to Cersei. They walk out of Maegor's Holdfast to the council chambers, where Ser Mandon admits them to see the queen, who is with Petyr, Pycelle, and Varys. Sansa asks after Jeyne's father, Vayon, and Pycelle looks embarrassed, which seems to indicate he was killed. Cersei is annoyed that Jeyne was placed with Sansa, and Petyr says that he will find a place for her. Cersei tells Sansa that Eddard was a traitor who tried to steal the throne and manipulates her through her ""love"" for Joffrey into writing a letter telling her brother not to take up arms.","Lord Commander Mormont and Ser Jaremy have arrived to examine the corpses Ghost discovered. Jon is there as well, and so are Chett, Sam, who represents Maester Aemon, and a dozen rangers including Dywen, Hake and Ketter. Earlier, Bass, the kennelmaster, tried to get the dogs to take a scent from the hand Ghost brought back, but they refused to do so. Chett is handling the dogs now, and they are fighting him and refusing to go near the corpses. Ser Jaremy recognizes the dead men as Othor and Jafer Flowers, both of whom were part of Ben Stark's ranging. Ser Jaremy thinks they must have been dead only a day, but Sam points out that the blood has dried up and they must have been dead longer. It is strange though, because there is no sign of rotting, or maggots, and no animals other than Ghost will get close. Both corpses also have bright blue eyes, though neither one's eyes were ever blue. Lord Commander Mormont orders the corpses returned to Castle Black so Maester Aemon can examine them and orders Ser Jaremy to scour the surrounding woods.
Bowen meets the group as they return to the Wall and tells Lord Commander Mormont that a raven has come. As Jon returns to his quarters, everyone from Ser Alliser to Donal Noye stares at him. He finds Pyp, Grenn, and Todder and learns that Robert is dead. He returns to Lord Commander Mormont's quarters, and the lord commander tells him about Eddard being arrested and charged with treason. He is in a daze for the rest of the day. Everyone knows what happened. He gets piteous looks, and Hobb gives him an extra helping at dinner. Matthar, Pyp, Grenn, Todder and Sam try to comfort him. He hears Ser Alliser slandering Eddard and attacks, leading to his being subdued and imprisoned.
After some time, Jon dozes off in his cell, and when he wakes up, it has gotten very cold and Ghost is scrabbling at the door. He opens the door and sees his guard dead with his head twisted around. He goes up to the Lord Commander's chambers and sees a dark shape going in. When he follows, he discovers it is the supposedly dead Othor.1 He hacks Othor's arm off as well as half of his face, but Othor keeps coming and so does the severed arm. Othor starts to strangle Jon, but Ghost saves him. Lord Commander Mormont stumbles out with an oil lamp, and Jon grabs it, torches the drapes, and throws the burning mass at Othor.","Robb has called the banners. The Karstarks are the last to arrive with 300 horse and 2,000 foot from Karhold. Bran watches them arrive on Hodor's shoulders with Maester Luwin. Hodor is carrying him around in a basket that the maester devised. Bran has been confined to the castle for his safety since the incident in the woods. Lord Rickard Karstark rides at the head of his men accompanied by his sons, Harrion, Torrhen, and Eddard. Other houses that have arrived in recent days include Glover, Mormont, Bolton, Hornwood, Cerwyn, Tallhart, and Umber. Robb hosts them each in turn. Maester Luwin tells Bran that the Karstarks bring the total to 12,000 men, of which 3,000 are horse. The houses Manderly and Flint will join Robb on the way south to the Riverlands. The castle and town are full to bursting, and Robb must march soon.
Bran decides to go to the godswood. Hodor carries him in the wicker basket on his shoulders. Some Karstark men stare at him, so he calls Summer to unnerve them. As he passes the forge, Bran sees Mikken hard at work. When he arrives, he gives a prayer for Robb, Catelyn, Arya, Sansa, Eddard, and Rickon and thinks back over the events of the last few days. Rickon has been wild since learning that Robb is leaving. He ran to the crypts with Shaggydog and slashed at the people who came after him with a sword. Shaggydog has been wild too, and they were forced to chain him up. Robb has grown greatly recently. His bannermen tried to test him. Roose Bolton, Robett Glover, and Maege Mormont all disputed his authority, while Medger Cerwyn and Halys Hornwood both tried to flatter him with gifts. Greatjon Umber was the worst, threatening to leave and then insulting Robb and unsheathing his sword until Grey Wind tackled him and bit off two fingers. After this incident, the Greatjon became Robb's staunchest supporter. Sansa's note arrived, and Robb was incredulous and wonders what is wrong with her. Bran says she lost her wolf, thinking back to when Lady's bones arrived at Winterfell.
As Bran finishes his prayers, the leaves rustle in the wind, and Osha comes in and says this means the old gods are listening, but are sad because they cannot watch over those in the south due to a lack of weirwoods. She has been working as a kitchen servant and comes to the godswood to pray from time to time. She also says that the gods have no power in the south because the weirwoods are gone. She has been trying to warn Robb that the Others are coming, but is being ignored. That is the reason she fled south, unlike Mance Rayder, who was resolved to stand and fight, which she considers a stubborn and stupid move by a Night's Watch deserter from the Shadow Tower. That evening, Bran hosts the Karstarks, and Rickard's sons mock his handicap. Two days later, Robb marches south with Hallis Mollen, Theon Greyjoy and his lords bannermen.","Drogo tells Daenerys that he has no intention now to invade the Seven Kingdoms and goes off to hunt. Daenerys summons Ser Jorah as Irri, Jhiqui and Doreah attend her and tells him that he must help convince Drogo to march. He promises that they will go home, but they must be patient. To cheer her up, he tells her that a caravan led by a merchant captain named Byan Votyris has arrived, and Daenerys decides to go see it. She is accompanied by Irri, Jhqui, Doreah, Aggo, Jhogo, Rakharo, Quaro and Ser Jorah. They wander about for a while, and then Jorah goes off to see if Illyrio has sent any messages.
Eventually, Daenerys comes across a wineseller hawking his wares. When he learns Daenerys's identity, he offers her a special cask of wine from the Arbor. Just then, Jorah returns and orders the merchant to open the cask and drink from it. The wine is poisoned, and the seller bolts instead, but is caught. Byan arrives and orders the man seized for the khal and gives the man's stock to Daenerys. They return to her quarters, and Jorah explains that a letter arrived from Illyrio warning that Robert had offered a lordship for her death and that of her son. She suddenly eyes her dragon eggs and gets a strange idea. She has Jorah light the brazier and take his leave. When he is gone, she thrusts the eggs into the fire, but nothing happens. When Drogo returns and learns about the assassination attempt, he vows to take the Seven Kingdoms for his unborn son.","Catelyn and Ser Brynden are with Ser Wendel and Ser Wylis Manderly and their 1,500 levies, which include twenty knights and two hundred mounted lances. Their father, Lord Wyman Manderly, has stayed behind in White Harbor to see to the defenses, largely because he has grown too fat to sit a horse. Robb's host is just coming into view. She rides through to Moat Cailin with Ser Wendel and Ser Brynden and finds Robb with Grey Wind surrounded by his lords bannermen, including Ser Helman Tallhart, Greatjon Umber, Robett and Galbart Glover, Roose Bolton, Halys Hornwood, Rickard Karstark and Theon Greyjoy. She informs him that Ser Rodrik is on his way north to serve as castellan of Winterfell while Robb is in the south. Catelyn sends the bannermen away to speak to Robb alone.
Catelyn fears for Robb's safety and wants to send him back to Winterfell, but knows she cannot without causing him to lose face. Robb informs her that a letter arrived from Sansa telling him not to fight. Catelyn realizes right away that Sansa is now a hostage. Robb has eighteen thousand men, but is afraid about what might happen to Eddard and Sansa. Catelyn assures him that victory in the field is now the only option. Robb tells Catelyn of what has transpired in the riverlands. Jaime marched up the Golden Tooth and smashed a force led by Lord Vance and Lord Clement Piper. Lord Vance was slain, and Lord Clement fell back to Riverrun. Meanwhile, Lord Tywin came up from the south with an even larger army, which ambushed Lord Beric's men from King's Landing. Ser Raymun Darry and most of the men from Winterfell were killed. Lord Beric may have escaped, but no one knows for sure.
Robb has ordered Howland Reed to bleed any Lannister host that comes north, but knows that Lord Tywin is too smart to try and will stay in the riverlands taking castles one by one to isolate Riverrun. Therefore, Robb has no choice but to ride south to meet him. Robb's plan is to split his horse and foot. The foot will march on Tywin and draw him in while the horse races to Riverrun to surprise Jaime. He plans to give the Greatjon the foot while he commands the horse, but Catelyn points out that the Greatjon is too brash and Robb decides to give Roose Bolton the command instead. Robb tells Catelyn he will prepare an escort to take her back to Winterfell, but Catelyn says that with her father dying and her brother surrounded, she must go to them.","Tyrion approaches a Lannister camp of 20,000 men with Bronn and 300 clansmen of the Stone Crows, Moon Brothers, Black Ears, and Burned Men. Gunthor stayed in the mountains to rally the other clans to Tyrion's cause. Tyrion decides to ride ahead with Shagga, Conn, Chella, Ulf, and Timett, representatives from each of the mountain clans with Tyrion. They reach a checkpoint and are escorted to the main camp of Lord Tywin's army. Ser Flement Brax greets them and takes them to Tywin. Lord Tywin has taken as his headquarters the very inn from which Tyrion was abducted, and Tyrion sees Masha's corpse hanging from a gibbet.
Tyrion enters the common room to find Lord Tywin sharing a pitcher of ale with his brother, Ser Kevan. Tywin greets Tyrion coldly and treats him with disdain throughout their conversation. Tyrion learns that Tywin has destroyed the small parties that Edmure sent to stop Gregor's raids while Jaime met Edmure before the walls of Riverrun and defeated and captured him. Lord Tytos Blackwood managed to extricate the remains of Edmure's force and get inside Riverrun, which is now under siege. Lord Tywin took Lord Tytos's seat of Raventree and Lady Shella Whent yielded Harrenhal for want of men to defend it. Gregor has burned out the Pipers and the Brackens. In addition to Riverrun, only the Mallisters in Seagard and Walder Frey at the Twins remain to resist the Lannisters. Marq Piper and Karyl Vance are loose in the Lannister rear, raiding. Tyrion learns of Robert's death and Eddard's imprisonment. Lord Beric and Thoros are also still alive and harassing the rear. Just then, the clansmen burst in on the meeting. Tyrion introduces them and begins to explain why they are there when a messenger arrives from Ser Addam Marbrand stating that Robb is moving south. Lord Tywin decides to meet him and finish him quickly so that he can deal with Stannis. He tells the clansmen that if they ride with him, all his son promised and more will be theirs.","Sansa arrives for the first court of King Joffrey's reign. She has been given free rein of the castle, but is always ""escorted."" The walls of the throne room have been stripped of Robert's hunting tapestries. Three Kingsguard; Ser Mandon, Ser Meryn and Ser Preston, stand at the foot of the throne and twenty or so lords wait for Joffrey to arrive, including Lord Gyles Rosby. Other attendees include Jalabhar Xho, Horas and Hobber Redwyne, Ser Aron Santagar, Ser Balon Swann and Ser Dontos Hollard. Grand Maester Pycelle, Varys, and Petyr assume their seats on the small council and then Joffrey enters with Cersei, Ser Barristan, Ser Boros and Ser Arys.
Joffrey has Grand Maester Pycelle read off a long list of those who must come to King's Landing to swear fealty to Joffrey or be named traitors. These include Stannis Baratheon and his wife and daughter;1 Renly Baratheon; Nestor Royce and his son Albar; Yohn Royce and his sons Andar and Robar; Lysa and Robert Arryn; Mace Tyrell and his brothers, uncles, and sons;2 Hoster, Brynden and Edmure Tully; Beric Dondarrion and Thoros of Myr; Doran Martell; Bryce Caron; the great lords of the riverlands, Jonos Bracken, Karyl Vance, Tytos Blackwood, Shella Whent, Walder Frey and his heir Ser Stevron, and Jason Mallister; and Robb, Catelyn, Brandon, Arya and Rickon Stark. He names Lord Tywin the new Hand of the King and names Cersei to the small council as queen regent. Furthermore, he elevates Janos Slynt to Lord of Harrenhal and to the small council. Lord Janos comes in at that point with two of his sons3 and takes his seat on the council.
Next, the queen relieves Ser Barristan as Lord Commander of the Kingsguard and names Jaime to the post. Barristan is stunned, as the oath is for life. He talks of how he had always dreamed to be a Kingsguard and joined in his twenty-third year. Ser Gerold Hightower heard his vows, and he served alongside the likes of Prince Lewyn Martell and Arthur Dayne, protecting three kings, Robert, Aerys II, and Aerys's father Jaehaerys II. Cersei offers him land near Lannisport, but Barristan refuses, saying he will die a knight and walks out after insulting the other Kingsguard and Joffrey. Joffrey orders Barristan seized for questioning after he leaves, and Lord Janos says he will see it done. Cersei names Sandor Clegane to replace Ser Barristan on the Kingsguard. He accepts, but refuses to take a knight's vows, becoming the first member not to be a knight. When the pronouncements are over, Sansa comes forward and begs for mercy for Eddard. Joffrey and Cersei relent and say his life may be spared if he confesses his crimes.","Eddard lies in the dungeon for days, delirious with pain and infection. He thinks of events past and present and ponders the future and his own foolishness. Eventually, his mind wanders to the year of the false spring when he was eighteen and down from the Eyrie for the great tournament at Harrenhal. He remembers Brandon, Robert going wild in the melee, and Jaime Lannister kneeling in front of the king's pavilion and taking the vows of the Kingsguard with all six of his new brothers in attendance.1 Prince Rhaegar Targaryen owned the field that day, unhorsing all comers, including Brandon, Yohn Royce, and Arthur Dayne. Eddard remembers the moment when all the smiles died as Rhaegar rode past his own wife, Elia, to name Lyanna queen of love and beauty and give her a crown of winter roses. Thoughts of Lyanna once again make Eddard consider the promise he made her as she lay dying.
