"Gared attempts to convince his commander, Ser Waymar Royce, to turn back, as the wildlings are all dead according to Will. Ser Waymar mocks him for his unease, but Will notices that Gared is afraid despite having been in the Night's Watch for forty years. Will is uneasy also. He has spent four years in the Watch and been on at least a hundred rangings, but this is the first time the haunted forest has ever terrified him. They have been traveling north for nine days pursuing wildling raiders, and every day has been colder and worse than the day before. Ser Waymar refuses to turn back, however. The youngest son of an ancient house with too many heirs, he is young and has only been in the Watch for half a year. Gared insists that they have done all that Mormont ordered and that they could already have a two week ride ahead of them if it snows. Waymar asks Will to repeat what he saw again. Will had been a poacher before joining the Watch, until Mallister freeriders had caught him and given him the choice of losing a hand or going to the Wall. He is the best in the Watch at moving through the woods unseen. He reports that the wildling camp is two miles away and that he spied eight men and women there. None of them moved an inch the entire time he surveyed the camp, including a spotter up in the trees. Gared says they must have been killed by the cold and that he had seen a man freeze during the last winter and also during the one before that when he was a boy.1 Ser Waymar points out that it has not been cold enough for a man to freeze and orders Will to take him to the camp.
They ride into the night, before dismounting at Will's suggestion to go the rest of the way. Gared becomes uneasy once again, but Waymar only mocks him and tells him to watch the horses while he and Will continue on foot. Gared wants a fire, but Waymar refuses so as not to draw enemies. Gared claims it will keep away some enemies such as bears, direwolves, and ""other things,""2 but Waymar is firm. As they reach the campsite, Will is shocked to see that the bodies are gone. Waymar refuses to go back to Castle Black from his first ranging a failure, and so he orders Will to climb a tree and look for any sign of the wildlings. As he climbs, Will hears Ser Waymar issue an uncertain challenge. The Others, however, make no sound as they glide through the forest towards Ser Waymar. Will sees them briefly, but assumes it was a mirage. Waymar calls out to Will and asks why it is so cold, and Will realizes that it is now freezing. An Other comes out of the shadows to challenge Waymar. As Will watches, five more emerge silently to surround Waymar, but the knight does not see them. The newcomers watch as Waymar and the first Other fight. After a series of blows, the Other wounds Waymar in the side. Finding a last ounce of strength, Waymar shouts ""For Robert!"" and lunges forward, but when his sword meets the Other's blade, it shatters. Waymar falls to his knees screaming and holding his face, and the Others all move in and butcher him. Will stays in the tree a long while after the Others depart before gathering the courage to come down. He decides to take the twisted, broken sword as proof of what happened and hopes that if Gared does not know what to make of things, then Mormont or Maester Aemon will. As Will stands, he sees Ser Waymar standing over him, his one good eye now sporting a burning blue pupil.3 Waymar grabs Will's throat and chokes him to death. His grip is icy cold.","It is the ninth year of summer.1 Lord Eddard Stark and twenty men2 are riding out to a holdfast to dispense the king's justice. Eddard's son Bran is excited because he has never been allowed to come along before. The man was captured in the hills outside a small holdfast. Robb believes the man must be a wildling sworn to Mance Rayder, the King-Beyond-the-Wall, and that makes Bran think of the tales Old Nan has told him about wildlings, including that they are slavers, slayers, and thieves, consorted with giants and ghouls, and lay with the Others to sire half-human children. When they arrive at the holdfast, they discover the accused is an old man dressed in black who has lost his ears and a finger to frostbite.3 Bran sits between Robb and Jon with the banner of the Starks of Winterfell, a grey direwolf racing on a white field, flapping over their heads. Lord Eddard questions the man briefly, and then Theon Greyjoy brings him his sword, Ice, forged of Valyrian steel. After handing his gloves to the captain of the guard, Jory Cassel, Eddard executes the man in the name of Robert Baratheon, the First of his Name, King of the Andals and the Rhoynar and the First Men, Lord of the Seven Kingdoms and Protector of the Realm, by the word of Eddard Stark, Lord of Winterfell and Warden of the North. The head lands by Theon, who laughs and kicks it away. Jon, Bran's bastard brother, calls Theon an ass and compliments Bran on his poise during the execution.
On the way back to Winterfell, Robb comments that the deserter died bravely, but Jon notes he was already paralyzed by fear.4 Robb and Jon race ahead, but Bran holds back. Eddard comes up to him and explains that the man was a deserter from the Night's Watch and the penalty for desertion is death. He also explains that he had to execute the man himself because his family are of the blood of the First Men, and the First Men believe that the man who passes sentence should also carry it out. At that point, Jon reappears and beckons Eddard to come see what he and Robb have found. The party is shocked to see they have discovered a dead direwolf and her five live cubs, three male and two female.5 Theon comments that there has not been a direwolf seen south of the Wall in two hundred years, and Hullen, the master of horse, is uneasy that a direwolf has been discovered in the realm after so long. Many in the party are further disquieted when it is revealed the direwolf has an antler stag lodged in its throat, the apparent cause of death.6 Theon prepares to kill the pups, but Bran and Robb protest. Hullen's son, Harwin, points out they cannot keep the pups, and Hullen and Eddard agree. Jon points out that the number and gender match Eddard's children7 and says they were meant to have the pups. Bran is impressed that Jon has referenced both of Bran's sisters and even baby Rickon and given up any right to a wolf for himself to save the pups. Eddard relents and tells Jory and Desmond to gather up the pups. A little farther on, Jon hears something and goes back to discover a sixth cub, white with red eyes, which he takes for himself.8","Catelyn comes to Eddard in the godswood. It consists of three acres of untamed forest in the heart of Winterfell, a dark and primal place where the First Men worship the old gods. Catelyn does not like coming to the godswood, for she was raised in the Faith. Eddard has built a small sept for her use, but he still worships the old gods. Eddard is cleaning Ice beneath the heart tree, a great weirwood with a face carved in it. In the south, all the weirwoods have been cut down save on the Isle of Faces, where the green men still maintain them, but every godswood in the North still has its heart tree. The godswood of Winterfell has existed since before Brandon the Builder constructed the castle. Eddard asks after the children, and Catelyn tells him they are in the kitchen arguing over names for the direwolves. Arya and Sansa are excited, but Rickon is still a little afraid. Eddard says he must learn to face his fears, because ""winter is coming."" Those words give Catelyn a chill. Every house has its own words, or motto, and ""winter is coming"" are the words of House Stark. Eddard turns the conversation to the deserter he executed.1 He was the fourth deserter Eddard has been forced to execute in the last year and was half-mad. Catelyn admires Ice. It was forged in the freehold of Valyria before it was destroyed by the Doom, though the name dates back to the age of heroes, when the members of House Stark ruled as the Kings in the North. Ben has written to say that the strength of the Night's Watch has fallen below a thousand thanks to desertions and losses from rangings, and Eddard fears he may need to call his banners to deal with Mance Rayder. Catelyn fears for Eddard going beyond the Wall, for there are supposed to be many terrors in the Far North, but Eddard reassures her that the Others and the children of the forest have been gone for eight thousand years.
Catelyn tells Eddard the news she came to deliver, which is that Jon Arryn is dead. Eddard takes the news hard. He had fostered with Lord Jon at the Eyrie in his youth along with King Robert Baratheon. When Aerys II Targaryen, the mad king, had demanded that Lord Jon deliver the heads of Robert and Eddard, Lord Jon raised his moon-and-falcon banners in rebellion instead.2 Fifteen years ago they became brothers as well when Eddard and Jon married Lord Hoster Tully's daughters.3 Robert wrote the letter bearing the news of Jon's death himself and explained that Jon took ill so quickly that Grand Maester Pycelle was powerless to aid him.4 Jon's wife5 has taken their son6 and returned to the Eyrie. Catelyn wishes she had gone to Riverrun instead, as the Eyrie is high and lonely and her sister will need friends and family to comfort her. Eddard points out that her uncle, Brynden, will be there, as Jon named him Knight of the Gate, but Catelyn fears that is not enough. Eddard suggests she go to her, but Catelyn says she cannot because the king is coming to Winterfell. Eddard is pleased that the king is coming, and decides to have Maester Luwin send a swift bird to the Wall so his brother, Ben, will be able to see the king too. Catelyn says that there will probably be a hundred knights with their retainers and fifty freeriders with the king's party. Queen Cersei and her children7 are coming as well, and so are the queen's brothers.8 This gives Eddard pause, as he resents the Lannisters of Casterly Rock for coming to Robert's cause late. Still, he is pleased at the thought of seeing the children, as the youngest, Prince Tommen, was still a suckling babe last Eddard saw him.9 Eddard says he will arrange for Jory to lead an escort of honor to meet the royal party on the kingsroad and wonders how they will take care of such a large party on such short notice.","Viserys Targaryen gives his sister, Daenerys, a fine silk dress so she will look a princess that night. The dress is a gift from Illyrio Mopatis, who has been their host for half a year. Daenerys wonders why Illryio, a dealer in spices, gemstones, dragonbone, and contraband that would gladly sell his closest friend for the right price, is being so helpful. Viserys says it is because Illyrio knows there will be a reward when he comes into his throne. Daenerys is not so sure, but does not want to make Viserys angry and ""wake the dragon."" Viserys is preparing to present Daenerys to Khal Drogo, and hopes he will take her as his wife. He warns her not to fail him and wake the dragon and twists one of her nipples for emphasis. After Viserys leaves, Daenerys looks out over the towers of Pentos, listening to the red priests at their nightfires and the children playing in the streets. She thinks of Westeros, the home she never knew. Viserys talks of Westeros all the time, speaking of how it was stolen from them and telling her of wondrous places such as Casterly Rock, the Eyrie, Highgarden, the Vale of Arryn, Dorne, and the Isle of Faces. Viserys was eight when they fled the Seven Kingdoms, but Daenerys was still in her mother's womb. Viserys has also told her of the events that led to their exile. How they were evacuated in the dead of night to Dragonstone, how Rhaegar battled the Usurper in the waters of the Trident and died for the woman he loved,1 how King's Landing was sacked by the ""Usurper's dogs,"" lords Lannister and Stark,2 how Princess Elia begged for mercy as Rhaegar's heir was taken from her and murdered,3 4 and how the Kingslayer opened her father's throat in the throne room with a golden sword.5
Daenerys was born nine months after the flight to Dragonstone, during a vicious storm that destroyed the Targaryen fleet. Her mother6 died giving birth to her, an event for which Viserys has never forgiven her. The Usurper's brother7 was sailing for Dragonstone, the last remaining stronghold of House Targaryen, with a newly built fleet, and the garrison was ready to sell her and Viserys and surrender. Ser Willem Darry and four men were able to spirit them away to Braavos before that could happen. Ser Willem soon grew ill and was bedridden for several years before dying. The servants stole what little money was left at his death, and Viserys and Daenerys took to wandering the Free Cities, staying briefly in Myr, Tyrosh, Qohor, Volantis, and Lys in turn. At first, they were welcomed in the halls of the powerful, but as the years passed, they were gradually shunned and forced to sell off their few remaining treasures to survive, including their mother's crown, and Viserys became known as the beggar king. Viserys lusts after the Seven Kingdoms, but all Daenerys wants is to return to the house with the red door and the lemon tree in Braavos where they had lived with Ser Willem.
Servants come to bathe Daenerys, and one of them talks all the while about how lucky she is to be marrying Drogo. Daenerys had always assumed she would marry Viserys, as the Targaryens had been marrying brother to sister for centuries to keep their Valyrian lineage pure. Daenerys dresses and joins Viserys and Illyrio for the journey to Khal Drogo's manse. Viserys is in a good mood on the trip, certain that ten thousand riders from Drogo's khalasar will be enough to reclaim the Seven Kingdoms. He is sure that he will have support from Tyrell, Redwyne, Darry, and Greyjoy, none of which are fond of the Usurper, and he believes that Dorne will rise to avenge Elia as well.8 Illyrio eggs him on, telling Viserys that his agents in the Seven Kingdoms report the people eagerly await their rightful king's return. Khal Drogo's manse is an immense structure with nine towers right on the bay. It was a gift from the magisters of Pentos, who have bought off the Dothraki to stop them from looting the city, though they claim not to fear the Dothraki because the red priests have assured them the Lord of Light will not let them breach the walls. An Unsullied in Drogo's employ meets them at the gate and lets them in. Most of the guests at the party are Dothraki, but there are men from the Free Cities of Pentos, Myr, and Tyrosh as well, and also a few from Ibben and the Summer Isles. Illyrio points out some of the more notable guests, including Drogo's bloodriders,9 Khal Moro and his son, Rhogoro, the brother of the Archon of Tyrosh, and Ser Jorah Mormont. Daenerys is surprised that a knight would be there, and Illyrio explains that he fled Westeros after selling two poachers into slavery. Viserys says he must speak to Ser Jorah. Illyrio points out the khal and leaves to bring him over. Daenerys is terrified by the sight of him and wants to leave, but Viserys rants at her and hurts her and tells her they need his khalasar to retake the Seven Kingdoms. Daenerys smiles and stands up straight at Viserys's command as Illyrio brings Drogo over to them.","The King's party, three hundred strong,1 arrives at Winterfell beneath the crowned stag of House Baratheon. Eddard recognizes Ser Jaime Lannister, Sandor Clegane, and Tyrion Lannister immediately, but the king himself, flanked by two knights of the Kingsguard2 looks practically a stranger. Eddard has not seen the king since Greyjoy's Rebellion nine years ago, when Eddard and Robert joined forces to deal with Balon Greyjoy, who proclaimed himself king of the Iron Islands, and Eddard took Balon's son, Theon as his ward. Since that time, Robert has grown fat. Robert greets Eddard and Catelyn warmly, and Eddard greets Queen Cersei and her children3 as well. With the greetings out of the way, Robert immediately demands to go down to the crypts to pay his respects. Cersei begins to protest, but Jaime stops her. Once there, Eddard and Robert walk to the end of the rows of graves to where Eddard's father, Lord Rickard, his elder brother, Brandon, and his sister, Lyanna, are buried. Brandon was strangled by the order of Aerys II Targaryen days before he was supposed to wed Catelyn while Lord Rickard was forced to watch.4 Lyanna was sixteen when she died, and she was supposed to have married Robert. Robert pays his respects to the woman he loved and laments that she was buried deep underground. Eddard reminds the king that he was with Lyanna when she died and expressed a desire to be buried with her father and brother. He also remembers the promise he made to her, and how the fear went out of her eyes when he made it.5 6 Eddard's companions found him clutching her body some time later, and the crannogman Howland Reed had to take his hand from hers. Robert tells Eddard how he vowed to kill Rhaegar for what he did to Lyanna. Eddard reminds Robert that he did so, and Robert laments that he could only do so once. It had been during a battle at a ford on the Trident. Robert and Rhaegar met in single combat in the river, until Robert landed a killing blow to Rhaegar's chest with his warhammer.
Robert tells Eddard that Lord Jon's sickness came on suddenly. He had been healthy and fit on the tournament for the nameday of Robert's son, but two weeks later he was dead. Robert fears that his death drove Lysa mad. She refused to let her son, Robert, be fostered by Lord Tywin Lannister at Casterly Rock and withdrew to the Eyrie in the dead of night. Lord Tywin had never taken a ward before, and Robert feels Lysa should have been honored. Eddard offers to foster him at Winterfell, but Robert says that he cannot offer Robert to another now that Tywin has accepted. Robert also says that Jon's son will not be granted the title of Warden of the East that has always belonged to House Arryn. Eddard is surprised, but Robert says that a sickly boy cannot be a war leader. Eddard points out that the title is only an honor when the realm is at peace, but Robert will hear no more of it. Robert explains that he came north to make Eddard the Hand of the King to replace Lord Jon. The Hand is the second most powerful man in the kingdom, speaking with the king's voice, commanding his armies, drafting his laws, and even dispensing justice from the Iron Throne in the king's name if he is indisposed. Eddard does not want the position, but Robert is insistent and even plans to betroth his son Joffrey to Eddard's daughter, Sansa. Eddard asks for time to think the offer over.","Jon Snow is sitting near the back of the great hall in Winterfell during the welcome feast for King Robert.1 Earlier, he got a good look at the royal family as they came in. Eddard escorted in Queen Cersei, followed by Catelyn and Robert, then Rickon, Robb and Princess Myrcella, Arya and Prince Tommen, Sansa and Joffrey, Jaime and Tyrion, and, finally, Benjen Stark and Theon Greyjoy.2 Jon has been drinking for the entire feast, and is now quite drunk. Ghost peeks his head up from under the table looking for food, and Jon gives his direwolf half a chicken to devour. A dog comes up to challenge Ghost for a share, but all it takes is a baring of his fangs to make the dog slink away. Ben Stark comes over to see Ghost. He remarks on how quiet the wolf is, and Jon explains that he never makes a sound, which is how he got his name. Ben admires Jon's keen skills of observation and remarks that he could use a man like him on the Wall. Jon, drunk, asks to join the Night's Watch. Ben tells him the Wall is a hard place for a boy, but Jon protests that he is nearly a man and that bastards have to grow up faster than other children. He also talks of Daeron Targaryen, who conquered Dorne at the age of fourteen, but Ben points out that the conquest only lasted a summer and that he had lost ten thousand men conquering the place and another fifty thousand trying to hold it. Furthermore, he was dead at eighteen.
Jon still wants to join the Watch, knowing there is no place for him at Winterfell in the long run as a bastard. Ben tells him that the members of the Watch are not allowed to marry or father children and that he should know what he is giving up and father a few bastards of his own first. Jon hotly states he will never father a bastard, which draws all eyes to him. Jon runs out of the hall in tears. Outside, he runs into Tyrion perched on the ledge above the door. He has drunk too much wine and come out for air. As Jon watches, he vaults down from the ledge and comes over to see Ghost. Ghost bares his fangs at Tyrion at first, but on Jon's command lets Tyrion pet him. Tyrion tells Jon that he should make being a bastard his strength so that fact cannot be used against him by his enemies. When Jon asks what he could possibly know about being a bastard, Tyrion replies that all dwarfs are bastards in their fathers' eyes. His mother3 died giving birth to him and his father4 treats him terribly for it. Tyrion goes on to say that all dwarfs are bastards, but that all bastards need not be dwarfs. As he walks back into the hall, the light throws Tyrion's shadow across the yard, and for an instant, he looks as tall as a king.","Catelyn and Eddard are in their bedchamber after making love. Catelyn's bedchamber is always warm thanks to the hot springs that run under Winterfell and course through the walls. The warmth reminds her of Riverrun and days spent with Lysa and Edmure. Eddard states his firm resistance to becoming Hand of the King, but Catelyn cautions him that he must, for Robert may come to suspect his loyalty if he says no. Eddard is still not convinced, saying that Robert would never harm him and Sansa is too young to be betrothed. Catelyn points out that she was twelve when she was betrothed to Brandon, and Eddard wishes that Brandon was there, as he was the one raised to rule. Desmond interrupts and says Maester Luwin is waiting for an audience. He enters and explains that someone left a small box with a Myrish lens and a note in his chambers. He suspects a member of the King's party. The message is for Catelyn from Lysa, written in a secret language she and Catelyn invented as children, and claims that Cersei murdered Jon.1 Catelyn says that Eddard must become the Hand now so he can investigate the murder, and he reluctantly agrees. He laments that his father went south at the summons of a king too and never returned.2
Eddard orders Catelyn to stay and rule the North in his stead and prepare Robb to rule one day. He will also leave Rickon, as he is still a baby, but Arya, Sansa, and Bran will go south with him. Catelyn begs Eddard to leave Bran, her favorite, as he is only seven, but Eddard points out that he was eight when sent to foster at the Eyrie. Furthermore, Ser Rodrik has informed him of bad blood between Robb and Joffrey, and Eddard feels Bran can help bridge the gap by becoming close to the royal family. Maester Luwin asks what is to be done with Jon Snow. Catelyn has always hated her husband's bastard and resented him for it. She has forgiven him for fathering a bastard, as they were apart for their first year of marriage while Eddard fought in the war and she remained at Riverrun pregnant with Robb. What she cannot forgive is how Eddard treated him like a trueborn son and brought him to live at Winterfell. She heard rumors that Eddard fathered Jon on Ashara Dayne when he went to Starfall to return the sword3 of Ser Arthur Dayne, the deadliest knight of the Kingsguard, after slaying him in single combat.4 Catelyn asked him about those rumors once, and it was the only time Eddard ever frightened her. He told her never to ask about Jon again and all she needed to know was that Jon was of his blood.5 Eddard also wants Jon to remain at Winterfell, but Catelyn refuses to have him. Maester Luwin mentions that he had asked Ben about joining the Night's Watch, and Eddard agrees that this is the best solution.","Arya is doing needlework under the eye of Septa Mordane along with Sansa, Beth Cassel, Jeyne Poole, and Princess Myrcella. She is embarrassed by the poor quality of her work and runs off. Arya resents that Sansa is beautiful and more polished than she is. Nymeria greets her at the base of the stairs. Arya named the pup after Nymeria, the warrior queen of the Rhoyne who led her people across the Narrow Sea. Sansa named hers Lady.
Arya decides to go watch the boys sparring in the practice yard. She runs into Jon and Ghost, and they watch together. Bran and Tommen are fighting each other with heavily padded wooden swords under the watchful eye of Ser Rodrik Cassel, the master-at-arms, and a group of spectators, including Robb and Theon. Jon teases her as they watch. They have always got on well together, and are the only two of Eddard's children with Stark features, the other children all inheriting the Tully look. Jon also points out Prince Joffrey in the crowd, notes his arms, divided between the Baratheon stag and the Lannister lion, and comments that the Lannisters are over proud to make the queen's arms equal to the royal arms.
