Eddard urges Sansa forward and tells her to say what happened. Sansa lies and says she does not remember, causing Arya to attack her. Cersei takes this as proof of Arya's wildness and demands that Robert punish her. King Robert decides that he and Eddard should discipline their children privately. Cersei brings up the direwolf. Nymeria is missing, so Robert is content to leave it at that. Cersei announces a reward for the man who brings her Nymeria's pelt and taunts Robert for not being a man. Cersei says they should execute Lady and Robert agrees, saying the animal would have turned on Sansa eventually anyway. Eddard challenges Robert to do it himself, but Robert leaves, and Eddard says he will do the deed if it must be done. He has Jory fetch Ice and uses it to kill Lady. He tells Jory to have four guards take the body back to Winterfell for burial. As he is returning to his quarters, Sandor comes back from searching. He found Mycah and rode him down.","Bran is falling in darkness. A voice tells him to fly, but he does not know how. The speaker is a crow who lands on his shoulder and exhorts him to fly. He looks down. He sees all of Winterfell, Maester Luwin looking at the stars, Hodor carrying an anvil, Robb practicing with a real sword. The weirwood at Winterfell turns its eyes to look at him knowingly. He sees Catelyn and Ser Rodrik on a galley with a knife; he sees Eddard plead with Robert while Sansa cries and Arya holds her secrets; over them all are two shadows, one dark as ash with the face of a hound and the other armored like the sun, golden and beautiful.1 Over both looms a giant of stone with blood pouring out of his visor.2He looks across the Free Cities and the Dothraki Sea to Vaes Dothrak, and beyond to the Jade Sea to Asshai, where dragons stirred.3 Finally, he looks north and beholds the Wall and Jon and beyond that in the heart of winter something so terrible that it makes him cry. The crow tells him this is why he must live, because winter is coming. He notices that the crow has three eyes. The three-eyed crow pecks at his forehead.4 The ground rushes up to meet him, but he flies at the last second. He awakes in his room in Winterfell. A serving woman runs off to tell everyone that he is awake. He sees his direwolf atop him and is comforted by his warmth. By the time Robb gets to the room, he has decided to name the direwolf Summer.","Catelyn and Ser Rodrik approach King's Landing on Storm Dancer, captained by Moreo Tumitis. Ser Rodrik has been sick for most of the voyage, and finally had to shave his whiskers after befouling them one too many times. Once ashore, they plan to contact Ser Aron Santagar, master-at-arms for the Red Keep, whom they hope can identify the dagger. Ser Rodrik emphasizes the need for secrecy and that there are those at court who would recognize Catelyn on sight. Catelyn realizes he means Littlefinger, Lord Petyr Baelish. He had been a ward to Catelyn's father and a brother to Catelyn herself. He wanted more than that, however, and when he learned that Catelyn was to marry Brandon Stark, he challenged the older man to a duel. Brandon was twenty, Petyr scarcely fifteen, and there was no hope that he could prevail. Catelyn begged Brandon to spare his life, so he left Petyr with only a scar. Catelyn's father sent him away after that. He wrote Catelyn a letter after Brandon was killed, but Catelyn did not read it. Rodrik mentions that Petyr is now on the small council, and Catelyn responds that she always knew he would rise high. They decide that Ser Rodrik will go to the castle and fetch Ser Aron while Catelyn waits for him in a safe place.
Upon going ashore, Catelyn and Ser Rodrik choose an inn recommended by Captain Moreo, and Ser Rodrik departs for the Red Keep. Catelyn falls asleep and wakes to pounding on her door. She opens it to discover men of the City Watch who are under orders to escort her to Lord Petyr. When she arrives, Petyr informs her that he learned of her arrival from Lord Varys, who will join them shortly. Varys went to Petyr because he is master of coin, and most of the small council is gone, with Ser Barristan and Lord Renly off escorting King Robert and Lord Stannis gone to Dragonstone. Also, Varys knew that Petyr was friends with Lysa. Petyr asks why Catelyn is there and is not convinced by her explanation that she wanted to see her husband, as the Tully words are ""Family, Duty, Honor,"" and Catelyn would never leave her assigned post. Varys arrives and asks after the dagger, which he discovered through the ""whispering of little birds"" after Ser Rodrik met with Ser Aron, both of whom left the castle and are waiting for Catelyn at the inn.1 She pulls the dagger out, and Petyr reveals it was his until he lost it at the tournament held on Prince Joffrey's name day when Ser Loras Tyrell unhorsed Ser Jaime Lannister. He says he lost the dagger to Tyrion Lannister.2 3","Jon fights a training match with Grenn, whom he defeats easily. Jeren and Todder drag Grenn off while Ser Alliser Thorne berates Jon for showing fatigue. Ser Alliser has nothing but scorn and hatred for all of the trainees. Ser Alliser ends the training session, and the trainees all go to the armory. Jon also has scorn for all the trainees for their weaknesses and has made no friends. He feels particularly alone as Benjen is gone too. Three days after arriving, he learned that Ben was leading a ranging of six rangers.1 Jon begged him to go along, but Ben refused. The next morning he watched the group leave. Grenn confronts Jon along with Todder and two other recruits2 over the beating in the yard. Jon gets smart with them and a fight breaks out, which is stopped by the blacksmith, Donal Noye. Donal berates Jon for fighting with his brothers. He reminds Jon he is not the only bastard on the wall; Jeren is the bastard of a septon, while Cotter Pyke, commander of Eastwatch by the Sea, is the son of a tavern wench. Jon refuses to acknowledge the trainees as brothers, and Donal reminds him that the Watch is his new life. Jon reflects bitterly that Donal has no place to talk about giving up life. He had smithed for Stannis Baratheon and only came to the wall as an old cripple after losing his arm at the siege of Storm's End. Jon says the other trainees all hate him because he is better than them, and Donal says it is actually because he is a bully, thrashing the others all over the yard and leaving them no dignity. Jon feels ashamed and guilty of his actions.
Jon leaves and stares at the Wall until Tyrion comes by. Jon has not seen him much since arriving, as he is an honored guest of the Lord Commander and spends his time with the officers. Tyrion is surprised that Ghost is not with Jon, and Jon explains that he must keep the wolf chained during training. They discuss Ben, who is long overdue to return from his ranging. He had set out not long after arriving at Castle Black with six rangers to look for Waymar Royce. Many rangers have failed to return from the Far North of late.3 They go to the mess to eat, but Jon is soon summoned by Ser Alliser to see Lord Commander Jeor Mormont. Lord Commander Mormont gives Jon a letter from Robb stating that Bran has woken up and will live, though crippled. Jon is overjoyed and runs back down to the mess to celebrate with Tyrion. He sees Grenn and apologizes to him and offers to help him improve. Ser Alliser scolds Jon for trying to do his job, and Jon mocks him, causing Ser Alliser to leave in a fury.","Eddard arrives at King's Landing and is informed by the king's steward that the small council is meeting and would like him to make an appearance. After leaving instructions with Vayon, he changes and goes to the council chamber, where Lords Renly, Petyr, and Varys and Grand Maester Pycelle are waiting for him. Eddard asks after the other members and is informed that Lord Stannis has left for Dragonstone and that Ser Barristan is guarding Robert. When Eddard suggests waiting for Robert, he is informed that Robert rarely sits in on council meetings. Renly presents a command from Robert stating that he will hold a tournament in Eddard's honor in which the winner receives forty thousand gold dragons, second place receives twenty thousand, the victor of the melee receives another twenty thousand, and the victor of the archery competition receives ten thousand. When Pycelle asks Petyr how this is to be paid for, he says that they will have to borrow from Lord Tywin because the treasury is empty. The crown is over six million gold pieces in debt, with the largest part owed to Lord Tywin and the rest owed to Lord Tyrell, the Iron Bank of Braavos, several Tyroshi trading cartels, and even the Faith. Eddard is stunned, as Aerys II had left a treasury flowing with gold, and cannot believe that Lord Jon would have let Robert beggar the realm. Pycelle says that Robert often disregarded Jon's advice. Eddard means to convince the king to call the tournament off, but the other counselors tell him it will be a futile gesture. Eddard angrily calls a halt to the meeting, saying he is tired from the journey, and leaves.
Eddard watches the king's party make its way into the castle. Eddard stayed at the head of the column after the incident on the Trident, while Robert confined himself to the wheelhouse and stayed perpetually drunk. Sansa blames Arya for what happened to Lady, while Arya has brooded silently since the death of Mycah. Petyr approaches Eddard as he is heading back to his rooms and bids him follow in another direction. When Eddard asks where they are going, Petyr only tells him that his wife is waiting for him. They go out the castle and climb down a hidden ladder carved into the cliff. At the bottom, they mount horses and ride to a brothel that Petyr owns, and Petyr tells Eddard that his wife is within. Eddard is angered when he realizes they have come to a brothel and insults Petyr, but Ser Rodrik appears and assures him that Petyr is telling the truth.
They go inside and meet Catelyn, and she explains all she knows about Bran and the dagger. Eddard wants to accuse Cersei, but Petyr says there is not enough proof and they best be rid of the dagger.1 Catelyn has also told Petyr about their suspicions over the death of Lord Jon, and he has agreed to help in the search for the killer. Catelyn fears Varys, but Petyr says he has him in check. After all is told, Eddard orders Catelyn and Ser Rodrik to ride back to Winterfell. He tells Catelyn to order Helman Tallhart and Galbart Glover to each post two hundred bowmen at Moat Cailin to hold the Neck and for Lord Wyman Manderly to fortify White Harbor. Furthermore, he orders Theon closely watched, as they may need House Greyjoy's fleet. He feels there will not be war, but he must not show weakness. When he has all the evidence he needs, he plans to go to Robert and expose the Lannister treachery.","Tyrion is taking dinner with the high officers of the Night's Watch, including Lord Commander Jeor Mormont, Ser Alliser Thorne, Bowen Marsh, Ser Jaremy Rykker, and Maester Aemon, and informs Jeor that he will be leaving on the morrow. He mocks Ser Alliser, who gets up and leaves. Tyrion comments that Ser Alliser is not fit to be master-at-arms, but Lord Commander Mormont laments that they have too few knights or trained fighters. Few knights have taken the black during Mormont's tenure as Lord Commander, and Ser Alliser fought bravely at King's Landing. Ser Jaremy quips that he and Ser Alliser were on the wrong side in that battle, and afterward Lord Tywin gave them the choice of taking the black or dying as traitors. Mormont accuses Tyrion of mocking the Watch, but Maester Aemon says that Tyrion is a giant come amongst them, which leaves Tyrion speechless.
After dinner, Jeor drinks with Tyrion. He tells Tyrion that he will give him an escort as far as Winterfell. Tyrion protests that he has his own men, Jyck and Morrec, and that Yoren is going south again too, but Mormont insists. Tyrion suggests sending Jon, but Mormont thinks that seeing his family again will just stir up feelings that are best left buried at this phase of his training. Mormont adds that his sister, Maege, rules Bear Island with his son's dishonor, and he has nieces he has never met. Lord Commander Mormont goes on to talk about the Watch's plight. The Watch is dying. There are less than one thousand men now; six hundred at Castle Black, two hundred at the Shadow Tower, and slightly less than that at Eastwatch, and only one-third of these are fighting men. He regrets sending Ser Waymar out on a ranging with him so green, but he feared to offend his father, Lord Yohn Royce. He sent two of his most reliable men with Waymar, and was shocked when Eddard sent him Gared's head after he was executed as a deserter. He laments the fact that Ben Stark has gone missing and wonders whom he should send to find him. Finally, he laments his own old age, sixty-eight, and worries that there are no suitable successors to his position. He pleads with Tyrion to tell Lord Tywin and King Robert of the Watch's needs. Jeor is desperate because the findings of the Citadel indicate that winter is on the way and it will be a bad one. He has reports from Denys Mallister of the Shadow Tower that wildlings are slipping south in greater numbers than usual, apparently running from something, and the fisherfolk of Eastwatch have glimpsed strange things.
Tyrion takes his leave and is heading back to his chambers when he suddenly gets the urge to climb the Wall one last time. He gets to the top and walks west, meeting Jon and Ghost. Jon has been making progress with his fellow trainees. Grenn is better than he was, and he has starting helping another trainee named Pypar too. Ser Alliser has taken a special interest in making his life hell. Tyrion tells Jon that he is stopping by Winterfell on the way south and asks if there is a message he would like sent. He tells Tyrion to help Bran like he helped him. They shake hands as friends, and gaze off to the edge of the world.","Eddard arrives at dinner late after a small council meeting. He joins Sansa, Arya, Septa Mordane, Jeyne, Hullen, Jory and most of his fifty guards, including Desmond, Jacks, Harwin, and Porther. Eddard tells them about the upcoming tournament, and Sansa gets excited. Eddard does not want his daughters to come, but Sansa pleads and Septa Mordane points out that it would seem odd if his daughters did not attend a tournament in his honor. Arya starts thinking about Mycah and Lady and loses her appetite. She runs from the table, darts past Tomard, and locks herself in her room. She takes out Needle and holds it. Eddard comes to her door, and Arya opens it to admit him. He sees Needle in her hand. He laments that she has ""the wolf blood,"" like both Brandon and Lyanna, and says it led them both to an early grave. He believes Lyanna would have carried a sword if allowed to. Arya confesses that she blames herself for Mycah's death and also that she and Jory drove Nymeria away by throwing rocks so she would not be killed. Eddard tells her that they have enemies in King's Landing and that she must stop feuding with Sansa and show a united front, and Arya agrees to try to be less willful. Eddard gives Needle back and leaves. The next day, Vayon brings her to the small hall, where Syrio Forel, who had been the first sword of the Sealord of Braavos for nine years, is waiting for her to begin her instruction in the art of swordfighting.","Drogo's party reaches the edge of the Dothraki Sea. Daenerys is riding with her entourage, including Ser Jorah, Irri, her khas (bodyguard),1 and Viserys. Illyrio had counseled Viserys not to make the journey and offered the comfort of his manse, but Viserys refused to leave Drogo's side until he receives his promised crown. A sudden impulse takes Daenerys, and she decides to ride out into the grasses of the Dothraki Sea, leaving orders with Ser Jorah for no one to follow her. Daenerys thinks back on her journey thus far. The journey was not easy for Daenerys at first. Riding on horseback all day has left her sore and bloody. Drogo's lovemaking at night made it even worse. She was almost ready to kill herself when she had a dream of being purified by dragonfire. From that point on, she became stronger and more confident. She also took an interest in the beauty of the land around her. The party made their way through the hills around Norvos, past villages of white stucco, forded four rivers, traveled down ancient Valyrian roads, and passed through the Forest of Qohor.
Daenerys's reverie is interrupted when a furious Viserys rides out to scold her for having Ser Jorah command him not to intrude, but Daenerys stands up for herself and shoves him away. Viserys is about to respond when Jhogo rides up and coils his whip around Viserys's neck. When Daenerys sees him on the ground red-faced and sobbing, she realizes what a pitiful creature he really is. She orders his horse taken away, a dreadful insult and humiliation amongst the Dothraki. Daenerys is afraid afterward that she has woken the dragon and that Viserys will hurt her later, but Ser Jorah tells her that Rhaegar was the last dragon and Viserys is merely the shadow of a snake. She realizes that he would make a terrible king and that he will never retake the Seven Kingdoms. Back at camp, she notices that her stone dragon eggs are unusually warm.2 As Irri, Jhiqui, and Doreah bathe her, she asks about dragons, but they tell her they are all gone. Daenerys recalls that Viserys told her the last Targaryen dragons had died a century and a half ago during the reign of Aegon III, who was given the epitaph Dragonbane. That night she talks with Doreah late into the night about sex, and when Drogo comes, she pleases him so thoroughly that he calls out her name at his climax. When they are on the far side of the Dothraki Sea some time later, Daenerys, now fourteen, realizes she is pregnant.","Bran watches Rickon run in the yard with Summer, Grey Wind, and Shaggydog. Bran is now eight and having trouble coping with his paralysis. Old Nan is with him to take care of him and keep him company. Nan is the oldest person in Winterfell. She came to be a wetnurse for another Brandon whose mother died giving birth, though whether this Brandon was a brother of Lord Rickard or of Lord Rickard's father1 changes depending on when Nan tells the story. At any rate, the boy died of a chill at three, but Nan stayed on at the castle. Her two sons died during Robert's Rebellion and her grandson died during Greyjoy's Rebellion, while her daughters long ago married, moved away, and died. Her only kin left is the stableboy, Hodor. Robb spends all his time now trying to be a lord, drilling the guard, going over accounts, and visiting outlying holdfasts.
Bran is cranky and in no mood for Old Nan's stories. She offers to tell the story of Brandon the Builder and how he raised both Winterfell and the Wall, but Bran says he prefers the scary stories. Nan therefore proceeds to tell Bran a story of the Others. Many thousands of years ago, a winter came that was the harshest ever experienced and a night came that lasted a generation. It was then that the Others came. They rolled over all in their path, defeating armies by the score. As all hope seemed lost, the last hero rode forth into the Far North with a sword, a horse, a dog, and a dozen companions to find the children of the forest and magic to defeat the Others. After years of fruitless searching, all of the hero's companions died and his sword shattered and the Others closed in on him with packs of pale white spiders the size of hounds. Just as Nan reaches the climax of the story, Maester Luwin comes in with Hodor and tells Bran he is required in the great hall to meet Tyrion, who has just arrived.
Hodor carries Bran to the hall, where Robb, flanked by Theon, Hallis, and a dozen guards, is talking to Tyrion, his servants,2 Yoren, and three other members of the Night's Watch. Robb is rude to Tyrion and threatens him as Bran enters the room. Tyrion asks Bran if he remembers how he happened to fall, but he cannot. He then gives the boy a gift, telling him that he can ride a horse using a special saddle of Tyrion's design. Suddenly, Rickon and the three direwolves burst into the room, and the direwolves proceed to attack Tyrion until they are called off. Robb apologizes for his earlier rudeness and offers Tyrion chambers in the castle, but Tyrion takes his leave to find an inn in town, and Robb turns his attention to Yoren while Bran goes back to his room. He falls asleep and has a dream relating to his fall in which he desperately states that he did not hear Cersei and Jaime's conversation. At dinner with the Watch members, Yoren reports Ben's disappearance. After the feast, Robb sits in Bran's room and cries for fear and grief.","Lord Eddard questions Grand Maester Pycelle on the death of Jon Arryn. It is extremely hot, causing Pycelle to comment that the smallfolk claim the last year of summer is always the hottest. He goes on to say that King Maekar's summer was even hotter and had even some in the Citadel claiming that the Great Summer, the summer that never ends, had come at last, but it broke in the seventh year and was followed by a long, harsh winter. Jon had come to Pycelle asking after a certain book one day, and the very next day, he had a terrible stomach illness. His Maester, Colemon, was purging his stomach, and Pycelle sent him away because he feared it might kill Jon.1 He often called out Robert's name in his final days, and his last words were ""the seed is strong.""2 Eddard suggests he may have been poisoned, but Pycelle discounts it, saying that he has been Grand Maester for nearly forty years under Robert, Aerys II, Aerys's father Jaehaerys II, and even Jaehaerys's father Aegon V and did not think Jon's illness was suspicious. Eddard mentions Lady Lysa's accusations that poison was the culprit, but Pycelle counters that while poisonings are common in the Free Cities, the poisoner has always been held in contempt in the Seven Kingdoms as recorded by Grand Maester Aethelmure. When Eddard mentions that poison is a woman's weapon, Pycelle counters that it is also the weapon of eunuchs and warns Eddard not to trust Varys. Eddard prepares to take his leave and asks Pycelle to send him the book Jon was reading, a book of genealogies written by Grand Maester Malleon. Eddard asks if Cersei was with Jon when he died, and Pycelle reports that she and her children were journeying to Casterly Rock when it happened, escorting Lord Tywin who had come to the city to see the tournament held on Joffrey's name day.
On the way back to his chambers, Eddard sees Arya practicing balancing, and they talk about Bran, whom they have just learned has woken up. Arya asks if he can still be a knight, and Eddard tells her that he cannot but may still be a great lord and councilor. Arya asks if she can raise castles and be a councilor too and is disappointed with Eddard's answer that she cannot. Eddard returns to his rooms, and Alyn comes to inform him that Lord Petyr requests an audience. He has been doing his own investigating and discovered that four members of Jon's household remained after Lysa fled to the Eyrie, a pregnant kitchen girl, a stablehand who joined the City Watch, a potboy discharged for theft, and Jon's squire, Ser Hugh of the Vale, who was knighted by the king after Jon's death. Eddard says he will call on the squire, and Petyr shows him two spies, one from Varys and one from Cersei, that keep him under watch. He tells Eddard he should send a man he trusts instead. Eddard tells Petyr he was wrong not to trust him, but Petyr rejoins that not trusting him was one of the few smart things he has done since coming to King's Landing.","Jon is instructing Dareon and Pyp when a new recruit, Samwell Tarly, enters the practice yard. He is immensely fat and very nervous. Ser Alliser immediately mocks him as Ser Piggy. After he is outfitted, Ser Alliser orders Halder to test him. He is felled quickly, but Ser Alliser orders Halder to press the attack again. Jon tells Halder to stop, which infuriates Ser Alliser. He tells two other recruits, Rast and Albett, nicknamed Rat and Pimple respectively, to join Halder in attacking Jon and Sam. Pyp and Grenn immediately come to Jon's aid. After the battle, Sam thanks them. When they ask why he did not fight back, he tells them he is a coward, which shocks the boys. Sam walks away forlorn, and Jon goes to put up his armor.
