Lord Paxter returns to the Greyjoy alliance. Lord Tywin says they should do nothing at the moment and see if a better option presents itself. Tyrion senses that someone has made an offer and wonders who it is and what they are asking for.1 The discussion turns to wedding plans, and Pycelle reports that three hundred Dornishmen will be coming. Tywin explains that Prince Doran is coming to take his council seat,2 but Lord Mace is not happy. He has been feuding with the Martells since Willas was crippled. They next divide the rewards from the battle. Everyone gets something, but Lord Mace comes out best by securing the Florent lands for Ser Garlan, making him lord of Brightwater Keep. Lesser tracts were set aside for Lord Randyll, Lady Arwyn, Lord Leyton, and others not present, while Lord Paxter is granted thirty years remission on taxes for some of the best wine vintages of the Arbor. Varys reports on recent events. A kraken was sighted off the Fingers and sank an Ibbanese whaler, a new war is brewing between Tyrosh and Lys in which both cities hope to win Myr as an ally, and there are reports of a three-headed dragon in Qarth.3 Tywin asks if there is any sign of Tyrek yet, but there is not. Kevan reports that Ser Addam wants to know what to do with several goldcloak deserters that have returned. Tywin says to break their knees as a lesson. Tyrion thinks they should send most to the Wall, but Tywin feels that if the Starks and Greyjoys both claim the North then they should defend it.
When the session is over, Tywin asks Tyrion, Cersei, and Kevan to stay. Tyrion voices his distrust of Petyr, but Tywin will not hear of it. In fact, he has just informed Tywin of the Tyrell plot to spirit Sansa away to Highgarden.4 Tywin plans to forestall this through marriage, starting with Cersei. Cersei is adamantly against another marriage, but Tywin is firm. He plans to wed her to Willas. Cersei leaves in a fury. After she leaves, Tywin tells Tyrion that he will marry Sansa. Tyrion is not entirely happy, though the title of Lord Protector of Winterfell is appealing. He says it will not matter anyway once Robb has sons, and Tywin reveals that he married Jeyne. Tyrion is shocked for many reasons, including that his father does not seem mad.5 Tywin usually does not suffer disloyalty amongst his bannermen, and when he was a boy he had completely destroyed two powerful houses, the Reynes of Castamere and the Tarbecks of Tarbeck Hall, for defying him. As the meeting ends, Tywin repeats that Tyrion must wed Sansa soon.","Catelyn stands to Robb's left as the bodies are brought in. Edmure stands to his right. All the bannermen are there, including Ser Raynald and Ser Rolph, but not the queen. The bodies are Tion Frey and Willem Lannister. Robb orders the Smalljon to have his father bring in the prisoners. The Greatjon leads in five men, two more died in the taking and an eighth is mortally wounded. The prisoners killed two guards as well, Delp and Elwood. Their leader is Lord Rickard. Robb confronts him angrily, and Lord Rickard mocks his king. He is angered that Robb did nothing to Catelyn for freeing Jaime. Ser Brynden comes in. Robb tells the Greatjon to hang the other seven, even the dead ones, and keep Lord Rickard until he is done conferring privately with Brynden. He adjourns with Brynden, Edmure, and Catelyn. Brynden tells him that the Karstark men, three hundred horse, are all gone; they snuck away in twos and threes during the night. Lord Rickard has offered his daughter's1 hand in marriage to any man who brings him Jaime's head. Edmure says they must keep the murders a secret, but it is too late for that. Robb says he must execute Lord Rickard as a traitor. The next morning, Lord Rickard is brought to the godswood. Robb takes the axe from Long Lew and does the deed himself. Before he dies, Lord Rickard says Robb will be accursed as a kinslayer, as House Karstark was founded a thousand years ago by Karlon Stark, who was granted lands after helping put down a rebel lord and built Karl's Hold, now known as Karhold. Catelyn retreats to Lord Hoster's solar afterwards to be with her father. Maester Vyman tells her it will not be long now. Jeyne comes in later. She does not know how to comfort Robb. Catelyn tells her to wait patiently and be there when Robb needs her, which he always will eventually. Catelyn tells her she must make an heir soon. Jeyne agrees and says that Lady Sybell gives her a concoction of herbs, milk, and ale every morning to make her fertile.2 She thinks she will be with child soon.","Brienne, Jaime, and Cleos arrive at Maidenpool. The castle still flies the standard of House Mooton, but much of the town is destroyed. They turn towards Duskendale. A little ways along the road, they are ambushed by archers. Cleos is hit and gets dragged along the ground by his horse. Jaime charges the archers followed by Brienne, and they run away. Jaime and Brienne find Cleos dead; he has an arrow in his arm and another in his chest, but it was having his head banged against the ground that killed him. Jaime asked to be released and armed with Cleos's sword, but Brienne refuses. He finally gets fed up, pulls Cleos's sword, and lunges at Brienne. They fight for a good while, but Brienne finally gets the better of him. She is trying to make him yield when they are surrounded by riders. It is a band of the Brave Companions, including Rorge and Timeon. Urswyck is in command. He informs Jaime that Vargo has been promised Harrenhal and fights for the Starks now. Jaime tells him that Brienne is worth a good ransom to spare her from rapes. They are taken to Vargo, who is at a pillaged sept. He tells Jaime that he means to send a message. Shagwell knocks him to the ground and a Dothraki1 cuts off his right hand.","Arya, Gendry, Greenbeard, Tom, Anguy, Lem, Harwin, Jack-Be-Lucky and the rest of the outlaws are at a half-ruined keep trying to track down Lord Beric. The old man1 there keeps going on about how he held Ser Maynard at the bridge. His maester2 tells them that Beric has been hanged. Lem says that this is true, but Thoros cut him down in time.3 Three days later, they stop at a village hidden in the trees run by a woman called the Lady of the Leaves. She tells them that Beric is dead as well, killed when Gregor stabbed him through the eye.3 Lem tells her that is an old tale and false. The next day they stop at the ruins of a village called Sallydance. The septon there tells them that Northmen came through and looted the sept while looking for Jaime. They stay there that night and the next day come to a place called High Heart. The hill is surrounded by the stumps of thirty-one weirwoods. Tom explains that the place was sacred to the children of the forest. The locals claim it is haunted by the spirits of the children that were killed there by the Andal king Erreg the Kinslayer.
That night, a storm wakes Arya, and she sees Greenbeard, Tom, and Lem talking to a shrunken old woman.4 She is telling them that the old gods will not let her sleep and send her dreams. She has dreamed of a shadow with a burning heart butchering a stag,5 a man without a face waiting on a bridge with a drowned crow with seaweed in its wings on his shoulder,6 and a woman who was a fish with red tears on her cheeks who is dead, but her eyes open.7 She asks Tom for a song in return. The next morning, Arya asks Tom about her, and he says she is just an old dwarf woman, but she did point them in the right direction to find Beric. The next day, they come to Acorn Hall. Lady Ravella Smallwood greets them on their arrival. When she learns that Arya is noble born, she has her bathed and clothed with her daughter, Carellen's, garments. Carellen is currently in Oldtown staying with a great-great-aunt who is a septa. Lady Ravella informs them that Lord Beric stayed there a fortnight past and tells them where to look for him. She also tells them that Northmen came looking for Jaime. They tell Arya to leave while they talk of these things, and she and Gendry go to check out the forge. They talk, and then start to wrestle. When they return to the castle, Ravella gives Arya another bath. The next morning, they ride off.","Daenerys stands in the Plaza of Pride in Astapor. The slavemaster Kraznys mo Nakloz is showing off his Unsullied. Daenerys is pretending she cannot speak Valyrian, so a ten-year-old slave girl from Naath1 is translating his words into the Common Tongue of Westeros. Arstan is with her as well, though he was against coming. Kraznys explains the training and discipline of the Unsullied, and Daenerys says she will consider his offer. She returns to Balerion with Aggo and Jhogo guarding her. On the way back, Arstan voices his strong disapproval of using Unsullied. Belwas is eating at the base of the ship when they arrive, and Ser Jorah waits for her on deck. Daenerys, furious that she must buy a slave army when she thinks their upbringing is horrible, slaps the knight, causing all eyes, including those of Groleo and Jhiqui, to focus on her. She goes below decks, where Irri is looking after Drogon, Rhaegal, and Viserion. Irri tells her that the dragons have been restless and do not like being caged; Drogon even bit her. Daenerys apologizes and sends her away to be alone. Ser Jorah comes after awhile. He tells her that while Unsullied may live harsh lives, they will not sack cities or rape women or kill babies when they have conquered. Daenerys wants to be honorable like Rhaegar, but Jorah points out that Rhaegar lived honorably and also died honorably, losing his kingdom.","Bran, Hodor, Meera, Jojen, and Summer make their way through the mountains towards the Wall. Bran laments that they would make better time on the kingsroad, but Jojen says it would not be safe. They see no people on their trek, save for one night when they shared a cave with a Liddle to wait out a storm. The next day as they are walking the talk turns to stories, and Bran asks if the Reeds know any. Meera mentions the Knight of the Laughing Tree. She begins the story of a young and inquisitive crannogman1 who wanted to see the world and left the swamps for the Isle of Faces. He stayed there all winter, and when spring broke crossed the river to Harrenhal. A great tournament was about to begin, and most of the finest knights of the land were in attendance. The king was there,2 as were the White Swords,3 who welcomed a new brother.4 The storm lord5 was there and the rose lord,6 while the great lion of the rock7 was absent due to a quarrel with the king.2 The daughter of the castle reigned as the queen of love and beauty, and her four brothers and her uncle of the Kingsguard were there to defend her.8 The dragon prince9 and his wife10 were there as well. The crannogman1 was accosted by three squires who beat him until the she-wolf drove them off.11 She took him back to her tent, where her pack brothers, the wild wolf,12 the quiet wolf,13 and the pup14 were staying as well. She convinced him to attend the feast that night, and he ate and drank with the wolves and their sworn swords, including barrowtown men, moose, bears, and mermen.15 At the feast, the dragon prince9 sang a song that made the she-wolf11 weep, while the storm lord5 won a drinking contest with the knight of skulls and kisses.16 A maid with laughing purple eyes17 danced with a white sword,18 a red snake,19 the lord of griffins,20 and finally the quiet wolf13 after the wild wolf12 said a word on his behalf. The crannogman1 recognized the squires who accosted him. They served a pitchfork knight,21 a porcupine knight,22 and a knight of two towers.23 The she-wolf11 pointed them out to her brothers and the pup14 offered the crannogman1 a horse and armor. Though he wanted to avenge his honor, the crannogman1 realized he was too small. He shared a tent with the quiet wolf13 that night, but prayed to the old gods first. The champions were all defeated on the first day, and the pitchfork,21 porcupine,22 and two towers23 were among the victors. At the end of the second day, a mystery knight entered the lists. Mystery knights are not unknown in Westeros, with more notable examples including Ser Barristan Selmy entering two tournaments as a youth, one of them when he was ten, and Prince Aemon the Dragonknight entering a tournament as the Knight of Tears so he could name Queen Naerys queen of love and beauty. This particular mystery knight was small of stature and clad in ill fitting armor, and the knight's device was a weirwood with a laughing red face.24 The knight challenged the pitchfork,21 porcupine,22 and two towers23 knights, and defeated each in turn. When they came to ransom their armor, the knight only told them to teach their squires honor. That night, the storm lord5 and the knight of skulls and kisses16 both swore they would unmask the Knight of the Laughing Tree.24 The next day, however, the knight failed to appear. The king2 sent the dragon prince9 to find the knight, but all he found was the shield.24 Bran likes the story, but wishes the she-wolf11 had been named queen of love and beauty. Meera says that she was, but that is a sadder story.25","Davos is in a cell beneath Dragonstone. When he first arrived, he was gravely ill, but Maester Pylos came to tend to him, and he is now much stronger. He is tended by two gaolers, one who brings his morning meal and another who brings the evening meal. They will not give their names, so Davos has named them Lamprey and Porridge. Melisandre comes to see him. Davos tells her that he wants no part of her since the horror she birthed at Storm's End; he says it was a creature of darkness. Melisandre counters that shadows are created by light, but states that Stannis's life force is too weak for her to make more shadows. She asks Davos if he will embrace R'hllor, and he responds that he wants nothing to do with the god. She explains that all is black and white, ice and fire, good and evil, and that a war has been raging since the dawn of time between R'hllor, the Lord of Light, the Heart of Fire, the God of Flame and Shadow, and the Great Other whose name may not be spoken, the Lord of Darkness, the Soul of Ice, the God of Night and Terror. All men must choose where to stand in this war, and Melisandre asks Davos where he stands. Davos replies that he is not sure and Melisandre tells him it is good he told the truth, for she would have known if he lied. Davos asks how he was caught, and Melisandre replies that she saw his purpose in her flames. She states that Stannis is R'hllor's chosen champion and that she has seen him in the flames leading the fight against the dark. She also quotes prophesy which states that ""When the red star bleeds and the darkness gathers, Azor Ahai shall be born again amidst smoke and salt to raise dragons out of stone."" She believes Dragonstone to be the place of smoke and salt.1 Melisandre leaves Davos to ponder what she has told him.
Roughly three days later, Ser Axell brings a new prisoner to join him, Lord Alester Florent. Davos asks him if there is any word of survivors from Fury since Alester's nephew, Ser Imry, commanded the ship, and Alester says it went down with all hands including Ser Imry and Davos's son Maric. He says the war is hopeless and most of Stannis's lords are gone. Lord Ardrian was captured and swore fealty to the Iron Throne, Lord Monford died on the Blackwater, Lord Guncer was burned by Melisandre, and Lord Duram is a fat, feeble boy of fifteen. Lord Alester explains that he penned a letter for Lord Tywin offering that Stannis give up his claim to the throne, renounce his claim about Joffrey's parentage, and wed Shireen to Tommen in exchange for being confirmed as lord of Dragonstone and Storm's End. Lord Alester would have done the same for Brightwater Keep. Since Stannis has been closeted with Melisandre and speaking to no one and Lord Alester had access to the king's seal, he prepared to send the letter without permission. He mentions talk of a stone dragon and mentions failed attempts to raise a dragon such as Aerion Brightfire, the nine mages, the alchemists, and Summerhall.2 Alester begins to weep.","Jon goes to speak with Ghost. He tells the direwolf that he is going over the Wall tomorrow and that Ghost cannot come with him. Jon tells him to make for Castle Black and hopes the arrival will serve as a warning. Ghost bounds off, but Jon has no idea whether he is actually making for Castle Black or not. He has been traveling south with Styr and Jarl for days. He and Ygritte sleep together every night and have now had sex on many occasions. A man comes to take him to Styr. Jarl is there as well. Styr asks for information about Night's Watch patrols, and Jon explains that they consist of two rangers and two builders who look for damage along the walk as well as for foes. Most patrols ride atop the Wall on mules, but one in four walks along the base to look for tunneling. This is because of Arson Iceaxe, a wildling raider that had been halfway through the Wall when discovered. Rather than stop him, the Watch just sealed the Wall behind him, leaving him trapped. Under Lord Commander Qorgyle, patrols went out every second day to the Shadow Tower and every third day to Eastwatch, but Qorgyle had more men and the time of the patrols also now varies on the advice of Benjen Stark. Styr also asks for numbers, and Jon over-states the strength of the Watch. Styr thinks he is lying, but decides it does not matter.
Jon goes off to look for Ygritte, and Grigg the Goat tells him she went deeper into the cave. He finally finds her in a chamber at the end of a small passage. She tells him that the tunnel goes on a long ways and that there are many such passages in the mountains, such as Gorne's way that goes under the Wall. Three thousand years ago, Gorne and his brother, Gendel, led the wildlings through the tunnels past the Wall, but were attacked by Starks out of Winterfell. Gorne killed the King in the North, but the king's son killed him and the sounds of battle alerted the Night's Watch, which took Gendel in the rear, killing him as well. The wildlings believe that Gendel actually escaped back into the tunnels but that he got lost and kept going deeper and deeper into the earth, where his descendants are still searching for a way out to this day. Ygritte takes her clothes off so that Jon can see her for the first time, and he gives her oral sex. The act is new to Ygritte, and she wonders who taught him. When Jon says he has had no one else, Ygritte teases him. She was not a maid, having sex with a boy five years ago. He tried to steal her, but Ryk chased him off. Jon is relieved that it was not Ryk she lay with, and Ygritte says that wildlings do not have intercourse with members of their own clan. Jon points out that Craster has married his daughters, and Ygritte scoffs that he is not really a wildling because his father was a man of the Night's Watch who stole a woman from Whitetree, but left her behind after sleeping with her. The woman tried to bring their son to Castle Black, but she was run off. When they are finally done, Ygritte says they should just stay in the cave and that she never wants to leave.","Daenerys stands before eight slave masters, including Kraznys and several named Grazdan, named for the founder of Old Ghis, Grazdan the Great, flanked by Irri, Jhiqui, Arstan, Belwas, Aggo, Jhogo, Rakharo, and Ser Jorah. She tells them she wants to buy all the Unsullied they have. The slave girl translates. The slavers are taken aback and ask for clarification. She states she would like all of the eight thousand available, plus the additional six hundred trained Unsullied in the city and the boys still in training. They balk at selling the trainees until she states she will pay double for all of them. One of the Grazdan's, who knows a few words of the common tongue, tells her that at double the price she only has enough gold from her trading goods for five hundred. She offers her ships as well, and the slavers say that will net her two thousand. She offers them a dragon. Arstan protests fiercely until Daenerys has Ser Jorah remove him. The masters agree to give Daenerys all she wants in exchange for the trading goods, ships, and Drogon. They include the slave girl in the deal as a token to serve as translator. Daenerys takes her leave with her retinue and the slave girl. She scolds Arstan for disagreeing with her in front of others, and then asks the slave girl her name, which is Missandei. Daenerys frees her and then quizzes her about the Unsullied. When they return to the ship, she feeds her dragons and then argues with Groleo over selling the ships. That night, she cannot sleep and goes on deck. After a brief talk with Ser Jorah, she is able to go to sleep. She wakes up from a dream and realizes someone is in her cabin with her. She hears Quaithe repeat her prophecy about going to Asshai,1 but when she gets out of bed, there is no one there.
The next morning, Daenerys rides Silver into Astapor with Aggo going before, Belwas and Missandei flanking her, and Ser Jorah to the rear. Jhogo and Rakharo guard her litter, in which Drogon, Rhaegal, and Viserion ride with Irri and Jhiqui. The rest of her people follow, including Groleo and his sailors, Arstan, and the eighty-three Dothraki that still remain with her. The masters await with the Unsullied in the Plaza of Punishment before the main gate of the city. Kraznys takes Drogon's leash and hands Daenerys the harpy's fingers, a nine lashed whip that symbolizes her ownership. Daenerys rides down the line of Unsullied and tells them in Valyrian that the deal is done and they are hers now. She then returns to Kraznys, who is having difficulty with Drogon. Daenerys tells the slaver that a dragon is no slave before tearing his face with the whip and ordering Drogon to unleash his fire. Drogon burns Kraznys to death. The other dragons join in, while Aggo, Jhogo, Rakharo, and Belwas begin attacking those few nearby soldiers that have not already fled. Grazdan mo Ullhor orders the Unsullied to defend him, but they do not move as Aggo kills him with an arrow through the mouth. They stir at Daenerys's command and begin killing the slavers and setting the slaves free.","Sansa puts on her new gown as Cersei looks on. When she is dressed, a maiden cloak is brought out for her, and Cersei informs her that she is to marry Tyrion. Sansa is in a state of shock and tries to refuse, but Cersei says that she has no choice. Ser Osmund and Ser Meryn wait outside to escort her to the sept. Joffrey waits for her at the steps of the sept and taunts her until Tyrion comes out and asks for a moment alone with her. Tyrion apologizes for the situation and says she may marry Lancel if she prefers, but Sansa, resigned to her fate, says they should continue. Inside the sept, the guests include Ser Balon, Ser Boros, Varys, Ser Addam, Dontos, Lord Philip, Ser Bronn, Jalabhar Xho, Lord Gyles, Lady Tanda, and Lollys, but not one Tyrell. Joffrey unfastens Sansa's maiden cloak, and then it is Tyrion's turn to fasten a Lannister cloak around her shoulders. He is too short and there is no stool, so Tyrion tugs on Sansa's skirt for her to kneel. She refuses, causing the assembled to laugh. Joffrey finally has Dontos bend down for Tyrion to stand on.
