After a brief altercation between one of Lord Mathis's men and a Dornishman, a very drunk Joffrey calls for the jousters. They are dwarves,3 and Tyrion immediately sees the insult directed at him. After a comic show, one of them yields, and Joffrey declares that he must fight Tyrion to determine the champion. Tyrion stands on the table and says he will ride the pig if Joffrey rides the dog because the king is the only man he could hope to defeat. An enraged Joffrey has to be restrained by Ser Meryn and Ser Osmund. As Alaric of Eysen prepares to perform, Joffrey comes over to Tyrion and dumps wine on his head. Tyrion and Margaery attempt to defuse the situation, and Joffrey orders Tyrion to fill his cup for a toast. Lord Tywin announces that the pie has arrived, and Joffrey fetches his sword to cut it. Margaery points out that Widow's Wail should not be used to slice a pie, and Joffrey calls for Ser Ilyn to provide his sword. He no longer has Ice, which shocks Tyrion and Sansa.4 After Tyrion cuts the pie open to allow the pigeons to fly out, servants serve actual pigeon pie. Joffrey comes over and eats Tyrion's piece, washing it down with more wine. Suddenly, he starts coughing violently. As the assembled watch in horror, Joffrey chokes to death. Tyrion looks at the wine chalice in his hand, which still has a little wine in it, and pours it out. Cersei lets out a scream when it is over, and it takes two Kingsguard to pry her fingers off Joffrey's body. Cersei orders the Kingsguard to arrest Tyrion for the murder of Joffrey.","As the bell begins to toll announcing Joffrey's death, Sansa, in the godswood, feels elation. She had fled the throne room before he died, as had Lady Tanda. Sansa takes out the clothes she has hidden and dresses for her flight. As she takes off her hairnet, she notices that one of the gems is missing. When Dontos arrives, she accuses him of using the stone to poison Joffrey, but he denies it and also tells her that Tyrion has been arrested. Dontos, drunk, leads her out of the godswood. He is wearing his surcoat, wanting to be a knight at least for the rescue. He leads her down a long dark gallery and out of the castle to a cliff side. There is a hidden ladder carved into the cliff. Sansa balks at first, but Dontos tells her it is the only way. At the bottom, a man named Oswell is waiting with a skiff. He rows them into the bay.
Near dawn, they approach a trading galley. Oswell helps Sansa up on deck, and Lothor Brune wraps his cloak around her. It is Lord Petyr who has rescued her. Dontos asks for his reward, ten thousand dragons, and three crossbowmen kill him at Petyr's command. Sansa is horrified, and Petyr says he was her benefactor all along. He could not approach Sansa openly, but after Sansa saved Dontos he made the perfect go-between. It was Petyr who sent her the note telling her to come to the godswood if she wants to go home. As he takes her to her cabin, Petyr also reveals that the jousting dwarves were provided by him. Sansa asks why he killed Joffrey, and he states that he had no motive and that sometimes it is good to make moves that seem to have no reason in order to confuse one's enemies.1 Petyr tells her that he loved Catelyn, but could not marry her. He also claims he took her maidenhead.2 He tells Sansa she is safe and going home.","Jaime learns in an inn that Joffrey is dead, though the stories differ as to how and who. The next day, the party arrives at King's Landing with Jaime, Walton, and Nage with the peace banner at its head. Jaime is anxious to see Cersei again, but feels surprisingly little emotion over losing his firstborn son. He never really had an opportunity to become close to him. Jaime rides to the rear to find Brienne, who has stayed aloof from the others and pretended not to be part of the group. She has been listless since they learned from Ser Bertram Beesbury at Brindlewood that Robb and Catelyn are dead. Ser Bertram also told them that Lord Clement Piper had renewed his fealty to the Iron Throne with his son1 a prisoner at the Twins. Jaime offers to send her home or offer her a place in King's Landing, but neither option appeals to her. A guard waves them through the Mud Gate past a long line of wagons waiting to enter the city, and they ride up to the Red Keep. The gate is guarded, but a startled Ser Meryn lets them past. In the yard, Ser Loras and Ser Balon also greet the group. Loras recognizes Brienne and draws his sword meaning to kill her for the death of Renly. Jaime manages to stop him, but Loras still wants her arrested, and Jaime sees that she is.
Jaime goes to the sept to see Cersei, who is praying for Joffrey. Ser Osmund guards the door and does not recognize him at first, but finally lets him through. Cersei is disheveled and amazed to see him. She tells him of Tyrion's threat to turn her joy to ashes2 and says he killed Joffrey. Jaime is starting to believe this, but he recoils at doing what she wants, killing Tyrion in his cell. He forces himself upon her, and they have sex. When it is over, Jaime tells her he wants to be with her openly and marry. Tommen would lose the throne, but he does not care. Cersei says he has changed and makes him leave. Jaime goes to see Tywin. Tywin had expected him earlier. Varys had reported his escape soon after it occurred, and Tywin sent Gregor, Ser Samwell Spicer, Ser Dennis Plumm, Ser Peter Plumm, and Ser Harwyn Plumm to look for him. Lord Roose had passed on word as well. Lord Tywin is shocked to see the hand, however. When Jaime tells him it was Vargo, Tywin says that the Brave Companions deserted him and Gregor found him in Harrenhal half-mad with pain and fever from a wound to his ear that festered.3 He is not dead yet, but will be soon; Gregor has taken off his hands and feet. The Companions have scattered. Turning to Joffrey, Tywin has had Podrick and Sansa's maids4 detained and questioned, and Ser Addam is searching for Sansa. Lord Tywin tells Jaime it is time for him to leave the Kingsguard and take up his rightful place at Casterly Rock. He wants to send Tommen to be Jaime's ward and squire to get him away from Cersei and also hopes to marry Cersei to Oberyn. Jaime says he means to stay in the Kingsguard. After a long silence, Tywin tells Jaime he is not his son and tells him to attend to his duty.","Davos watches from above as Melisandre leads the evening devotions. Stannis, Selyse, Shireen, Axell, and Devan are among the devotees, though Stannis is not fervent as the others are. Ser Andrew tells Davos it is time, and they set to work along with Ser Gerald and Ser Rolland. Other members of their conspiracy include Lewys the Fishwife and Ser Triston of Tally Hill, a former sworn sword to Lord Guncer Sunglass. They go to Maester Pylos's room, where he is teaching Edric sums. Pylos tells Edric to go with Davos. Edric resists at first, but Davos cajoles him into coming. The four join Lewys and Omer Blackberry at a postern gate where they have tied up the guards. Mad Prendos, one of Salladhor's ships, waits to take Edric away. Everyone goes with him save Davos and Rolland. Davos makes the long lonely walk to the Stone Drum and up to the Chamber of the Painted Table and waits. After awhile, Davos hears Stannis and Melisandre approaching. Melisandre is telling Stannis that she saw Joffrey dead in the flames, but Stannis will not be convinced until the information is verified. Davos announces that Joffrey is indeed dead. Salladhor's ships still trade in King's Landing, and one brought back the news. Melisandre says that Stannis must give him Edric now, and Stannis reluctantly agrees there is no other way. Davos tells them what he did. Stannis is angry and draws Lightbringer, but gives Davos a chance to explain. He says a king must protect his people and pulls out a scrap of paper.1","Jon wakes from a disturbing dream, lonely because Ygritte and Ghost are gone. He hears two loud horn blasts signaling wildlings approaching. With the stairs a charred ruin, the winch is the only way up to the Wall now. Jon waits his turn with Satin, Mully, Spare Boot, Kegs, and Hareth, a stablehand who wants to take the black and one of the few citizens of Mole's Town still aiding the Watch in the defense. Zei, a whore who proved adept with a crossbow during the attack by Styr's raiders, and three orphan boys whose father died on the steps during the raid also stayed; everyone else fled back to their hovels or fields. Clydas and Hobb provide refreshment as they wait. When the cage finally arrives, Jon joins Donal at the top of the Wall. They hear a strange noise, which Jon identifies as mammoths. Donal orders their two trebuchets to launch burning pitch at the oncoming attackers to provide illumination. When this is done, they see giants approaching on over a hundred of mammoths. Alyn sounds his horn again and the wildlings answer as the battle is joined.
Pyp shouts that they are at the gate, and Donal tells him and Owen to drop lamp oil through the murder holes while Grenn chucks other debris down on their heads as well. As the battle continues, a slightly drunk Septon Cellador begins singing prayers, but Donal shuts him up. Donal orders the archers to begin firing and chooses four men to go with him to hold the gate below. He leaves Jon in command. The battle rages on and Cellador begins praying again. After awhile Hobb, Clydas, and Owen bring food to keep the men refreshed. One of the trebuchets breaks from the strain of constantly firing. Dawn finally comes, and the men on the Wall behold a gigantic host of wildlings. The night attack was only a probe; the real battle is just beginning. The line is centered by giants on mammoths, and the giants have a huge ram as well. Chariots of bone manned by men from the Frozen Shore anchor the flanks. The men are scared, but Jon gives a rallying speech and they prepare to meet the host. Jon orders the archers to target the ram but wait for his command. As the wildling advance, their formation comes apart. When the ram is in range, Jon gives the order, and he, Satin, Grenn, Owen, Spare Boot, Black Jack Bulwer, Arron, Emrick, and Zei let loose their arrows and quarrels. The ram goes down and the wildlings are thrown into disorder. A mammoth reaches the gate, and Grenn, Pyp, and Kegs toss down burning pots of oil. At that, the wildlings break and withdraw.
Jon's leg is in agony now, and he has Pyp help him off the Wall, leaving a horrified Grenn in charge. Jon decides to inspect the gate, and Pyp brings back Maester Aemon and Clydas with the spare key. They pass through the iron gates and find everyone dead, including Pate and Donal. The giants busted through the outer door, and a single giant, Mag, wrenched the bars off the first iron gate, though Donal killed him. Jon says they must block the gate and that Ser Wynton must take command. Maester Aemon states Wynton will merely smile, nod, and forget any conversation they have. Thirty years ago he came within a dozen votes of being named Lord Commander, and even ten years ago he would have been up for the task, but now he is too feeble. Jon says Aemon himself should lead then, but he says his order gives counsel not commands. He says Jon is the only one who can lead them until the garrison returns.","Arya has an empty place inside now that her parents and brothers are all dead.1 She would sleep all day and all night if Sandor did not make her go on. Her dreams are the best part of her life now. She enters Nymeria in those dreams and presides over a huge pack of wolves. They have two horses now, Stranger and Craven, a sorrel palfrey discovered wandering aimlessly the morning after the slaughter at the Twins that Arya named after Sandor said he had probably run from the Twins just like them. Sandor no longer watches her closely, but she does not run because she has no idea where she would go. She feels abandoned by Gendry and Hot Pie, and resents that Lord Beric just wanted to ransom her. She feels none of them ever wanted her around. They ride all day long every day, but Sandor refuses to tell her where they are going. They see other people from time to time, usually groups of Frey armsmen searching for stray northmen. One day, they come across a mortally wounded archer in service to Ser Marq who describes how a Bolton man befriended and then attacked him at the Red Wedding. Sandor gives him water and mercy, killing him quickly. After looting the corpse, they continue.
They reach the foothills of the Mountains of the Moon, where Sandor finally reveals he intends to attempt to ransom Arya to Lysa. Arya says they should return to the Twins to rescue Robb and Catelyn instead, but he dismisses this as nonsense. That night, she enters Nymeria and can smell her mother. She wades into the river and pulls the corpse out. Just then, a group of men approach, and she must abandon her prize.2 The next morning, she accepts that Robb and Catelyn are dead. As they move deeper into the hills, Sandor and Arya come to an isolated village, and Sandor decides they need to stop for food and rest. The townsfolk are building a new palisade, and Sandor agrees to help in the labor for food, ale, lodging, and some coin. He also learns that taking the high road will be impossible due to both the weather and the renewed depredations of the mountain clans. The Burned Men have been fearless since Timett returned from the war, while Gunthor led the Stone Crows in a raid on a village eight miles away in which they stole all the women and killed half the men. The clans have good steel weapons and armor now, and the Stone Crows, Milk Snakes, Sons of the Mist and other clans watch the road closely. After two weeks in the town, Sandor decides they should just stay for a while until the situation in the Riverlands calms down, but the next day, they are turned out by the village elder, who recognizes Sandor and does not want any trouble. Sandor is paid with some copper, sour ale, and a sword that he trades for with his axe. He decides to make for Riverrun again to ransom Arya to Ser Brynden. Arya suggest the Wall, but he thinks that is a bad idea.","Tyrion discusses his upcoming trial with Ser Kevan. Kevan reveals that Tywin will sit in judgment, but due to his personal connection to the case he will have Lord Mace and Prince Oberyn sit with him. Tyrion asks if he will be allowed trial by combat, and Kevan replies that he will but that Ser Gregor would serve as Cersei's champion. Tyrion asks about finding witnesses, and Kevan replies that he will attempt to produce anyone that Tyrion names, but that he cannot leave his cell save for the trial itself. Tyrion asks for Podrick, and Kevan goes to get him. Tyrion tells his uncle he did not poison Joffrey, but Kevan does not believe him. As he tries to think of witnesses in his support, Podrick arrives. Tyrion tells his squire to bring Bronn and tell him there is more gold in it for the sellsword than he could possibly imagine. Podrick does not return that day, and Tyrion finally thinks of his only witness, Sansa. Kevan returns and tells him the trial will start in three days. He also says that he will bring Sansa to share Tyrion's cell if she can be found, but neither Ser Addam or Varys have had any success locating her. Podrick finally returns with Bronn the next morning, but Bronn is not in a helpful mood. Cersei has arranged for him to marry Lollys Stokeworth, and the wedding is in two days. Bronn gives Tyrion a chance to offer a better price, but Tyrion cannot do so. Bronn leaves.
On the morning of the trial, Ser Addam and a dozen goldcloaks come to escort him to the throne room. Hundreds are there to see the trial, including Margaery, flanked by Lady Alerie and Lady Olenna. Lord Tyrell, Prince Oberyn, and Lord Tywin sit at the foot of the dais. After the High Septon says a prayer to the Father to guide them to justice, the trial begins. Lord Tywin begins by asking Tyrion if he killed Joffrey, to which Tyrion responds in the negative. The prosecutions witnesses then begin to testify. Ser Balon is the first to come forward, who proclaims disbelief of Tyrion's guilt but describes the moment after the riot when Tyrion struck Joffrey.1 Ser Meryn testifies next to the same incident and also to the time Tyrion stopped Joffrey from beating Sansa.2 Ser Boros testifies to this event as well. Tyrion wants to tell the crowd what Joffrey was doing to Sansa at the time, but he is ordered to stay silent. Osney and Osfryd come next one after the other to describe Tyrion's threats towards Cersei the night she arrested Alayaya,3 though the whore is not mentioned. Ser Osmund follows and tells a lie of how Joffrey confided to him on the day he was raised to the Kingsguard that Tyrion meant to kill him and rule in his place. Tyrion lashes out at this, and Tywin threatens to chain him like a common brigand if he does not stay silent. The trial ends for the day. That night, Tyrion asks Ser Kevan to bring Varys, hoping the eunuch will speak for him.
The next day, Maester Ballabar and Maester Frenken open the testimony by recounting how they opened Joffrey's throat and found nothing obstructing the airway. Grand Maester Pycelle follows. Pycelle shows the assembled various poisons Tyrion took from his room while he was imprisoned. Tyrion points out that none of those could have done the deed, and Pycelle says it was the strangler and that Tyrion must have used it all. Tyrion gives another outburst, and Tywin threatens to gag him if he speaks again. A progression of witnesses follow, including, Lord Paxter, Lord Ardrian, Ser Flement, Lord Gyles, Ser Hobber, Lord Philip, Lady Taena, Lord Estermont, Josmyn Peckledon, Galyeon, Morros, and Jothos, who all testify to various acts at the wedding feast itself.
That night when Kevan comes, Tyrion realizes that his manner has changed because he now believes Tyrion guilty. Tyrion asks after Sansa and Varys, but the former has not been found and the latter is to testify against him the next day. Ser Kevan urges him to confess and says that Tywin will let him take the black if he does. Tyrion is disdainful and distrustful of the offer, but Ser Keven gives an impassioned plea for Tyrion to trust Tywin. He knows Tywin is a hard man, but claims there were good reasons for it. Tywin's own father, Lord Tytos, was amiable and week. His bannermen mocked him and openly defied him, while debts to the house went unpaid. His mistress even stole his wife's jewels. Tywin restored House Lannister to its proper place and became Hand of the King at age twenty. He gave the realm twenty years of peace and plenty as Hand, but the only thanks he received were numerous slights to his honor from an envious Aerys II. Tyrion realizes that Ser Kevan loves Tywin greatly and promises to think over the offer.
Varys testifies the whole next day, confirming most of the previous testimony with documents. At the end of the day, Cersei says she will call one final witness on the morrow.4 That night, Tyrion receives a surprise visit from Prince Oberyn. Oberyn tells him that Cersei has hinted at marriage if he will condemn Tyrion. He has no desire to wed Cersei. He is pleased Tyrion stands accused of the crime; otherwise it might have been him. He knows poisons, has reason to keep House Tyrell away from the throne, and Myrcella, who as the next-eldest child would inherit by Dornish law, is betrothed to his nephew. Oberyn turns the talk to justice. He believes that Tyrion is innocent and wants a chance to avenge Elia both by killing Ser Gregor and Tywin. He says he will serve as Tyrion's champion in a trial by combat.","Jaime peruses the White Book as he waits for the rest of the Kingsguard to arrive. He feels a stranger to his own family now and thinks himself unworthy to follow such distinguished Lord Commanders as Barristan the Bold, Ser Gerold Hightower, Prince Aemon the Dragonknight, Ser Ryam Redwyne, the Demon of Darry, Ser Duncan the Tall, and Alyn Connington, the Pale Griffin. He reads the bio of Ser Barristan. The firstborn son of Ser Lyonel Selmy, Barristan squired for Ser Manfred Swann and was named ""the Bold"" in his tenth year when he competed as a mystery knight at Blackhaven and was unmasked by Prince Duncan Targaryen. Knighted by Aegon V Targaryen in his sixteenth year after entering another tournament and unhorsing both Prince Duncan and Ser Duncan the Tall, he slew the last Blackfyre pretender, Maelys the Monstrous in single combat during the War of the Ninepenny Kings. Named to the Kingsguard at twenty-three, he rode against the Kingswood Brotherhood, rescuing Lady Jeyne Swann and her septa from the outlaws and slaying Ser Simon Toyne; rescued King Aerys II Targaryen during the Defiance of Duskendale despite taking an arrow wound to the chest while avenging the death of fellow Kingsguard Ser Gwayne Gaunt, and led the assault on Old Wyk during Greyjoy's Rebellion. Jaime also looks at his own, much smaller, entry, which states, among other things, that he rode against the Kingswood Brotherhood as squire to Lord Sumner Crakehall when he was fifteen and was knighted by Ser Arthur Dayne for valor in the field. He recalls that he saved Lord Summer's life that day when Big Belly Ben was about to bash his head in and also stood toe-to-toe with the Smiling Knight, though it was Ser Arthur that killed him. Ever the gallant knight, Ser Arthur had allowed the Smiling Knight to fetch a new sword at one point because his was so full of notches.
When the rest of the Kingsguard finally arrive, Ser Boros and Ser Meryn take seats to his right, while Ser Osmund, Ser Balon, and Ser Loras sit to his left. Jaime berates them for letting Joffrey die and asks them if Tyrion killed him. Ser Meryn and Ser Boros are sure he did, while Ser Balon is not so sure and Ser Loras thinks it was Sansa. Jaime tells the assembled that Tommen will be king and that he intends to make sure the boy lives to a ripe old age. Jaime assigns Ser Boros to taste Tommen's food henceforth and insults the man when he balks. Ser Boros finally relents when Jaime challenges him to a sword fight, before leaving in disgust. Jaime is glad Boros did not take him up on the offer, as in his state Boros could have won easily. He next turns to Osmund to learn more about the man and is disquieted to learn he is merely a sellsword who fought with a company called the Gallant Men in the Stepstones and Disputed Lands. He may not even be a knight, as his story of being knighted on the battlefield by a Ser Robert Stone appears dubious. Jaime dismisses him and focuses on Ser Meryn. He chastises the knight for beating Sansa at Joffrey's order and tells him that from now on he will obey only Tywin, Cersei, and Jaime; part of protecting the king is protecting him from himself. After dismissing Meryn he turns to Balon. He welcomes Balon, but worries that his brother, Ser Donnel, fought for Renly and Stannis, while his father1 did not call his banners and remained at his seat at Stonehelm. Ser Balon explains that his father is past forty and done with fighting, while his brother was captured by Ser Elwood Harte at the Blackwater and swore fealty to the crown with all the others. Though Ser Donnel is Tommen's man now, however, Jaime wonders what Balon will do if that changes. Balon assures Jaime he will do his duty.
Finally, Jaime turns to Loras. As they begin to banter, Jaime realizes that Loras is just like him at that age. He asks Loras who wore Renly's armor in the fight against Stannis2 and learns it was Ser Garlan at Lord Petyr's suggestion. He asks after Renly's remains next, and learns that Loras buried the man himself in a secret place. Finally, he turns the conversation to Brienne. Loras still thinks she is guilty but has his doubts. Renly's gorget was cut through, which no man could have done. Furthermore, it made no sense to armor him and only then slit his throat. Jaime tells him to question Brienne. If he is still convinced she did it, Jaime will punish her for it; otherwise, Loras must let her go free.","Lothor helps Sansa up to the forecastle of the Merling King. The crossing has been rough and full of storms, and Sansa has spent most of the voyage below decks sick. Lord Petyr joins her as she looks out at a lonely tower on a desolate stretch of the Fingers. Petyr tells her it is his keep and that they are going ashore. Sansa thought they were going to Winterfell, but Petyr says it is sacked and burned and her new home is with him. The nameless keep does not look inviting to Sansa at all, but Petyr assures her they will only stay a fortnight, until Lysa arrives. Petyr and Lysa are to marry.
Lothor and Oswell row Sansa and Petyr ashore. Petyr's household, such as it is greets, them. They are Grisel, his housekeeper and former wetnurse, Umfred, his steward, Bryen, his captain of the guard, and Kella, who tends the sheep flock. They go to the hall for food. Hanging in the hall is the shield of Petyr's grandfather, whose own father was a Braavosi who came to Westeros as a sellsword for House Corbray. When Petyr's grandfather was knighted, he took the head of the Titan of Braavos as his sigil. When they are alone, Petyr tells Sansa she must take an assumed identity because Varys has spies everywhere and it is not safe to be Sansa Stark. She will be Lord Petyr's bastard daughter and go by the name Alayne, which was the name of Petyr's mother. Her cover story will be that her mother was the daughter of a merchant prince of Braavos that Petyr met in Gulltown when he was in charge of the port and died giving birth to her. She was then entrusted to the Faith, but decided at her flowering that she did not want to be a septa and therefore wrote to Petyr, who did not know she existed before that.
