Stannis asks why Davos wanted to kill Melisandre, and Davos explains how he believes she sent the fire that killed his sons. Stannis states he has wronged her and that she has always been his most faithful servant. Conversation turns to Edric. Stannis mentions that Melisandre told him that a king's blood has power. Stannis turns next to Westeros and says that Davos is right about Ser Axell's plan. He means to bring justice, and a raid on Claw Isle would only be revenge. He orders Davos to kneel, and names him Lord of the Rainwood, Admiral of the Narrow Sea, and Hand of the King. Davos is shocked and tries to refuse the honor, arguing that he cannot even read nor write. Stannis counters that of his great lords Ardrian has abandoned him, the new Lord Sunglass has fled to Volantis, and Duram Bar Emmon and Monterys Velaryon are only children. He does have a few good men left, including Ser Gilbert Farring who holds Storm's End with two hundred men, Lord Lester Morrigen, Rolland Storm the bastard of Nightsong, Lord Lucos Chyttering, and Ser Andrew Estermont, but Stannis trusts none of them like Davos and wants his council for the coming battle. Davos says they cannot win another battle with the Lannisters, but Melisandre enters and tells him it is the final battle against the Great Other that Stannis speaks of. Stannis tells Davos that he has seen it in the flames. Melisandre showed him a hill in a forest surrounded by a ring of torches with men in black moving on top of it and shapes coming towards them in the cold.4 Melisandre says the battle has begun. She has brought leeches with her on a silver platter. She says they will work, but they will also fail. She urges Stannis to give her Edric, as only royal blood can wake the stone dragon. Stannis refuses. Melisandre lifts the lid on the platter, revealing three leeches gorged on Edric's blood. Stannis throws each into a brazier one by one, saying the name of each usurper to the throne before tossing them in: Joffrey, Balon, and Robb.","Jaime comes to the bathhouse to bathe, as Lord Roose has invited him to dinner. Brienne is there as well. They verbally spar awhile, until Jaime apologizes and says he is sick of fighting; he wants a truce. Brienne counters that truces are based on trust. Jaime does not know why he does it; probably due to his injuries, but he tells the full story of the death of Aerys.
Lord Jon was exiled after losing the Battle of the Bells and replaced as Hand by Lord Qarlton Chelsted. Aerys finally realized that Robert was a serious threat. He reminded Prince Lewyn that he held Elia and sent him south to take command of ten thousand Dornishmen heading north. Ser Jon and Ser Barristan were sent to Stoney Sept to take command of the remnants of the army there. Prince Rhaegar returned from the south and told Aerys to summon Lord Tywin, but the ravens to Casterly Rock went unanswered. Aerys saw traitors everywhere, and Varys was always ready to point out any he missed. In his fear, Aerys commanded three leading alchemists, Rossart, Belis, and Garigus, to place caches of wildfire all over King's Landing. Lord Qarlton figured out what was happening and tried to dissuade Aerys through reason, jest, threats, and outright begging. When he failed, he threw down his chain of office, so Aerys had him burned alive and made Rossart, his favorite pyromancer and the one who roasted Lord Rickard alive, his new Hand. Jaime saw everything because he was the only member of the Kingsguard left in the city,1 for he was Tywin's son, and Aerys did not trust him to be away from his side. After Rhaegar's defeat at the Trident, Aerys sent Rhaella and Viserys to Dragonstone. Elia would have gone as well, but Aerys believed that Prince Lewyn must have betrayed Rhaegar and thought that the only hope of keeping Dorne loyal was to keep her and her children close to him. Aerys planned to burn the whole city with wildfire rather than let Robert have it. When Lord Tywin reached King's Landing, Pycelle convinced Aerys he was there to help, and Aerys opened the gates. When Tywin began to sack the city, Jaime was charged with holding the Red Keep, but knew that all was lost. He sent a messenger to ask for permission to make terms, but Aerys responded that he should bring him Tywin's head if he is not a traitor. The messenger also said that Rossart was present, and Jaime knew what he had to do. He slew Rossart, then Aerys. In the following days, he tracked down Belis and Garigus and killed them as well. Brienne asks why he never told that to anyone, and he says that the Kingsguard are sworn to keep the king's secrets, and Eddard would not have been interested in explanations anyway.
Jaime tries to get out of the bath, but gets dizzy and smashes his stump against the side of the tub. Brienne catches him before he can fall and has the guards fetch Qyburn. Qyburn tends to him, and then Brienne finishes cleaning him. Qyburn returns with clothes for both of them and a potion to strengthen Jaime. A half-hour later, Jaime is strong enough to stand, and supported by Brienne, he goes to dinner. Lord Roose waits in the center of the great hall, with only Elmar attending him. Roose explains the situation to them. He reports on Robb's marriage and Edmure's impending marriage. He also reports that Arya has been found, and he means to see her safely back north.2 Brienne continues to speak of her mission to see Jaime exchanged for Arya and Sansa, but Roose does not seem to care. He does, however, plan to send Jaime on to King's Landing, but he has a small problem. Vargo took Jaime's hand for a reason. Vargo knows that he is a doomed man now and wants to turn Jaime over to the Karstarks so he may wed Alys and gain sanctuary in the North. He did not have the strength to see him there by himself, however, and therefore had to bring him to Harrenhal. He took the hand so that Lord Roose would be implicated in the act and could not send him back to Tywin. Jaime promises to speak of how Lord Roose saved him, and the matter is settled. Roose then turns to Brienne and says it would be unconscionable to deprive Vargo of both his prizes. His guards take her away.","Tyrion awaits the arrival of Prince Doran's entourage. With him are Ser Addam and an escort of goldcloaks and a contingent from the court. Tyrion is not happy by the number of banners he sees. He turns to Bronn and asks how many there are, and Bronn answers there are nine. He then calls Podrick up to tell who the banners belong to; he has been studying Dornish heraldry at Tyrion's command. They are waving too much, so Bronn describes each in turn and Podrick identifies the house. They belong to Martell of Sunspear (red sun on orange with a spear through its back), Dalt of Lemonwood (purple field strewn with lemons), Blackmont of Blackmont (a vulture with a baby in its talons on a yellow field), Manwoody of Kingsgrave (a crowned skull on black), Qorgyle of Sandstone (three black scorpions on a red field), Uller of Hellholt (red and yellow separated by a jagged line), Allyrion of Godsgrace (a pie of red and black slices with a gold hand in the middle), Gargalen of Salt Shore (a cockatrice eating a snake), and Jordayne of the Tor (a golden quill on green checks). Tyrion is even more disquieted that these represent most of the greatest houses of Dorne. Podrick points out there is no litter; Prince Doran has gout and always travels in one. As they get closer, Tyrion spies their leader and knows who he is dealing with.
As the two groups meet, he greets them and feigns confusion as to which one is Doran. The leader says Doran's health requires he remain at Sunspear, and Tyrion greets Prince Oberyn Martell. Oberyn introduces his companions: Ser Dezial Dalt, Lord Tremond Gargalen, Lord Harmen Uller, his brother Ser Ulwyck, Ser Ryon Allyrion, his son Ser Daemon Sand, the Bastard of Godsgrace, Lord Dagos Manwoody, his brother Ser Myles, his sons Mors and Dickon, Ser Arron Qorgyle, Myria Jordayne, heir to the Tor, Lady Larra Blackmont, her daughter Jynessa, her son Perros, and Ellaria Sand, his own paramour. Tyrion introduces his own companions: Ser Flement, Lord Gyles, Ser Addam, Jalabhar Xho, Ser Harys, Ser Merlon Crakehall, Lord Philip, Bronn, and Podrick. He only knows Oberyn by reputation, but that reputation is truly formidable. When he was sixteen, Oberyn was found in bed with the paramour of Lord Edgar Yronwood, resulting in a duel between Oberyn and the older and much larger lord. Because of the Prince's youth and high birth, the duel was only to first blood and ended after both combatants took cuts. Lord Yronwood's wounds festered and killed him, however, and Oberyn has been known as the Red Viper ever since due to rumors that he fought the duel with a poisoned blade. He travelled extensively in the Free Cities, where he learned much about poisons and perhaps even darker arts. He studied at the Citadel, forging six links of a maester's chain before growing bored and later served as a soldier in the Disputed Lands, first as a member of the Second Sons and later as the captain of his own company. He has reputedly bedded men and women all over Dorne and fathered a large number of bastard daughters known as the sand snakes. He also crippled Willas Tyrell, heir to Highgarden, in a tournament. Tyrion realizes that the enmity between Oberyn and the Tyrells could lead to disaster at the wedding.
Oberyn and Tyrion talk as they ride. Oberyn speaks of the time they met years ago, right after Tyrion was born, when he visited the rock with his mother, her consort, and his sister Elia. Lady Joanna had died giving birth to Tyrion, and the castle was in mourning. It was said in those days that Lord Tywin, still Hand of the King at the time, ruled the Seven Kingdoms, but Lady Joanna ruled Tywin. Tyrion's uncles had often commented that her death greatly changed Tywin and that the best part of him died with her. Lord Tywin ignored his guests, but Cersei and Jaime had taken Oberyn and Elia to see him when they were at Casterly Rock discussing potential marriages. Cersei twisted his cock and made him scream until Jaime made her stop. Next they talk of whores and taxes. Tyrion, at his father's behest, has instituted a penny tax on whoring to help pay for the wedding. Oberyn quips that he should keep pennies around, as he and Ellaria want to have some fun with a blonde or two. Next Oberyn asks when the justice will be served. Tyrion says that there has not been time for inquiries, but Oberyn says that he already knows that Gregor is responsible. He means to kill the Mountain and find out who gave him his orders. Tyrion says his three hundred are no match for the thousands in the city, but Oberyn is not intimidated. Tyrion threatens him again and rides past him.","The Brotherhood ambushes a group of Brave Companions just before dawn. Anguy takes out a sentry on a roof, while Kyle and Notch take out two guards in front of a sept. One of the sentries screams when the torch he is carrying lights his clothes on fire, and the rest of the Brotherhood charges at Thoros's command. Arya and Gendry are watching from a nearby hill, guarded by Beardless Dick and Mudge. Flaming arrows set the sept alight, and soon the Companions start pouring out and the battle begins in earnest. Watty takes a wound and Kyle goes down before Lord Beric gives the signal and the rest of his men, including Lem and Edric, leave their hiding places and charge into the fray. Soon, it is all over; all the Companions are dead or prisoners save for two Dothraki that Lord Beric lets escape to carry word back to Harrenhal. Jack-Be-Lucky, Harwin, and Merrit enter the burning sept to search for captives and come out with eight brown brothers and a septon. The septon is Utt, the leader of this group of Brave Companions. After a brief trial, Utt and the other prisoners are all hanged one by one, with Tom playing a dirge through the proceedings. Arya wishes they had hung Sandor too, but they had treated his wounds, returned his sword, and let him go.
That night, they stay at the brewery, one of the few standing buildings left at this monastery that once held forty-four brothers. Lord Beric catches Arya looking at him and beckons her closer. She says she thought Sandor had killed him, and Lem speaks up to say it was a grievous wound, but Thoros is a gifted healer. Beric sends Lem away and says that even brave men blind themselves from truths they do not want to see. He asks Thoros how many times he has been brought back by the Lord of Light, and Thoros answers six, though each time is harder than the last, and Thoros does not think he can do it many more times. Gregor has killed him three times, including with a dirk in the eye, Ser Burton smashed his skull, and Ser Amory hanged him. He no longer remembers where his castle is located, to whom he is betrothed,1 who knighted him, his favorite foods, or many other basic things. The first time he came back to life, Thoros was giving him his last rights according to the faith of the Lord of Light and giving him the last kiss, breathing fire down his throat. It is a standard ritual, but never before has it brought a man back from the dead. The Lord of Light is not done with him.
Later, Gendry approaches Beric and says he would like to smith for the Brotherhood. Lord Beric reluctantly agrees after warning him of the dangers and knights him. Sandor appears and mocks the proceedings. Beric asks how he found them and got past the sentries, and Sandor says that there was enough smoke to track them from a long way off, and he may have killed the sentries. He has come for his gold, which Beric refuses to give back. He finally leaves. Harwin leaves to check on the sentries, while Beric orders Anguy to kill Sandor's horse if he follows the next day. Some of the men want to kill him, but Beric will not allow it, and Thoros points out that Sandor won his trial by combat when the Lord of Light snapped Beric's sword. The Lord of Light is not done with him yet either. Harwin comes back and reports that the sentry, Puddingfoot, is asleep but unharmed. The next morning, Likely Luke and Watty scout the area but find no sign of Sandor. The outlaws get underway.","Bran, Hodor, Meera, Jojen, and Summer approach an old, abandoned village on a lake with a tower on an island in the center. Summer spies three deer and takes off after them. They are out of the mountains, and the terrain consists of grasslands, fields, low rolling hills, and bogs all the way to the Wall. Jojen says they should stay there for the night as a storm is coming. No buildings are still intact save the tower, which appears unreachable. Bran says there is a hidden causeway to the tower. He recognizes the place as Queenscrown, where Queen Alysanne stayed on her visit north. She rode her dragon Silverwing to the Wall and was so impressed by the Night's Watch that she convinced her husband, Jaehaerys I, to double the size of the Gift, that land adjacent to the Wall controlled by the Night's Watch. The top of the tower is painted gold to honor the event. They find the causeway and make their way to the island. They get through the front door of the tower, but iron bars block access to the rest of the structure. Bran pulls down an iron grate over a murder hole, and they are able to climb through to the upper levels. Once they are settled, Bran asks Jojen how he means to get through the Wall. He says he means to go to one of the abandoned castle and try to find an opening. They see a lone rider heading towards the village and take cover in the tower as the first drops of rain begin to fall. Soon it is pouring, and thundering beside. Hodor gets scared and starts screaming. During one flash of lightning, Jojen spies men down below entering the village. Hodor will not stop screaming, and Bran reaches for him as he does for Summer and actually takes control of him for a second, frightening himself, but silencing Hodor. He then opens his third eye and becomes Summer, who is scouting the men warily in the rain. He can smell their fear.","Jon and Ygritte look out at a towerhouse in the distance. Ygritte is incredulous that men can build such structures. They begin to talk about differences in their cultures. Ygritte is disdainful of kings and those who kneel to them, and boldly states that Mance will teach them a lesson. Jon tells Ygritte that Mance has no chance of winning and that all the wildlings will die. Ygritte refuses to believe it and angrily reminds Jon he is one of them now too and kisses him fiercely. Jon kisses back, but sadly laments that she is a wildling to the core. He has been waiting for a chance to escape, but Styr still does not trust him and has him watched day and night. Every day, Styr summons him before himself, Grigg, and Errok to quiz him about Castle Black. He lies where he can, but realizes the truth is bleak. Only four hundred men remain at Castle Black, most of them stewards and builders. If Styr achieves surprise, which is likely under the circumstances, it will be a massacre. Everyday, it also becomes harder to think of betrayal. Despite his best efforts, he is beginning to become friends with some of the raiders, including Errok, Grigg, Quort, Bodger, Hempen Dan, Del, Henk the Helm, Toefinger, Big Boil, and Stone Thumbs. They travel until around sunset, when Lenn says a bad storm is on the way. Grigg tells Styr that there is a town within two or three miles, and he agrees to shelter there.
By the time they arrive, it is past dark and the storm is raging. Del reports that there was an old man staying in the ruined inn. Jon walks off to find a dry spot. Ygritte finds him later, and he tells her the village is Queenscrown. One of the Thenns comes and summons him to Styr; Ygritte comes too. Styr wants him to kill the old man that was captured. Jon cannot bring himself to do it despite Ygritte's urgings to prove himself. Styr mocks them as a crow and his wife, and Ygritte angrily stalks forward and slits the man's throat. Just then, Summer charges into their midst, quickly killing a Thenn and Del. Jon realizes he will never get a better chance and takes the old man's horse. Bodger tries to stop him, but Jon kills him. After that, he is able to break away. Hours later, he stops and realizes there is an arrow in his leg. With great effort, he pulls it out, washes the wound, and bandages it as best he can. He then turns north for Castle Black.","Daenerys, riding Silver, and Ser Jorah mount a ridge and look down upon the Yunkish army in their path. There are five thousand men. The Yunkish hold the center themselves while the flanks are held by two sellsword companies, the Second Sons and the Stormcrows, with about five hundred men each. Ser Jorah says they can defeat the army easily, but Daenerys is worried about the cost, as replacements for her army may be hard to come by. She orders him to extend an invitation to the slavers and the leaders of the sellsword companies to meet with her separately. She returns to camp, where the Unsullied are busy fortifying, and speaks to Grey Worm. He is the leader of the Unsullied, chosen by the acclamation of his peers when Daenerys told them to nominate officers. Ser Jorah is training him for command. Daenerys let the Unsullied choose their own names after freeing them, and many of them went back to their old names from before they were cut, but Grey Worm chose to keep the name he bore on the day Daenerys freed him because he considers it lucky. Daenerys rides on to her tent. Beyond the orderly camp of the Unsullied is a disorganized camp of tens of thousands, refugees from Astapor. Daenerys left the city in the charge of a council of former slaves led by a healer, a scholar, and a priest, but many of the slaves were afraid to stay and now follow her. They are weak and ill-trained and strip the country bare on the march, but Daenerys does not have the heart to abandon them.
Belwas and Arstan are waiting at her tent; they are guarding her on the march since she needs Aggo, Jhogo, and Rakharo to lead her few Dothraki outriders. Rhaegal, Viserion, Drogon, Irri, Jhiqui, and Missandei are inside. Missandei tells her that the slave masters of Yunkai call themselves the Wise Masters and will speak a dialect of Valyrian. An hour later, Ser Jorah returns with the captains of the Stormcrows. There are three of them who claim equal rank. They are Prendahl na Ghezn, Sallor the Bald, and Daario Naharis. Arstan, Belwas, and Grey Worm are with Daenerys in addition to Ser Jorah. She tries to get them to change sides, but they refuse and leave, though Daario gives her a polite nod on his way out. Two hours later, the commander of the Second Sons, Mero, the Titan's Bastard, arrives. He is interested in having sex with Daenerys, but not with changing sides or leaving the conflict. He does ask for some wine, and Daenerys allows him an entire wagonful, wine being at a surplus after the looting of the slave masters' stock in Astapor. The Yunkish envoys arrive at sunset, fifty men led by Grazdan mo Eraz. He comes with two chests bearing fifty thousand marks and promise of safe passage if she will leave Yunkai alone. Daenerys counters that she will give the Wise Masters of Yunkai three days to release all their slaves, at which point her Unsullied will inspect the city and depart if all the slaves have been released. Grazdan says the offer is insane, and Daenerys signals her dragons to breathe fire, singing Grazdan's clothes. She tells him to leave and summons Aggo, Jhogo, and Rakharo. She tells the assembled that they will attack an hour past midnight. The Unsullied will attack the flanks while the Dothraki charge the center in wedge formation. It takes an hour to hammer out the details, after which she retires.
Near midnight, Ser Jorah comes with Daario in tow. He comes to offer the Stormcrows to her cause and brings the heads of Prendahl and Sallor as proof of his sincerity. Daenerys accepts his oath of fealty and orders him to return to his camp and take the Yunkish host in the rear when the attack begins. He agrees and leaves. Ser Jorah says it was a mistake to trust him, and Daenerys becomes angry. She tells him she is sick of him trying to push every man away and make himself indispensable. She cherishes and trusts him, but will never love him. Ser Jorah departs stiffly. Daenerys is not able to sleep as the battle begins and summons Arstan to tell her more of Rhaegar. He tells her that he was proficient with the lance, but never enjoyed battle and rarely entered the lists. He preferred his harp, but there was always a sense of doom around him, perhaps owing to the circumstances of his birth. He was ""born in grief"" at Summerhall.1 He would often go there alone, without even the Kingsguard, and sleep in the ruined hall, always returning with a song. Daenerys hears horses, and Ser Jorah enters to announce victory. The Stormcrows turned, the slaves broke, and the Second Sons were too drunk to fight. Two hundred were killed and several thousand captured to only about a dozen losses. Grazdan had already left to deliver her terms to Yunkai, and Mero fled and has not been found. Daenerys orders all who yield to her spared and for the Second Sons to remain in existence if enough come over to her. The next day, she marches her army to Yunkai and waits. On the third day, the gates open and freed slaves begin pouring out. She has Missandei tell them to whom they owe their freedom as they walk by, and they begin to shout ""mother"" in many different languages. Soon she is being swarmed by freed slaves. She spurs Silver forward and rides among them as they touch her and call out to her.","Arya sees a hill in the distance and realizes they have returned to High Heart. They make camp on the hill. Arya, Gendry, and Edric watch as Thoros gazes into the fire. Edric says he sees things in the flames sometimes, but he sees nothing that day. Gendry states that his master, Tobho Mott, used to say Thoros was a sot and a fraud, and Thoros agrees that was once true. He was the youngest of eight, so he was packed off to the temple. He never took to the profession, often raiding the kitchens and sleeping with women. He was good with languages and occasionally saw things in the flames, however, so he was kept around. He was finally sent to Westeros because he was such a hassle and it was hoped Aerys II, with his love of fire, could be converted. Aerys never took to him, but Robert did from the moment he used a flaming sword in his first tournament melee and Ser Kevan Lannister's horse reared and threw him. Beric comes over and says that fire consumes until nothing is left, and that six times were too many.
Notch, Anguy, and Merrit take the watch. Late in the night, Arya sees the Ghost of High Heart enter the camp and seat herself next to Beric, Lem, and Tom. She tells them of the latest news. Balon Greyjoy is dead, and his men are fighting among themselves; Lord Hoster is dead too. She has also had more dreams. She dreamed of the goat sitting alone and fevered in the hall of kings as the great dog descends on him,1 a wolf howling in grief in the rain, a clangor of horns and drums and the sad sound of a little bell,2 a maid at a feast with purple serpents in her hair,3 and the same maid slaying a giant in a castle built of snow.4 She senses Arya and tells her to come closer. She says Arya is a blood child and smells of death. She bids Arya to leave, as she gorged on grief at Summerhall. Beric tells her they are taking Arya to her mother at Riverrun, and she tells them that Ser Brynden holds Riverrun, and Catelyn has gone to the Twins for the wedding.
