"Chett, Lark, and Small Paul are out hunting with the dogs, which refuse to track a bear whose paw print they have discovered.1 The discussion turns to a planned desertion that night. They plan to kill Lord Commander Mormont and Blane, Grubbs and Aethan because they are on watch, Dywen and Bannen because they are the best trackers, and Sam because he controls the ravens. They are striking now because three days past Thoren's patrol, consisting of Kedge Whiteye, Bannen, Goady, and Tumberjon, returned with word that the wildlings are moving down the Milkwater, twenty or thirty thousand of them. Harma Dogshead has the van with five hundred horse. Sweet Donnel Hill, Ser Mallador's squire, told Chett that Thoren wants to attack the wildlings since they are burdened with women and children and not expecting resistance. Ser Mallador agrees, and they are trying to convince Lord Commander Mormont, while Ser Ottyn counsels retreat. Lord Commander Mormont is waiting for Jarmen's and Qhorin's patrols to return before making a decision, but they are both overdue. Chett has fourteen men in his conspiracy, including Lark, Small Paul, Kedge, Donnel, Dirk, Clubfoot Karl, Softfoot, and Ollo Lophand. Chett will kill Sam and scatter the ravens, Softfoot and Small Paul will kill Lord Commander Mormont, Dirk will take Blane, Lark and his cousins will do Bannen and Dywen, and Donnel and Karl will take care of the horses. Chett figures that Ser Ottyn will be given command and bid a hasty retreat for the Wall without stopping to hunt the deserters. Lark says he plans to go home after the desertion, which Chett thinks is stupid because all will know him for a deserter. Ollo means to go to Tyrosh, which Chett also considered, but he had only been a leech collector with his father back home in Hag's Mire and does not have a trade to practice in Tyrosh. He does not want to go home either and thinks that maybe he can kill Craster and take over the man's keep. He likes the idea of having Craster's wives, as the only women he had ever known were the whores of Mole's Town. In Hag's Mire, his boils had frightened the girls away, even a slut named Bessa who had lain with all the boys. He spent a day picking wildflowers for her, and when she refused and laughed at him, he killed her. He was caught near Sevenstreams, and one of Lord Walder Frey's bastards judged him guilty and sent him to the Wall.
The group returns to the Fist. Chett stops to watch Sam take archery practice at the foot of the hill. He has a bitter hatred for Sam for taking his place with Maester Aemon. Sam's first arrow misses completely. Dolorous Edd and Grenn cheer him on, but his second arrow goes wide too. After the third arrow hits and Sam is beaming, Chett tries to take him down with a cutting remark, but Edd gets the better of him. After reporting to Lord Commander Mormont, Chett makes a circuit of the camp, listening to what the men have to say. He gets dinner from Hake, while Dywen expresses worry that he can hear no animals around them. Chett joins a group that includes four of his conspirators. Both Dirk and Donnel seem at ease, but Sawwood and Maslyn are showing signs of nervousness. A call goes out for the men of the Watch to assemble at the central fire, where Lord Commander Mormont is flanked by Thoren, Ser Mallador, Ser Ottyn, and Blane. Chett takes a spot next to Brown Bernarr and waits. Lord Commander Mormont announces that the wildlings are coming, and he means to ambush them on their march. The men waver at first, but Mormont leads them in the oath of the Watch to raise their spirits. Chett notices with approval that Lark, Softfoot, and Donnel join in fervently. After the men are dismissed, it begins snowing. Chett panics, because snow will ruin all their plans. He decides to kill Sam anyway. Just as he is about to close in for the kill, a single horn blast sounds and wakes Sam up. Soon after, there is a second blast, which is followed by a third, the signal for Others approaching. Chett wets himself in fear.","Jaime revels in the first dawn he has seen in a long time as Brienne and Ser Cleos row down the Red Fork. Catelyn released him after he promised to return to King's Landing and convince Tyrion to release Sansa and Arya. He is being kept in chains, however. Jaime bandies words back and forth with Brienne, who considers him a monster. The wind shifts, and they raise the sail. Jaime has Ser Cleos shave his head, figuring that being bald with a beard will make him unrecognizable until they reach safety. Jaime watches the scenery roll by and beholds abandoned and ruined villages. They come across a group of women hanging from a tree, and Brienne insists on stopping to bury them. They are serving girls and whores that served Lannister soldiers. Just as they are beginning, Brienne spots a sail, and they hurry back to the boat. Jaime spies a Tully sail, and the chase is on. The other ship is a river galley and quickly catches up. Ser Robin is commanding. He orders them to throw their weapons over the side and prepare to be boarded. Brienne tells Ser Cleos to take the tiller and dives into the water. She climbs a cliff on the bank and sends a boulder crashing down on the galley. It splits in two, with one half taking out the sail and the other half puncturing the hull. The galley is finished. Jaime thinks that he is free of Brienne as well, but she catches up with the boat and gets back in.","Ser Desmond and Utherydes meet with Catelyn and try to decide what must be done with her. They do not want to put her in chains, but they decide she must be confined to a cell until Edmure returns. She suggests her father's chambers instead so she can comfort him in his final days, and they consent. Lord Hoster is sleeping when Catelyn arrives in his chambers. He wakes up when she speaks and calls her Tansy, not knowing who she is. Catelyn asks who Tansy is, and Hoster answers that she will have many trueborn sons.1 Maester Vyman comes in to put him back to sleep. Catelyn asks if he knows any Tansy, but he does not. That evening, he returns with a meal and word that Utherydes is quite sure that no one named Tansy has ever worked at the castle. Catelyn had noticed the arrival of a raven earlier and asks what news it brought. Maester Vyman tells her it is from Robb. He took a wound storming the Crag, but it is not serious. Catelyn puzzles on what her father said and concludes that Lysa must have lost a child before Lord Hoster made Lord Jon marry her as his price for adding his strength to Robert's Rebellion. She writes a letter to Lysa urging her to come or at least send a letter and gives it to the maester. Later that day, a commotion outside heralds Edmure's return. Two hours later, he comes to her. He informs her of Stannis's defeat and berates her for freeing Jaime. He tells her that he has sent ravens off to Lord Roose at Harrenhal telling him to be on guard and offered a thousand gold dragons for his recapture. Catelyn, lost in her grief anew tells him to leave.","Arya, Gendry, and Hot Pie travel north from Harrenhal cross country. Arya means to hit the Trident and then follow it to Riverrun. When they finally stop to rest, Arya enters Nymeria in her dreams. Nymeria and her pack ambush four Brave Companions, including Iggo, and kill them all.","Tyrion awakens when Bronn enters his room. Tyrion says he summoned him days ago and Bronn says he was there twice, but Tyrion was dead to the world. Tyrion notices the sigil on his chest, and Bronn tells him he is now Ser Bronn of the Blackwater. He gives Tyrion more details of the battle and its aftermath. When Joffrey was led back to the Red Keep, the goldcloaks began to desert. Lord Jacelyn attempted to get them back to the walls and almost succeeded until someone shot him in the neck and he was dragged from his horse and killed. Ser Addam commands the city watch now. Shagga remains in the kingswood, while Timett has returned to the mountains. Chella tried to reenter the city but was driven off. Cersei released Alayaya after whipping her. Tommen is back in the city; with Jacelyn dead, Cersei sent the Kettleblacks to fetch him back from Rosby. Osney and Osfryd have both been knighted and none of the three Kettleblacks are in Tyrion's employ any longer. Lord Randyll is marching to Duskendale to counter Robett's force. Tyrion's sellsword army is gone, those that did not die were paid and put out by Ser Kevan.
Tyrion tells Bronn that he wants to know everything about Ser Mandon and then has the sellsword help him up. He calls for Podrick and has him bring clothes. They walk to the gate, where Ser Meryn has the guard. At first, he refuses to let Tyrion pass, but Tyrion says he has business with Lord Tywin, and Ser Meryn lowers the drawbridge. Ser Osmund guards the other end of the bridge. Tyrion is so weak by this point that Bronn has to carry him up the steps of the Tower of the Hand. They pass Ser Addam on the way up. He tells Tyrion that Lord Tywin is in a foul mood because they still have not found Tyrek. When Tyrion enters Lord Tywin's solar, Lord Tywin dismisses Bronn and Podrick so they may speak alone. Tywin is cold and abrupt with Tyrion. He belittles Tyrion's part in the battle and is annoyed that Tyrion promised Prince Doran that Gregor would be brought to justice. He dismisses Tyrion, but instead of leaving, Tyrion demands that Tywin acknowledge him as his son and heir to Casterly Rock. Tywin tells Tyrion that he will never get the Rock, he who killed his mother coming into the world and continues to shame House Lannister with his whores. It was Tywin that had Alayaya beaten. The next time he finds Tyrion with a whore, he will hang her.","Davos watches on his tiny rock as a ship approaches.1 He has been on the island for days and is weak from sickness and hunger. He considers letting the ship pass and dying in peace. Finally, he decides to hail it. He is noticed and rescued.","Sansa has received a dinner invitation from the newly-arrived Margaery. She worries about what it portends, but she accepts. On the appointed night, Ser Loras arrives to escort her. He informs her that, Margaery's grandmother, Olenna, will be there as well. Ser Balon opens the gate to Maegor's Holdfast, and they pass through. In the yard, a group of men are practicing swords, including Ser Hobber, Ser Tallad, Ser Kennos of Kayce, Ser Osney, Ser Osfryd, and Lord Morros. She notes one knight training against three men. It is Ser Garlan, Loras's brother. Loras admits that his brother is better with the sword, though not with the lance. Sansa mentions the Hand's tournament and the red rose Loras gave her,1 but Loras does not even remember, though he tries to hide it. She says it was after he unhorsed Ser Robar, and Loras laments that he killed Robar at Storm's End. They arrive at the doors to the Tyrell chambers, which are guarded by Olenna's twin guards Erryk and Arryk, whom she just calls Left and Right because she can never tell them apart. Margaery greets her at the gate and bids her welcome. She takes Sansa to the dinner table and introduces her to the gathered ladies: Lady Alerie Tyrell, Megga Tyrell, Alla Tyrell, Elinor Tyrell, Lady Janna Fossoway, Leonette Tyrell, Septa Nysterica, Lady Alyce Graceford, Lady Alysanne Bulwer, Meredyth Crane, Lady Taena Merryweather, and Lady Olenna Tyrell. Olenna has some choice words to say about her son, whom she calls Lord Oaf and Lord Puff Fish, and getting mixed up with Renly before having Sansa sit next to her and summoning Butterbumps to entertain. After the first course is brought out, Olenna tells Sansa to tell her about Joffrey. Sansa is terrified and tries to dodge the question. Olenna finally has Butterbumps sing ""The Bear and the Maiden Fair"" so that no one will hear their conversation. Finally, Sansa tells Olenna and Margaery that Joffrey is a monster. Olenna says that is a pity.2 Margaery asks if Sansa would like to visit Highgarden. She says she would, but the queen will never let her go. Olenna says she will if Lord Mace asks it. Olenna means to see her wed. At first, Sansa thinks they mean Loras and is thrilled, but Olenna says she means Mace's eldest son Willas, who was crippled as a squire in his first tournament by Oberyn Martell. Sansa is less sure of that match. They finish talking as the song comes to an end.","Jon and Ghost enter the main wildling camp with Rattleshirt's party, including Ygritte, Lenyl, Ragwyle, Longspear Ryk, and Orell, trapped in his eagle. They are met at the edge of the camp by a group of outriders led by the Weeper, who tells them to take Jon to Mance. They enter his tent, where a singer is performing while two men study a map. Jon mistakes one of them for Mance, but he is actually the singer. Mance introduces himself and recognizes Jon. He introduces the others present, Styr, Magnar of Thenn, Tormund Giantsbane, Mance's wife Dalla, who is pregnant with his child, Dalla's sister Val, and Val's current lover, Jarl. Mance asks him why he is there, and Jon lies that Qhorin was just on a ranging from the Shadow Tower. Mance sends the others away to talk further. He tells Jon that he knows him because he has seen him twice. The first time was when he was in the Watch and escorted the old lord commander, Qorgyle, to Winterfell. The second time was the welcoming feast for King Robert, which he secretly attended. Mance tells Jon the story of why he left the Watch. He was wounded by a shadowcat while on a ranging and, fearing they would not reach Maester Mullin at the Shadow Tower in time, his brothers took him to be healed by a wildling woman who also patched his black cloak with red thread. When he returned to the Shadow Tower, they refused to let him wear the cloak. Jon tells him that he deserted because of the low regard he was given as a bastard. Mance accepts him.","Daenerys stands at the prow of Balerion and watches Rhaegal and Viserion chase each other across the sky. Captain Groleo joins her and laments the lack of any wind the past seven days to speed them towards Pentos. Ser Jorah joins her, followed by Arstan, who tells her a little about the Targaryen dragons of old, stating that Balerion was two hundred years old when he died during the reign of Jaehaerys I and claiming that a dragon will never stop growing as long as it has food and freedom. Daenerys asks how that can be, and Arstan responds that the dragons raised in the Dragonpit were never as large as their ancestors and that the maesters said this was because of the walls and dome that contained them.1 He goes on to speak of Aerys II and Rhaegar at Daenerys's urging. He says Aerys was often pleasant, though harsh on those he saw as enemies, and calls Rhaegar a man no one really knew, but one whom he personally saw in tournaments and playing his silver harp. A disdainful Jorah retorts that anyone from the period knows that and that Arstan will next claim he squired for the prince. Arstan says he would make no such claim, stating that Myles Mooton was Rhaegar's squire and Richard Lonmouth after him, both of which Rhaegar knighted and both of which remained his close companions. Lord Jon Connington was also a close friend, but his oldest friend was Ser Arthur Dayne. Rhaegar was a puissant warrior, good with sword and lance, but in his youth he was more bookish, with men saying Queen Rhaella must have swallowed some books and a candle while he was in the womb. The maesters were amazed by his intellect, but he had no interest in fighting, and many worried he was Baelor the Blessed come again. One day, he apparently read something in his scrolls, though no one knows what, and then presented himself to the master-at-arms, Ser Willem Darry, and asked for sword and armor, for he needed to become a warrior. Arstan halts there when he sees that Belwas has woken up and goes to attend him. Ser Jorah cautions Daenerys that Arstan may be hiding something. The wind finally picks up.
That night, Ser Jorah comes to her chambers. Daenerys shows him that she has taught her dragons to breathe fire on command by tossing a piece of meat to Drogon and saying dracarys, the Valyrian word for dragonfire. Ser Jorah wants to talk alone, and Daenerys sends Irri and Jhiqui away. Ser Jorah repeats his mistrust of Arstan, Belwas, and Illyrio and suggests that they go overland to Pentos from Slaver's Bay. Telling the captains to put ashore there will be a good test of their loyalty, and they can buy Unsullied in Astapor so that she has an army at her back when she returns to Pentos. Daenerys wonders why she would want Unsullied, and Ser Jorah tells her the tale of the three thousand of Qohor. Four hundred years ago, the Dothraki rode out of the east for the first time to pillage and burn. They were led by Khal Temmo, who commanded over fifty thousand, half of them warriors. The people of Qohor knew of the threat and responded by strengthening their walls, doubling the guard, hiring the sellsword companies the Bright Banners and the Second Sons, and, as an afterthought, hiring three thousand Unsullied from Astapor. When the Unsullied arrived, the battle was already joined and the sellswords had already fled. The next morning, the three thousand lined up before the gates, the only thing between Temmo and the city. They could have been flanked, but Dothraki are disdainful of foot soldiers, who are only fit to be run down. Eighteen times the Dothraki charged, and eighteen times they were sent reeling. Though reduced to six hundred, they killed 12,000 Dothraki, including Temmo, his bloodriders, his kos, and his sons. On the fourth day of fighting, the new khal brought his riders past the gates in a procession, and one by one they cut off their braids and laid them at the feet of the Unsullied before riding off. Jorah says they can pay using Illyrio's trade goods, which will be another good test of his dedication to her cause. Daenerys agrees that this is a good idea. She begins to dress, when Ser Jorah pulls her close and kisses her. He professes his love and says she should take him as husband and dragonrider because no one will be truer to her and her cause then him.","Bran is running through the woods inside Summer. Just as he steals a kill from a pack of wolves, Hodor wakes him up. Jojen admonishes him for becoming lost in his wolf self and not remembering to do things like mark trees so they know where Summer's kills are. Bran is sullen; he wishes that he never had to leave Summer. Meera returns with fish and frogs for dinner. Jojen says they should move on. They have been staying in an abandoned tower for several days, but Jojen is not convinced it is safe. He wants to go beyond the Wall and find the three-eyed crow. Meera finds this idea foolish since they have no idea where to look. Bran says they should sail down the White Knife to White Harbor, but he is ignored as usual. Bran asks why they need to find the crow anyway. Jojen says that Bran has opened his third eye, but he is still not in control of his gift. Winter is coming, and Bran will be needed. Meera comes around, but she tells Bran it should be his decision. He decides they should find the crow.","Davos watches from on deck as Shayala's Dance approaches Dragonstone. The sounds of the boat remind him of his youth as a smuggler and the sea watch, commanded by Ser Tristimun that was ruthlessly efficient at catching smugglers in Aerys II's day. The captain of the ship, a Lyseni named Khorane Sathmantes, has been kind to him on the voyage, giving him use of his cabin and clothes. He also spoke of the battle and how Renly's ghost led the van of Lord Tywin's army.1 Few remained loyal, mostly Florents. Lord Alester is now Hand of the King. Khorane comes up to say they have arrived and that Salladhor will want to see him. Davos says he must see Stannis, but Khorane explains that no one sees him anymore. Davos finds Salladhor on a Pentoshi trader called Bountiful Harvest. Salladhor is overjoyed to see him and orders one of his eunuchs, Meizo Mahr, to show him to the owner's cabin and get him refreshments.
Salladhor arrives soon after and explains that Lord Alester made him Lord of Blackwater Bay and gave him leave to collect duties from passing ships. He seizes those that do not pay, such as Bountiful Harvest, which is owned by Illyrio Mopatis. He tells Davos that some of Stannis's ships escaped the fire, including Lord Steffon, Ragged Jenna, Swift Sword, and Laughing Lord. They were all trapped upriver by the chain and most of them were captured or scuttled. Ragged Jenna and Laughing Lord are still on the river acting as raiders. Lady Marya and Wraith did not survive, and both Dale and Allard are dead. Devan, however, survived. Salladhor offers Davos a ship and a place in his fleet, but Davos declines. He wants to see Stannis, but Salladhor repeats that he sees no one. Queen Selyse has given Lord Alester the title of Hand and granted him use of the king's seal, and they run the realm. Stannis closets himself with Melisandre and watches the flames. Davos thinks that she sent the flames at King's Landing and sent Stannis, and his sons, to their deaths to show that she is indispensible. Davos declares his intention to kill her. Salladhor tries to dissuade him, telling him that Melisandre has been burning traitors in her fires, including Lord Guncer and Ser Hubard's sons. Davos will not be turned aside and leaves.
At the gate to Dragonstone, Davos is refused admittance. He asks if Jate Blackberry is still captain of the gate, but he is dead. He asks next after Lord Chyttering, but he died on the Blackwater. Davos names off two more guards, Hookface Will and Hal the Hog, but they are dead too. The guard finally goes to get instructions and returns to lets him in. He is escorted to a garden by Florent guardsmen and instructed to wait. Patchface and Shireen come through. Patchface stops for a second when he sees Davos and utters a strange rhyme: Fool's blood, king's blood, blood on the maiden's thigh, but chains for the guests and chains for the bridegroom, aye aye aye.""2 Edric barrels into him soon after. He asks who Davos is and says that Stannis should not have cut off his fingers when he learns he is the knight of onions. Just then, Ser Axell comes to take him to the dungeon for plotting to kill Melisandre.","Brienne, Ser Cleos, and Jaime stop at an inn by the riverside that is still standing. It is the Inn of the Kneeling Man, which purportedly stands on the exact spot where King Torrhen knelt to King Aegon. When Jaime opens the door, he is confronted by a boy with a crossbow.1 He lets them enter as long as they leave their swords at the door. A man comes up and offers food.2 He is not the innkeeper; he and his wife3 discovered the innkeeper and his women dead, buried them, and took over the place themselves. The boy is not theirs. He lost his two boys and the Brave Companions killed the boy's parents, so they took him in. He cooks them some dinner and asks for news. When he learns that they are heading downriver, he tells them they will never make it because two sunken ships are blocking the way and there are outlaws further down. Lord Beric and Thoros are still causing trouble as well. Jaime realizes that their best chance is to strike overland, and Brienne reluctantly agrees. They end up buying three horses from the man, a plow horse, an old gelding, and a war horse that he ""acquired."" He offers beds as well, and Cleos is tempted, but Brienne says they must ride on. So Jaime can ride, she strikes off his ankle chain at a smithy out back. The man tells them they will come to a burned village six miles downriver where they will come to a fork in the road. He says to avoid the south road that leads to Ser Warren's towerhouse, now in unknown hands with Ser Warren dead in the fighting, and strike south and east instead. They ride off into the night. When they reach the village, Brienne turns them south. Jaime is pleasantly surprised at her intelligence; it is clear that the man was trying to lead them straight to the outlaws.
